id,title,selftext,author,subreddit,score,num_comments,created_utc,permalink,url,topic,collection_date,text,sentiment_label,sentiment_negative,sentiment_neutral,sentiment_positive,sentiment_compound,sentiment_score,datetime,frame,frame_confidence,frame_reason
c742oe,UAE scales down troops in Yemen as Iran-Gulf tensions mount,,ZuMelon,worldnews,6,1,1561839576,/r/worldnews/comments/c742oe/uae_scales_down_troops_in_yemen_as_irangulf/,https://www.france24.com/en/20190628-united-arab-emirates-military-troops-yemen-gulf-tensions,iran,2025-12-07 13:47:13,UAE scales down troops in Yemen as Iran-Gulf tensions mount ,neutral,0.4309967756271362,0.5550182461738586,0.0139849754050374,-0.4170117974281311,-0.4170117974281311,2019-06-29 20:19:36,THREAT,0.8,게시글 제목에서 이란과 걸프 지역의 긴장이 고조되고 있다는 점을 언급하고 있어 군사적 위협의 가능성을 강조하고 있다.
c73qor,"The US, Not Iran, Is the Rogue State",,30ustice4,worldnews,1,0,1561837860,/r/worldnews/comments/c73qor/the_us_not_iran_is_the_rogue_state/,https://jacobinmag.com/2019/06/iran-war-donald-trump-sanctions-jcpoa,iran,2025-12-07 13:47:13,"The US, Not Iran, Is the Rogue State ",negative,0.7390143871307373,0.2527953386306762,0.0081902714446187,-0.7308241128921509,-0.7308241128921509,2019-06-29 19:51:00,THREAT,0.8,"게시글 제목에서 'Rogue State'라는 표현은 군사적 위협이나 불안정성을 암시하며, 이는 일반적으로 위협 프레임에 해당한다."
c73pf1,US sends F-22 fighters to Middle East amid tensions with Iran,,-Tavy-,worldnews,85,15,1561837677,/r/worldnews/comments/c73pf1/us_sends_f22_fighters_to_middle_east_amid/,https://edition.cnn.com/2019/06/28/politics/us-f-22-fighters-to-qatar-intl-hnk/index.html,iran,2025-12-07 13:47:13,US sends F-22 fighters to Middle East amid tensions with Iran ,neutral,0.131443440914154,0.8516861796379089,0.0168703589588403,-0.1145730838179588,-0.1145730838179588,2019-06-29 19:47:57,THREAT,0.9,게시글 제목에서 미국의 F-22 전투기 배치가 이란과의 긴장 상황과 관련되어 있어 군사적 위협을 강조하고 있다.
c701wi,Husband says Zaghari-Ratcliffe ends hunger strike in Iran,[deleted],[deleted],worldnews,9,0,1561821128,/r/worldnews/comments/c701wi/husband_says_zaghariratcliffe_ends_hunger_strike/,https://www.apnews.com/82e79b97e81e4031863376c188654d7e,iran,2025-12-07 13:47:13,Husband says Zaghari-Ratcliffe ends hunger strike in Iran [deleted],neutral,0.2761367559432983,0.7051361799240112,0.0187270659953355,-0.2574096918106079,-0.2574096918106079,2019-06-29 15:12:08,NEUTRAL,0.8,"게시글은 특정한 정치적 프레임을 강조하지 않고, 단순히 사건에 대한 정보를 전달하고 있다."
c6yhdw,US sends F-22 fighters to Middle East amid tensions with Iran,,MaryWannaWeed,worldnews,11,18,1561811961,/r/worldnews/comments/c6yhdw/us_sends_f22_fighters_to_middle_east_amid/,https://www.cnn.com/2019/06/28/politics/us-f-22-fighters-to-qatar-intl-hnk/index.html,iran,2025-12-07 13:47:13,US sends F-22 fighters to Middle East amid tensions with Iran ,neutral,0.131443440914154,0.8516861796379089,0.0168703589588403,-0.1145730838179588,-0.1145730838179588,2019-06-29 12:39:21,THREAT,0.9,게시글 제목에서 이란과의 긴장 상황 속에서 F-22 전투기를 중동에 배치하는 내용은 군사적 위협을 강조하고 있다.
c6y4cs,Teenage girl in Iran beaten by police after playing with water guns in park,,Admiral_Asado,worldnews,46,21,1561809503,/r/worldnews/comments/c6y4cs/teenage_girl_in_iran_beaten_by_police_after/,https://observers.france24.com/en/20190628-iran-teenage-girl-iranpolice-water-guns,iran,2025-12-07 13:47:13,Teenage girl in Iran beaten by police after playing with water guns in park ,negative,0.7311100363731384,0.2608672082424164,0.0080226762220263,-0.7230873703956604,-0.7230873703956604,2019-06-29 11:58:23,HUMANITARIAN,0.9,게시글은 이란에서 경찰에 의해 소녀가 폭행당한 사건을 다루고 있어 인권과 관련된 문제를 강조하고 있습니다.
c6y0g9,US loses allies on Iran as Europe launches system to avoid sanctions.,,Morgennes,worldnews,2833,818,1561808729,/r/worldnews/comments/c6y0g9/us_loses_allies_on_iran_as_europe_launches_system/,https://www.newsweek.com/us-loses-allies-iran-europe-launches-system-avoid-sanctions-1446601?utm_source=GoogleNewsstandWorld&utm_medium=Feed&utm_campaign=Partnerships,iran,2025-12-07 13:47:13,US loses allies on Iran as Europe launches system to avoid sanctions. ,negative,0.5858237147331238,0.4019108712673187,0.0122654307633638,-0.5735582709312439,-0.5735582709312439,2019-06-29 11:45:29,ECONOMIC,0.85,게시글은 미국의 동맹국들이 이란에 대한 제재를 피하기 위한 시스템을 도입한 내용을 다루고 있어 경제적 측면과 제재 문제를 강조하고 있습니다.
c6xhn9,Nazanin Zaghari-Ratcliffe ends Iran prison hunger strike | News,,BelleAriel,worldnews,1,0,1561804797,/r/worldnews/comments/c6xhn9/nazanin_zaghariratcliffe_ends_iran_prison_hunger/,https://www.theguardian.com/news/2019/jun/29/nazanin-zaghari-ratcliffe-ends-iran-prison-hunger-strike,iran,2025-12-07 13:47:13,Nazanin Zaghari-Ratcliffe ends Iran prison hunger strike | News ,neutral,0.2518833577632904,0.7340796589851379,0.0140369525179266,-0.2378464043140411,-0.2378464043140411,2019-06-29 10:39:57,NEUTRAL,0.8,"게시글은 나자닌 자그하리-랫클리프의 단식 종료에 대한 정보를 제공하고 있으며, 특정한 정치적 프레임을 강조하지 않고 중립적인 사실을 전달하고 있다."
c6xbx0,U.S. Air Force has deployed F-22 Raptors stealth fighters to Qatar amid Iran tensions,,ASK003,worldnews,8,8,1561803622,/r/worldnews/comments/c6xbx0/us_air_force_has_deployed_f22_raptors_stealth/,https://fighterjetsworld.com/latest-news/u-s-air-force-has-deployed-f-22-raptors-stealth-fighters-to-qatar-amid-iran-tensions/15036/,iran,2025-12-07 13:47:13,U.S. Air Force has deployed F-22 Raptors stealth fighters to Qatar amid Iran tensions ,neutral,0.0267784912139177,0.9468292593955994,0.0263922940939664,-0.0003861971199512,-0.0003861971199512,2019-06-29 10:20:22,THREAT,0.9,게시글은 미국 공군의 F-22 스텔스 전투기 배치와 이란과의 긴장 상황을 언급하고 있어 군사적 위협을 강조하고 있다.
c6wlte,"Trump talks Putin, Iran, Border controls, Climate change and more G20 pr...",,tuble89,worldnews,1,0,1561797956,/r/worldnews/comments/c6wlte/trump_talks_putin_iran_border_controls_climate/,https://www.youtube.com/attribution_link?a=oblf3D4iCIM&u=%2Fwatch%3Fv%3DRlj7R0rodrI%26feature%3Dshare,iran,2025-12-07 13:47:13,"Trump talks Putin, Iran, Border controls, Climate change and more G20 pr... ",neutral,0.1852916479110717,0.7728891968727112,0.0418191291391849,-0.1434725224971771,-0.1434725224971771,2019-06-29 08:45:56,DIPLOMACY,0.8,"게시글 제목에서 트럼프가 푸틴, 이란과의 대화 및 G20 회의에서의 다양한 주제를 언급하고 있어 협상과 대화의 가능성을 강조하고 있습니다."
c6wic0,"Trump talks Putin, Iran, Border controls, Climate change and more G20 pr...",,tim789,worldnews,1,1,1561797177,/r/worldnews/comments/c6wic0/trump_talks_putin_iran_border_controls_climate/,https://www.youtube.com/attribution_link?a=KnqLRWsENLs&u=%2Fwatch%3Fv%3DRlj7R0rodrI%26feature%3Dshare,iran,2025-12-07 13:47:13,"Trump talks Putin, Iran, Border controls, Climate change and more G20 pr... ",neutral,0.1852916479110717,0.7728891968727112,0.0418191291391849,-0.1434725224971771,-0.1434725224971771,2019-06-29 08:32:57,DIPLOMACY,0.8,"게시글 제목에서 트럼프가 푸틴, 이란과의 대화 및 G20 회의와 관련된 다양한 주제를 언급하고 있어 협상과 대화의 가능성을 강조하는 것으로 해석될 수 있습니다."
c6uats,EU mechanism for trade with Iran 'now operational',,FedRepofEurope,worldnews,11,1,1561781545,/r/worldnews/comments/c6uats/eu_mechanism_for_trade_with_iran_now_operational/,https://www.dw.com/en/eu-mechanism-for-trade-with-iran-now-operational/a-49407662,iran,2025-12-07 13:47:13,EU mechanism for trade with Iran 'now operational' ,neutral,0.008794049732387,0.9051035046577454,0.0861024558544159,0.0773084089159965,0.0773084089159965,2019-06-29 04:12:25,ECONOMIC,0.9,게시글은 EU와 이란 간의 무역 메커니즘에 대한 내용을 다루고 있어 경제적 측면을 강조하고 있습니다.
c6u5al,These Iraqi Militias Are Prepared to Fight the U.S. if It Starts a War with Iran,,trendyupdatenews,worldnews,1,0,1561780593,/r/worldnews/comments/c6u5al/these_iraqi_militias_are_prepared_to_fight_the_us/,https://trendyupdatenews.com/these-iraqi-militias-are-prepared-to-fight-the-u-s-if-it-starts-a-war-with-iran/,iran,2025-12-07 13:47:13,These Iraqi Militias Are Prepared to Fight the U.S. if It Starts a War with Iran ,negative,0.5852121114730835,0.4014978110790252,0.0132900737226009,-0.5719220638275146,-0.5719220638275146,2019-06-29 03:56:33,THREAT,0.9,게시글은 이란과의 전쟁이 시작될 경우 이라크 민병대가 미국과 싸울 준비가 되어 있다는 내용을 담고 있어 군사적 위협을 강조하고 있습니다.
c6tu0a,"Iran may stand down on nuclear threat after Europe, China work to bypass US sanctions",,hyperiony17,worldnews,108,22,1561778630,/r/worldnews/comments/c6tu0a/iran_may_stand_down_on_nuclear_threat_after/,https://abcnews.go.com/Politics/iran-stand-nuclear-threat-europe-china-work-bypass/story?id=64021813,iran,2025-12-07 13:47:13,"Iran may stand down on nuclear threat after Europe, China work to bypass US sanctions ",neutral,0.0516268946230411,0.8990809917449951,0.0492921248078346,-0.0023347698152065,-0.0023347698152065,2019-06-29 03:23:50,DIPLOMACY,0.85,게시글은 이란의 핵 위협이 유럽과 중국의 협력으로 인해 완화될 가능성을 언급하고 있어 협상과 대화의 측면을 강조하고 있다.
c6ss6o,"Europe Activates ""INSTEX"" to Trade with Iran ~ US Threatens Sanctions ~ Europe Threatens to Pull all Funds from U.S. Banks.",,jsuibck,worldnews,15,19,1561772270,/r/worldnews/comments/c6ss6o/europe_activates_instex_to_trade_with_iran_us/,https://halturnerradioshow.com/index.php/en/news-page/world/europe-activates-instex-to-trade-with-iran-us-threatens-sanctions-europe-threatens-to-pull-all-funds-from-u-s-banks,iran,2025-12-07 13:47:13,"Europe Activates ""INSTEX"" to Trade with Iran ~ US Threatens Sanctions ~ Europe Threatens to Pull all Funds from U.S. Banks. ",neutral,0.4377753436565399,0.5490358471870422,0.0131888268515467,-0.4245865046977997,-0.4245865046977997,2019-06-29 01:37:50,ECONOMIC,0.9,게시글은 유럽의 INSTEX 활성화와 미국의 제재 위협을 언급하며 경제적 측면에서의 무역과 제재를 강조하고 있습니다.
c6scud,U.S. loses allies on Iran as Europe launches system to avoid sanctions,,PepeBabinski,worldnews,66,32,1561769719,/r/worldnews/comments/c6scud/us_loses_allies_on_iran_as_europe_launches_system/,https://www.newsweek.com/us-loses-allies-iran-europe-launches-system-avoid-sanctions-1446601,iran,2025-12-07 13:47:13,U.S. loses allies on Iran as Europe launches system to avoid sanctions ,negative,0.516685962677002,0.4699589014053345,0.0133551573380827,-0.5033308267593384,-0.5033308267593384,2019-06-29 00:55:19,ECONOMIC,0.9,게시글은 미국의 제재 회피를 위한 유럽의 시스템 출범을 언급하고 있어 경제적 측면과 제재 문제를 강조하고 있습니다.
c6s7oa,Nuclear talks progress ‘not enough’ for Iran to change course,,viralnewsdrift,worldnews,1,0,1561768892,/r/worldnews/comments/c6s7oa/nuclear_talks_progress_not_enough_for_iran_to/,https://viralnewsdrift.com/nuclear-talks-progress-not-enough-for-iran-to-change-course/,iran,2025-12-07 13:47:13,Nuclear talks progress ‘not enough’ for Iran to change course ,negative,0.5414801239967346,0.4458435773849487,0.0126762669533491,-0.5288038849830627,-0.5288038849830627,2019-06-29 00:41:32,DIPLOMACY,0.8,게시글 제목에서 'nuclear talks progress'라는 표현이 협상과 대화의 진행 상황을 언급하고 있어 외교적 접근을 강조하고 있습니다.
c6s3c7,Nuclear talks progress ‘not enough’ for Iran to change course,,trendnewsworld,worldnews,1,0,1561768214,/r/worldnews/comments/c6s3c7/nuclear_talks_progress_not_enough_for_iran_to/,https://trendnewsworld.com/2019/06/29/nuclear-talks-progress-not-enough-for-iran-to-change-course/,iran,2025-12-07 13:47:13,Nuclear talks progress ‘not enough’ for Iran to change course ,negative,0.5414801239967346,0.4458435773849487,0.0126762669533491,-0.5288038849830627,-0.5288038849830627,2019-06-29 00:30:14,DIPLOMACY,0.8,게시글 제목에서 'nuclear talks progress'라는 표현이 협상과 대화의 진행을 언급하고 있어 외교적 접근을 강조하고 있다.
c6s2c1,EU mechanism for trade with Iran 'now operational',,UltraRed15,worldnews,27,10,1561768047,/r/worldnews/comments/c6s2c1/eu_mechanism_for_trade_with_iran_now_operational/,https://www.dw.com/en/eu-mechanism-for-trade-with-iran-now-operational/a-49407662,iran,2025-12-07 13:47:13,EU mechanism for trade with Iran 'now operational' ,neutral,0.008794049732387,0.9051035046577454,0.0861024558544159,0.0773084089159965,0.0773084089159965,2019-06-29 00:27:27,ECONOMIC,0.9,"게시글 제목은 EU의 이란과의 무역 메커니즘 운영에 대한 내용으로, 경제적 측면을 강조하고 있습니다."
c6nvdd,Nuclear talks progress ‘not enough’ for Iran to change course,,dailytrendshunter,worldnews,1,0,1561747086,/r/worldnews/comments/c6nvdd/nuclear_talks_progress_not_enough_for_iran_to/,https://dailytrendshunter.com/nuclear-talks-progress-not-enough-for-iran-to-change-course/,iran,2025-12-07 13:47:13,Nuclear talks progress ‘not enough’ for Iran to change course ,negative,0.5414801239967346,0.4458435773849487,0.0126762669533491,-0.5288038849830627,-0.5288038849830627,2019-06-28 18:38:06,THREAT,0.8,"게시글 제목에서 'nuclear talks'와 'change course'라는 표현이 군사적 위협과 관련된 내용을 암시하며, 이란의 핵 프로그램과 관련된 긴장감을 강조하고 있기 때문입니다."
c6nhs8,"Iran seizes 1,000 bitcoin mining machines using subsidized power",,yourSAS,worldnews,11,4,1561745270,/r/worldnews/comments/c6nhs8/iran_seizes_1000_bitcoin_mining_machines_using/,https://www.reuters.com/article/us-crypto-iran/iran-seizes-1000-bitcoin-mining-machines-using-subsidized-power-idUSKCN1TS2VL,iran,2025-12-07 13:47:13,"Iran seizes 1,000 bitcoin mining machines using subsidized power ",neutral,0.0838082879781723,0.891011118888855,0.0251806322485208,-0.0586276575922966,-0.0586276575922966,2019-06-28 18:07:50,ECONOMIC,0.9,"게시글은 이란의 비트코인 채굴 기계 압수 사건을 다루고 있으며, 이는 경제적 측면과 관련된 내용으로 보인다."
c6jno3,"G20 Summit: In Japan, Donald Trump dines with Scott Morrison before talks with world leaders on trade, Iran, North Korea - Firstpost",,AshishShrivas687,worldnews,0,0,1561725251,/r/worldnews/comments/c6jno3/g20_summit_in_japan_donald_trump_dines_with_scott/,https://www.firstpost.com/world/g20-summit-in-japan-donald-trump-dines-with-scott-morrison-before-talks-with-world-leaders-on-trade-iran-north-korea-6894841.html,iran,2025-12-07 13:47:13,"G20 Summit: In Japan, Donald Trump dines with Scott Morrison before talks with world leaders on trade, Iran, North Korea - Firstpost ",neutral,0.0113923493772745,0.931997776031494,0.056609820574522,0.0452174693346023,0.0452174693346023,2019-06-28 12:34:11,DIPLOMACY,0.8,"게시글은 G20 정상회의에서의 대화와 협상 가능성을 강조하고 있으며, 특히 북한과의 관계에 대한 논의가 포함되어 있기 때문에 외교적 프레임으로 분류됩니다."
c6jkzn,Qatar Continues to Diversifying Investment In and Around Iran,,Hiran_jayesh,worldnews,1,0,1561724781,/r/worldnews/comments/c6jkzn/qatar_continues_to_diversifying_investment_in_and/,https://www.theforeigncode.com/qatar-continues-diversifying-investment-around-iran/,iran,2025-12-07 13:47:13,Qatar Continues to Diversifying Investment In and Around Iran ,neutral,0.0223977304995059,0.9469950199127196,0.0306072812527418,0.0082095507532358,0.0082095507532358,2019-06-28 12:26:21,ECONOMIC,0.8,게시글 제목은 카타르의 이란 내외 투자 다각화에 대한 내용을 다루고 있어 경제적 측면을 강조하고 있습니다.
c6jhvp,US to sanction nations importing Iran oil,,UnstatesmanlikeChi,worldnews,8,3,1561724220,/r/worldnews/comments/c6jhvp/us_to_sanction_nations_importing_iran_oil/,https://www.9news.com.au/world/us-to-sanction-nations-importing-iran-oil/5223fa2e-79a8-4982-8c69-9117376ac641,iran,2025-12-07 13:47:13,US to sanction nations importing Iran oil ,negative,0.5098879337310791,0.4794021248817444,0.0107099190354347,-0.499178022146225,-0.499178022146225,2019-06-28 12:17:00,ECONOMIC,0.9,게시글은 이란 석유 수입 국가에 대한 제재를 언급하고 있어 경제적 측면을 강조하고 있다.
c6j83k,"Authorities in Iran have seized roughly 1,000 Bitcoin mining machines from two former factories, according to state TV reports. The action was taken following a spike in electricity consumption.",[deleted],[deleted],worldnews,1,0,1561722473,/r/worldnews/comments/c6j83k/authorities_in_iran_have_seized_roughly_1000/,https://www.bbc.com/news/technology-48799155,iran,2025-12-07 13:47:13,"Authorities in Iran have seized roughly 1,000 Bitcoin mining machines from two former factories, according to state TV reports. The action was taken following a spike in electricity consumption. [deleted]",neutral,0.3548865020275116,0.6340990662574768,0.0110144233331084,-0.3438720703125,-0.3438720703125,2019-06-28 11:47:53,NEUTRAL,0.9,"게시글은 이란 정부의 비트코인 채굴 기계 압수 사건에 대한 정보를 전달하고 있으며, 특정한 정치적 프레임이나 감정을 강조하지 않고 중립적인 사실을 보고하고 있다."
c6is6v,"Iran seizes 1,000 Bitcoin mining machines after power spike",[deleted],[deleted],worldnews,1,0,1561719371,/r/worldnews/comments/c6is6v/iran_seizes_1000_bitcoin_mining_machines_after/,https://www.bbc.co.uk/news/technology-48799155,iran,2025-12-07 13:47:13,"Iran seizes 1,000 Bitcoin mining machines after power spike [deleted]",neutral,0.4422881603240967,0.5477846264839172,0.0099272169172763,-0.4323609471321106,-0.4323609471321106,2019-06-28 10:56:11,NEUTRAL,0.8,"게시글은 이란의 비트코인 채굴 기계 압수 사건을 단순히 전달하고 있으며, 군사적 위협이나 외교적 협상, 경제적 측면, 인권 문제와 관련된 내용이 포함되어 있지 않기 때문입니다."
c6iekq,"Iran seizes 1,000 Bitcoin mining machines",,UnstatesmanlikeChi,worldnews,2,0,1561716425,/r/worldnews/comments/c6iekq/iran_seizes_1000_bitcoin_mining_machines/,https://www.bbc.co.uk/news/technology-48799155?intlink_from_url=&link_location=live-reporting-story,iran,2025-12-07 13:47:13,"Iran seizes 1,000 Bitcoin mining machines ",neutral,0.1445879638195037,0.834117591381073,0.0212943833321332,-0.1232935786247253,-0.1232935786247253,2019-06-28 10:07:05,NEUTRAL,0.9,"게시글은 이란의 비트코인 채굴 기계 압수에 대한 사실을 전달하고 있으며, 특정한 정치적 프레임이나 감정을 강조하지 않고 중립적인 정보를 제공하고 있습니다."
c6i8l9,"UAE, a key member of the Saudi-led coalition fighting in Yemen, is scaling back its military presence there as worsening U.S.-Iran tensions threaten security closer to home",[deleted],[deleted],worldnews,2,1,1561715152,/r/worldnews/comments/c6i8l9/uae_a_key_member_of_the_saudiled_coalition/,https://www.reuters.com/article/us-yemen-security-exclusive/exclusive-uae-scales-down-military-presence-in-yemen-as-gulf-tensions-flare-idUSKCN1TT14B,iran,2025-12-07 13:47:13,"UAE, a key member of the Saudi-led coalition fighting in Yemen, is scaling back its military presence there as worsening U.S.-Iran tensions threaten security closer to home [deleted]",neutral,0.4123664796352386,0.5696774125099182,0.0179561171680688,-0.3944103717803955,-0.3944103717803955,2019-06-28 09:45:52,THREAT,0.8,게시글은 미국과 이란 간의 긴장이 지역 안보에 위협이 된다고 언급하고 있어 군사적 위협을 강조하고 있습니다.
c6i3ux,WAR: Trump and iran,[deleted],[deleted],worldnews,1,0,1561714072,/r/worldnews/comments/c6i3ux/war_trump_and_iran/,http://bbcreport.info/2019/06/28/wartrump-and-iran/,iran,2025-12-07 13:47:13,WAR: Trump and iran [deleted],neutral,0.479748010635376,0.5006193518638611,0.0196326971054077,-0.4601153135299682,-0.4601153135299682,2019-06-28 09:27:52,THREAT,0.9,"게시글 제목에서 'WAR'이라는 단어가 사용되어 군사적 위협을 강조하고 있으며, 트럼프와 이란 간의 긴장 관계를 암시하고 있기 때문입니다."
c6gsmo,"Regarding Iran, in case Westerners thought iran is Saudi Arabia and they're all terrorist and women have no rights this 4 min video of Tehran should prove you brainwashed by propoganda in the west",,Daveslaine,worldnews,1,1,1561703546,/r/worldnews/comments/c6gsmo/regarding_iran_in_case_westerners_thought_iran_is/,https://youtu.be/Xlvs2An5qQY,iran,2025-12-07 13:47:13,"Regarding Iran, in case Westerners thought iran is Saudi Arabia and they're all terrorist and women have no rights this 4 min video of Tehran should prove you brainwashed by propoganda in the west ",negative,0.82258141040802,0.1694045811891555,0.0080140409991145,-0.8145673871040344,-0.8145673871040344,2019-06-28 06:32:26,HUMANITARIAN,0.8,"게시글은 이란에 대한 서구의 편견을 반박하며, 이란의 여성 권리와 관련된 문제를 언급하고 있어 인권과 관련된 프레임으로 분류할 수 있습니다."
c6gg67,Trump Wants a New Nuclear Deal With Iran. No One Else Does.,,Morgennes,worldnews,11,8,1561701085,/r/worldnews/comments/c6gg67/trump_wants_a_new_nuclear_deal_with_iran_no_one/,https://www.politico.com/story/2019/06/27/trump-iran-nuclear-deal-1385148,iran,2025-12-07 13:47:13,Trump Wants a New Nuclear Deal With Iran. No One Else Does. ,neutral,0.4271311461925506,0.5321546196937561,0.0407142341136932,-0.3864169120788574,-0.3864169120788574,2019-06-28 05:51:25,THREAT,0.8,"게시글 제목에서 'Nuclear Deal'과 'No One Else Does'라는 표현은 군사적 위협과 관련된 긴장감을 암시하며, 이란과의 핵 문제에 대한 우려를 강조하고 있다."
c6f5sf,Scott Morrison on Iran: we'll 'seriously' consider any US request to join military action,,bustead,worldnews,26,34,1561692820,/r/worldnews/comments/c6f5sf/scott_morrison_on_iran_well_seriously_consider/,https://www.theguardian.com/world/2019/jun/28/scott-morrison-on-iran-well-seriously-consider-any-us-request-to-join-military-action,iran,2025-12-07 13:47:13,Scott Morrison on Iran: we'll 'seriously' consider any US request to join military action ,neutral,0.0515943951904773,0.8992148637771606,0.0491908676922321,-0.0024035274982452,-0.0024035274982452,2019-06-28 03:33:40,THREAT,0.9,게시글은 미국의 군사 행동에 대한 참여 가능성을 언급하고 있어 군사적 위협과 관련된 내용을 강조하고 있습니다.
c6f1og,Iran seen breaking nuclear pact limit in days; Trump says 'no time pressure',,antherxee,worldnews,1,0,1561692117,/r/worldnews/comments/c6f1og/iran_seen_breaking_nuclear_pact_limit_in_days/,https://www.reuters.com/article/us-mideast-iran-usa/iran-seen-breaking-nuclear-pact-limit-in-days-trump-says-no-time-pressure-idUSKCN1TS1KP,iran,2025-12-07 13:47:13,Iran seen breaking nuclear pact limit in days; Trump says 'no time pressure' ,neutral,0.0534146353602409,0.8831191062927246,0.0634662434458732,0.0100516080856323,0.0100516080856323,2019-06-28 03:21:57,THREAT,0.85,게시글 제목에서 이란이 핵 협정의 한계를 위반할 가능성을 언급하고 있어 군사적 위협과 관련된 내용으로 해석될 수 있습니다.
c6dkl5,Iran on course to exceed nuclear pact limit within days: diplomats,,Kittykatkid,worldnews,9,85,1561683309,/r/worldnews/comments/c6dkl5/iran_on_course_to_exceed_nuclear_pact_limit/,https://www.reuters.com/article/us-mideast-iran-usa/iran-on-course-to-exceed-nuclear-pact-limit-within-days-diplomats-idUSKCN1TS1KP?il=0,iran,2025-12-07 13:47:13,Iran on course to exceed nuclear pact limit within days: diplomats ,neutral,0.0279708355665206,0.9170662760734558,0.0549629516899585,0.0269921161234378,0.0269921161234378,2019-06-28 00:55:09,THREAT,0.9,게시글은 이란이 핵 협정의 한계를 초과할 가능성을 언급하고 있어 군사적 위협과 관련된 내용을 강조하고 있습니다.
c6cwwc,"Short US-Iran war ‘an illusion’, Zarif tells Trump",,viralnewsdrift,worldnews,1,0,1561679486,/r/worldnews/comments/c6cwwc/short_usiran_war_an_illusion_zarif_tells_trump/,https://viralnewsdrift.com/short-us-iran-war-an-illusion-zarif-tells-trump/,iran,2025-12-07 13:47:13,"Short US-Iran war ‘an illusion’, Zarif tells Trump ",neutral,0.2888709008693695,0.693705141544342,0.0174239967018365,-0.2714469134807586,-0.2714469134807586,2019-06-27 23:51:26,THREAT,0.8,"게시글 제목에서 '전쟁'이라는 단어가 사용되어 군사적 위협을 암시하고 있으며, Zarif가 Trump에게 전쟁에 대한 의견을 제시하는 내용이므로 위협 프레임으로 분류할 수 있습니다."
