id,title,selftext,author,subreddit,score,num_comments,created_utc,permalink,url,topic,collection_date,text,sentiment_label,sentiment_negative,sentiment_neutral,sentiment_positive,sentiment_compound,sentiment_score,datetime,frame,frame_confidence,frame_reason
8jds8j,Iranian deal - Panel debate For & Apposing (1hour soundcloud),"I listened to the debate hosted by Intelligence Squared on the Iranian deal. The panel For the deal urges those opposing it to provide an credible alternative for the deal.  I am still processing the arguments of both sides. I am against the Nuclear deal because the moment it happened the newspapers argued that the motion will make the world unsafe as the Iranian government will retaliate. \(so you must be afraid then\)

Soon after the statement of the newspapers, we saw on the morning hours of 10th May that Iranian units fired missiles into Israel \(according to IDF reports\) and we saw the American flag being burned inside the Iranian government. This, for me, translates that if Iran can retaliate in such matters, then imagine what they can do if something goes wrong according to their narrative once they have nuclear capabilities. 

After listening to the panels, what is your feeling on the Iranian question? ",_brandwag,geopolitics,2,0,1526316335,/r/geopolitics/comments/8jds8j/iranian_deal_panel_debate_for_apposing_1hour/,https://www.reddit.com/r/geopolitics/comments/8jds8j/iranian_deal_panel_debate_for_apposing_1hour/,iran,2025-12-07 13:47:13,"Iranian deal - Panel debate For & Apposing (1hour soundcloud) I listened to the debate hosted by Intelligence Squared on the Iranian deal. The panel For the deal urges those opposing it to provide an credible alternative for the deal.  I am still processing the arguments of both sides. I am against the Nuclear deal because the moment it happened the newspapers argued that the motion will make the world unsafe as the Iranian government will retaliate. \(so you must be afraid then\)

Soon after the statement of the newspapers, we saw on the morning hours of 10th May that Iranian units fired missiles into Israel \(according to IDF reports\) and we saw the American flag being burned inside the Iranian government. This, for me, translates that if Iran can retaliate in such matters, then imagine what they can do if something goes wrong according to their narrative once they have nuclear capabilities. 

After listening to the panels, what is your feeling on the Iranian question? ",neutral,0.2981027960777282,0.6800738573074341,0.0218233857303857,-0.2762794196605682,-0.2762794196605682,2018-05-14 16:45:35,THREAT,0.85,"게시글은 이란 핵 거래에 대한 반대 의견을 제시하며, 이란 정부의 보복 가능성을 언급하여 세계의 안전에 대한 우려를 강조하고 있습니다."
8gfb9n,The Israeli-Iranian Axis: The Arab View,,Pilast,geopolitics,1,1,1525242439,/r/geopolitics/comments/8gfb9n/the_israeliiranian_axis_the_arab_view/,http://souciant.com/2018/05/the-israeli-iranian-axis/,iran,2025-12-07 13:47:13,The Israeli-Iranian Axis: The Arab View ,neutral,0.1379205882549286,0.8363149762153625,0.0257644467055797,-0.1121561378240585,-0.1121561378240585,2018-05-02 06:27:19,THREAT,0.8,"게시글 제목에서 'Axis'라는 용어는 군사적 동맹이나 위협을 암시하며, 이란과 이스라엘 간의 긴장 관계를 강조할 가능성이 높기 때문입니다."
8gcfdx,What are the global geopolitical and economic implications of an (attempted) Iranian ballistic missile on Israeli soil (Tel Aviv or Haifa)?,[deleted],[deleted],geopolitics,1,0,1525213009,/r/geopolitics/comments/8gcfdx/what_are_the_global_geopolitical_and_economic/,https://www.reddit.com/r/geopolitics/comments/8gcfdx/what_are_the_global_geopolitical_and_economic/,iran,2025-12-07 13:47:13,What are the global geopolitical and economic implications of an (attempted) Iranian ballistic missile on Israeli soil (Tel Aviv or Haifa)? [deleted],neutral,0.2757463157176971,0.7122171521186829,0.0120365750044584,-0.2637097537517547,-0.2637097537517547,2018-05-01 22:16:49,THREAT,0.85,게시글은 이란의 탄도 미사일이 이스라엘에 미칠 군사적 위협과 그에 따른 지정학적 영향을 논의하고 있어 위협 프레임으로 분류됨.
8g0khq,Trita Parsi on Iranian-American Relations,,GJGGJGGJG,geopolitics,7,3,1525104358,/r/geopolitics/comments/8g0khq/trita_parsi_on_iranianamerican_relations/,http://podcast.challengingopinions.com/2018/04/30/co072-trita-parsi-on-iranian-american-relations/?ref=r/geopolitics,iran,2025-12-07 13:47:13,Trita Parsi on Iranian-American Relations ,neutral,0.0348832011222839,0.9358243942260742,0.029292520135641,-0.0055906809866428,-0.0055906809866428,2018-04-30 16:05:58,DIPLOMACY,0.8,제목에서 'Iranian-American Relations'가 언급되어 있어 협상과 대화의 가능성을 강조하는 내용일 것으로 추측됨.
890rqj,Iranian Interests in Syria,,hassaankhan235,geopolitics,1,1,1522686858,/r/geopolitics/comments/890rqj/iranian_interests_in_syria/,http://www.dailymotion.com/video/x6h7f5d,iran,2025-12-07 13:47:13,Iranian Interests in Syria ,neutral,0.0629342645406723,0.9106191396713256,0.0264466870576143,-0.0364875793457031,-0.0364875793457031,2018-04-02 16:34:18,NEUTRAL,0.8,"게시글 제목은 이란의 시리아 내 이익에 대한 중립적인 정보를 전달하고 있으며, 특정한 위협이나 협상, 경제적 측면, 인권 문제를 강조하지 않고 있습니다."
84zg3q,What is the future of Sino-Iranian and Russo-Iranian Relations?,"Iran and Russia don't exactly have the best of history, but I felt that it was shelved due to the common enemy of the US, I read an article that was saying mistrust of Russia is prevalent in Iran.

Iran and China technically speaking, have a common ""frenemy"" in Russia as they both want more influence in central Asia.

What's your guy's take on the future of Iran-China and Iran-Russia relations? My take is, Iran-China relations will improve as they both co-op each other to get more influence in Central Asia, Russia-Iran relations will not deteriorate beyond normalcy but they will no longer be ""allied"" in the traditional sense but will be allied through their relations with China.",johndouglas220,geopolitics,43,10,1521239637,/r/geopolitics/comments/84zg3q/what_is_the_future_of_sinoiranian_and/,https://www.reddit.com/r/geopolitics/comments/84zg3q/what_is_the_future_of_sinoiranian_and/,iran,2025-12-07 13:47:13,"What is the future of Sino-Iranian and Russo-Iranian Relations? Iran and Russia don't exactly have the best of history, but I felt that it was shelved due to the common enemy of the US, I read an article that was saying mistrust of Russia is prevalent in Iran.

Iran and China technically speaking, have a common ""frenemy"" in Russia as they both want more influence in central Asia.

What's your guy's take on the future of Iran-China and Iran-Russia relations? My take is, Iran-China relations will improve as they both co-op each other to get more influence in Central Asia, Russia-Iran relations will not deteriorate beyond normalcy but they will no longer be ""allied"" in the traditional sense but will be allied through their relations with China.",neutral,0.3187236189842224,0.6474626064300537,0.03381372615695,-0.2849099040031433,-0.2849099040031433,2018-03-16 22:33:57,DIPLOMACY,0.7,"게시글은 이란과 중국, 이란과 러시아 간의 관계 개선 가능성을 언급하며 협력과 영향력 확대에 대한 논의를 포함하고 있어 외교적 측면을 강조하고 있다."
7x4s8c,How American Media Spin-Doctored the Iranian Protests A new poll suggests the demonstrations were not about Iran's foreign policy.,,fdeckert,geopolitics,35,23,1518475850,/r/geopolitics/comments/7x4s8c/how_american_media_spindoctored_the_iranian/,http://www.theamericanconservative.com/articles/how-american-media-spin-doctored-the-iranian-protests/,iran,2025-12-07 13:47:13,How American Media Spin-Doctored the Iranian Protests A new poll suggests the demonstrations were not about Iran's foreign policy. ,negative,0.6285703778266907,0.3609526753425598,0.0104770166799426,-0.6180933713912964,-0.6180933713912964,2018-02-12 22:50:50,NEUTRAL,0.8,"게시글은 이란의 시위에 대한 미국 미디어의 보도 방식에 대해 언급하고 있으며, 특정한 위협이나 외교적 요소를 강조하지 않고 중립적인 정보 전달에 초점을 맞추고 있다."
7wl6z9,Israel Attacks Targets in Syria After Iranian Drone Enters Israeli Airspace and Jet Crashes,,Planet_side,geopolitics,135,79,1518266030,/r/geopolitics/comments/7wl6z9/israel_attacks_targets_in_syria_after_iranian/,https://www.nytimes.com/2018/02/10/world/middleeast/israel-iran-syria.html,iran,2025-12-07 13:47:13,Israel Attacks Targets in Syria After Iranian Drone Enters Israeli Airspace and Jet Crashes ,negative,0.6787229180335999,0.3141925632953644,0.0070844939909875,-0.6716384291648865,-0.6716384291648865,2018-02-10 12:33:50,THREAT,0.9,게시글은 이란 드론의 침입과 이스라엘의 군사 공격을 언급하고 있어 군사적 위협과 전쟁 위험을 강조하고 있습니다.
7t7lfm,Big Charity vs. the Iranian 99%?,,gnikivar2,geopolitics,0,1,1517000121,/r/geopolitics/comments/7t7lfm/big_charity_vs_the_iranian_99/,http://content.blubrry.com/wealthofnationspodcast/iran_revolutionary_guards.mp3,iran,2025-12-07 13:47:13,Big Charity vs. the Iranian 99%? ,neutral,0.0606461055576801,0.8918418288230896,0.0475120991468429,-0.0131340064108371,-0.0131340064108371,2018-01-26 20:55:21,HUMANITARIAN,0.8,"게시글 제목에서 'Charity'와 'Iranian 99%'라는 표현은 인권과 사회적 불평등 문제를 암시하며, 이는 인도적 관점에서의 논의로 해석될 수 있습니다."
7pu2u1,The Real Causes of the Iranian Protests,,Mynameis__--__,geopolitics,0,1,1515730384,/r/geopolitics/comments/7pu2u1/the_real_causes_of_the_iranian_protests/,https://www.youtube.com/watch?v=DUcBPl6mAkY,iran,2025-12-07 13:47:13,The Real Causes of the Iranian Protests ,neutral,0.2013653069734573,0.764861524105072,0.0337732061743736,-0.1675921082496643,-0.1675921082496643,2018-01-12 04:13:04,NEUTRAL,0.8,"게시글 제목은 이란 시위의 실제 원인에 대한 정보를 전달하고 있지만, 구체적인 내용이 없어 중립적인 정보 전달로 분류할 수 있습니다."
7pu2nm,The Real Causes of the Iranian Protests,[deleted],[deleted],geopolitics,1,0,1515730325,/r/geopolitics/comments/7pu2nm/the_real_causes_of_the_iranian_protests/,https://www.youtube.com/watch?v=INDnHP5PaTc,iran,2025-12-07 13:47:13,The Real Causes of the Iranian Protests [deleted],neutral,0.3132618963718414,0.6700021624565125,0.0167358666658401,-0.2965260148048401,-0.2965260148048401,2018-01-12 04:12:05,NEUTRAL,0.8,"게시글 제목이 이란 시위의 원인에 대한 정보를 전달하고 있지만, 구체적인 내용이 없어 중립적인 정보 전달로 분류됨."
7p8y8b,Exclusive Interview with Russia Today: Iranians do not want a democracy based on US model,,Toophan3,geopolitics,1,9,1515521429,/r/geopolitics/comments/7p8y8b/exclusive_interview_with_russia_today_iranians_do/,https://al-sura.com/iranians-do-not-want-a-democracy-based-on-us-model/,iran,2025-12-07 13:47:13,Exclusive Interview with Russia Today: Iranians do not want a democracy based on US model ,negative,0.6004440188407898,0.3882865011692047,0.0112695209681987,-0.5891745090484619,-0.5891745090484619,2018-01-09 18:10:29,NEUTRAL,0.8,"게시글은 이란 국민의 민주주의에 대한 의견을 다루고 있으며, 특정한 위협이나 협상, 경제적 측면, 인권 문제를 강조하지 않고 중립적인 정보 전달에 가까운 내용으로 보입니다."
7oqzro,"An Iranian tanker, Sanchi, collided with a Chinese freighter, CF Crystal, in the East China Sea on January 6. The tanker carrying 136,000 tonnes of condensed oil, caught fire. 30 Iranian and two Bangladeshi sailors went missing in the collision.",,Fisher177,geopolitics,1,0,1515337307,/r/geopolitics/comments/7oqzro/an_iranian_tanker_sanchi_collided_with_a_chinese/,https://www.youtube.com/watch?v=KZzrEq_tD2w&feature=youtu.be,iran,2025-12-07 13:47:13,"An Iranian tanker, Sanchi, collided with a Chinese freighter, CF Crystal, in the East China Sea on January 6. The tanker carrying 136,000 tonnes of condensed oil, caught fire. 30 Iranian and two Bangladeshi sailors went missing in the collision. ",negative,0.7034704089164734,0.2895727157592773,0.0069568390026688,-0.6965135931968689,-0.6965135931968689,2018-01-07 15:01:47,NEUTRAL,0.9,"게시글은 사건에 대한 중립적인 정보만을 전달하고 있으며, 특정한 정치적 프레임이나 감정을 강조하지 않음."
7oi5tn,"Iranians rally for third day in show of unity, strength",,Veganpuncher,geopolitics,1,2,1515228052,/r/geopolitics/comments/7oi5tn/iranians_rally_for_third_day_in_show_of_unity/,http://en.khabarfoori.com/news/details/5244/iranians-rally-for-third-day-in-show-of-unity-strength,iran,2025-12-07 13:47:13,"Iranians rally for third day in show of unity, strength ",positive,0.0069137224927544,0.2377768605947494,0.7553094029426575,0.7483956813812256,0.7483956813812256,2018-01-06 08:40:52,NEUTRAL,0.8,게시글 제목은 이란인들의 집회를 언급하며 단순히 그들의 단결과 힘을 보여주는 내용을 담고 있어 중립적인 정보 전달로 분류할 수 있습니다.
7ntoiy,Edward Luttwak on Why the Iranian Regime Cannot Last,,PerrierCir,geopolitics,15,48,1514972964,/r/geopolitics/comments/7ntoiy/edward_luttwak_on_why_the_iranian_regime_cannot/,http://www.tabletmag.com/jewish-news-and-politics/252374/ayatollah-empire-is-rotting-away,iran,2025-12-07 13:47:13,Edward Luttwak on Why the Iranian Regime Cannot Last ,neutral,0.2759207785129547,0.7043886780738831,0.0196904595941305,-0.2562303245067596,-0.2562303245067596,2018-01-03 09:49:24,THREAT,0.8,게시글 제목에서 이란 정권의 지속 가능성에 대한 언급은 군사적 위협이나 전쟁 위험을 암시할 수 있기 때문에 위협 프레임으로 분류됨.
7ngszu,What would happen if the Iranian government was reformed and what would be the resulting government from those reforms?,,The_Masked_Man102,geopolitics,28,6,1514832887,/r/geopolitics/comments/7ngszu/what_would_happen_if_the_iranian_government_was/,https://www.reddit.com/r/geopolitics/comments/7ngszu/what_would_happen_if_the_iranian_government_was/,iran,2025-12-07 13:47:13,What would happen if the Iranian government was reformed and what would be the resulting government from those reforms? ,neutral,0.0532594583928585,0.924113631248474,0.0226269215345382,-0.0306325368583202,-0.0306325368583202,2018-01-01 18:54:47,NEUTRAL,0.9,"게시글은 이란 정부의 개혁과 그 결과에 대한 질문을 제기하고 있으며, 특정한 위협이나 협상, 경제적 측면, 인권 문제를 강조하지 않고 중립적인 정보 전달에 해당합니다."
7jl0s5,Israeli-Iranian proxy war - CaspianReport,,theKalash,geopolitics,1,0,1513188034,/r/geopolitics/comments/7jl0s5/israeliiranian_proxy_war_caspianreport/,https://www.youtube.com/watch?v=V5asWYmGOa8,iran,2025-12-07 13:47:13,Israeli-Iranian proxy war - CaspianReport ,neutral,0.1851487755775451,0.7951247096061707,0.0197265334427356,-0.1654222458600998,-0.1654222458600998,2017-12-13 18:00:34,THREAT,0.8,"게시글 제목에서 'proxy war'라는 용어가 사용되어 군사적 갈등과 위협을 암시하고 있으며, 이란과 이스라엘 간의 긴장 관계를 강조할 가능성이 높기 때문입니다."
7j6dha,"Iranian media discussing way forward after victories in Iraq, Lebanon, Syria, Yemen etc.","Published this week in the Iranian newspaper *Javan*
---

""Samuel Huntington's strategic points of view and his predictions [i.e. Clash of Civilizations] are not forgotten. He said: 'After the USSR, there are eight civilizations. Of them, only the Islamic and Chinese cultures will clash [with the West] in the future, and this will be violent and bloody.'

""Now, 30 years after Huntington said this, the world is seeing the deterioration of the West's might, and the shaping of the great civilization of Islam:

""1. America is $17 trillion in debt, and in effect is economically bankrupt.

""2. The world is witnessing the shaping of a multipolar regime with an Asiatic approach, in which Iran is a major axis.

""3. Iran has become the No. 1 power in the region, and it is very influential.

""4. The peoples of the world hate the behavior of the West in general, and particularly of America; this hatred is increasing by the day.

""5. The internal problems in America and in Europe are increasing, and this facilitates conditions for the emergence of new powers.

""6. The Western media empire is collapsing; the administration of the media is changing rapidly, and is no longer exclusively in the hands of the West.

""7. Iran is situated in the best spot in the [Asian] continent, and is unquestionably superior in the world with regard to oil and energy.

""8. Iran has the material and spiritual might and capability to export its revolution to the world.

""9. The Saudi regime that controls the Hijaz has suffered defeat in all its schemes to expand, and all its threats and efforts against Iran have become opportunities for Iran.

""10. The West, particularly America, cannot meet the needs of their people, because of the weakness of the liberal-capitalist [ideology], and have become helpless in the face of the Wall Street movement [sic].

""Therefore, our strong points must be matched with the weak points of the enemies, and our diplomacy must be adjusted in accordance with the long-term goals of the revolution.

""We must prepare ourselves to build a new world order. We need to build the new world order, and not to wait for others to shape the future according to their doctrine and their goals.

https://www.memri.org/reports/iranian-daily-we-must-prepare-ourselves-build-new-world-order-implement-revolutionary",redbased,geopolitics,27,29,1513035139,/r/geopolitics/comments/7j6dha/iranian_media_discussing_way_forward_after/,https://www.reddit.com/r/geopolitics/comments/7j6dha/iranian_media_discussing_way_forward_after/,iran,2025-12-07 13:47:13,"Iranian media discussing way forward after victories in Iraq, Lebanon, Syria, Yemen etc. Published this week in the Iranian newspaper *Javan*
---

""Samuel Huntington's strategic points of view and his predictions [i.e. Clash of Civilizations] are not forgotten. He said: 'After the USSR, there are eight civilizations. Of them, only the Islamic and Chinese cultures will clash [with the West] in the future, and this will be violent and bloody.'

""Now, 30 years after Huntington said this, the world is seeing the deterioration of the West's might, and the shaping of the great civilization of Islam:

""1. America is $17 trillion in debt, and in effect is economically bankrupt.

""2. The world is witnessing the shaping of a multipolar regime with an Asiatic approach, in which Iran is a major axis.

""3. Iran has become the No. 1 power in the region, and it is very influential.

""4. The peoples of the world hate the behavior of the West in general, and particularly of America; this hatred is increasing by the day.

""5. The internal problems in America and in Europe are increasing, and this facilitates conditions for the emergence of new powers.

""6. The Western media empire is collapsing; the administration of the media is changing rapidly, and is no longer exclusively in the hands of the West.

""7. Iran is situated in the best spot in the [Asian] continent, and is unquestionably superior in the world with regard to oil and energy.

""8. Iran has the material and spiritual might and capability to export its revolution to the world.

""9. The Saudi regime that controls the Hijaz has suffered defeat in all its schemes to expand, and all its threats and efforts against Iran have become opportunities for Iran.

""10. The West, particularly America, cannot meet the needs of their people, because of the weakness of the liberal-capitalist [ideology], and have become helpless in the face of the Wall Street movement [sic].

""Therefore, our strong points must be matched with the weak points of the enemies, and our diplomacy must be adjusted in accordance with the long-term goals of the revolution.

""We must prepare ourselves to build a new world order. We need to build the new world order, and not to wait for others to shape the future according to their doctrine and their goals.

https://www.memri.org/reports/iranian-daily-we-must-prepare-ourselves-build-new-world-order-implement-revolutionary",neutral,0.1012443751096725,0.8298806548118591,0.0688749849796295,-0.032369390130043,-0.032369390130043,2017-12-11 23:32:19,THREAT,0.8,"게시글은 헌팅턴의 '문명 충돌' 이론을 언급하며, 이슬람 문화와 서구 간의 미래의 폭력적 충돌 가능성을 강조하고 있어 군사적 위협을 암시하고 있다."
7duqqq,"In the ""Iran-Saudi Arabia hot war"" thread here, Iranian ally Hezbollah was repeatedly mentioned. Are they really a ""terrorist"" organization?",[removed],Markdd8,geopolitics,0,7,1511029951,/r/geopolitics/comments/7duqqq/in_the_iransaudi_arabia_hot_war_thread_here/,https://www.reddit.com/r/geopolitics/comments/7duqqq/in_the_iransaudi_arabia_hot_war_thread_here/,iran,2025-12-07 13:47:13,"In the ""Iran-Saudi Arabia hot war"" thread here, Iranian ally Hezbollah was repeatedly mentioned. Are they really a ""terrorist"" organization? [removed]",negative,0.5680803656578064,0.4229288697242737,0.0089907152578234,-0.5590896606445312,-0.5590896606445312,2017-11-18 18:32:31,NEUTRAL,0.8,"게시글은 이란-사우디 아라비아 간의 갈등과 관련된 정보를 제공하며, 특정한 정치적 입장을 취하지 않고 중립적인 질문을 던지고 있다."
7a9h3h,Russia to build pipeline to supply Iranian natural gas to India,,Razor2115,geopolitics,172,39,1509599805,/r/geopolitics/comments/7a9h3h/russia_to_build_pipeline_to_supply_iranian/,https://www.rt.com/business/408432-gazprom-iran-india-gas-pipe/,iran,2025-12-07 13:47:13,Russia to build pipeline to supply Iranian natural gas to India ,neutral,0.0884020552039146,0.8807135224342346,0.0308843906968832,-0.0575176626443862,-0.0575176626443862,2017-11-02 05:16:45,ECONOMIC,0.85,"게시글은 러시아가 이란의 천연가스를 인도로 공급하는 파이프라인을 건설하는 내용을 다루고 있어 경제적 측면, 특히 에너지 무역과 관련된 내용을 강조하고 있습니다."
