id,title,selftext,author,subreddit,score,num_comments,created_utc,permalink,url,topic,collection_date,text,sentiment_label,sentiment_negative,sentiment_neutral,sentiment_positive,sentiment_compound,sentiment_score,datetime,frame,frame_confidence,frame_reason
c3xo35,US launched cyber attack on Iranian rockets and missiles – reports - Targeted strike on computer-controlled weapons of Iran’s Islamic Revolutionary Guard had been planned over weeks,,ManiaforBeatles,worldnews,66,36,1561254564,/r/worldnews/comments/c3xo35/us_launched_cyber_attack_on_iranian_rockets_and/,https://www.theguardian.com/world/2019/jun/23/us-launched-cyber-attack-on-iranian-rockets-and-missiles-reports,iran,2025-12-07 13:47:13,US launched cyber attack on Iranian rockets and missiles – reports - Targeted strike on computer-controlled weapons of Iran’s Islamic Revolutionary Guard had been planned over weeks ,negative,0.5303835868835449,0.4576976299285888,0.0119187869131565,-0.5184648036956787,-0.5184648036956787,2019-06-23 01:49:24,THREAT,0.9,게시글은 미국의 사이버 공격이 이란의 미사일과 로켓에 대한 군사적 행동임을 강조하고 있어 군사적 위협을 나타내고 있습니다.
c3vk2d,Iranian Force Exults in Downing of U.S. Drone With a Feast and a Prayer,[deleted],[deleted],worldnews,5,4,1561242060,/r/worldnews/comments/c3vk2d/iranian_force_exults_in_downing_of_us_drone_with/,https://www.nytimes.com/2019/06/22/world/middleeast/iran-drone-revolutionary-guards.html,iran,2025-12-07 13:47:13,Iranian Force Exults in Downing of U.S. Drone With a Feast and a Prayer [deleted],neutral,0.2191222310066223,0.76597660779953,0.014901160262525,-0.2042210698127746,-0.2042210698127746,2019-06-22 22:21:00,THREAT,0.85,"게시글 제목에서 미국 드론을 격추한 이란 군대의 행동을 강조하고 있으며, 이는 군사적 위협과 전쟁 위험을 암시하는 내용으로 해석될 수 있다."
c3v1xe,Leaked Audio in Iranian media alleges collusion between Saudi Arabia and MEK over Tanker Attacks.,,Aria19999,worldnews,1,0,1561239250,/r/worldnews/comments/c3v1xe/leaked_audio_in_iranian_media_alleges_collusion/,https://twitter.com/aveeksen/status/1142416592984088576,iran,2025-12-07 13:47:13,Leaked Audio in Iranian media alleges collusion between Saudi Arabia and MEK over Tanker Attacks. ,neutral,0.3576183915138244,0.6305709481239319,0.0118106259033083,-0.3458077609539032,-0.3458077609539032,2019-06-22 21:34:10,THREAT,0.8,"게시글 제목에서 'Tanker Attacks'라는 언급은 군사적 위협과 관련된 사건을 암시하며, 이란과 사우디 아라비아 간의 갈등을 강조하고 있어 위협 프레임으로 분류할 수 있습니다."
c3uh3e,Iranian hackers wage cyber campaign amid tensions with U.S.,,gamung,worldnews,12,2,1561235901,/r/worldnews/comments/c3uh3e/iranian_hackers_wage_cyber_campaign_amid_tensions/,https://www.cbsnews.com/news/iranian-hackers-wage-cyber-campaign-amid-tensions-with-us-2019-06-22/,iran,2025-12-07 13:47:13,Iranian hackers wage cyber campaign amid tensions with U.S. ,neutral,0.409625381231308,0.5810340046882629,0.0093406168743968,-0.4002847671508789,-0.4002847671508789,2019-06-22 20:38:21,THREAT,0.8,게시글 제목에서 이란 해커의 사이버 캠페인이 미국과의 긴장 상황 속에서 발생하고 있다는 점을 강조하고 있어 군사적 위협과 관련된 프레임으로 분류할 수 있습니다.
c3tbq6,Iranian hackers wage cyber campaign amid tensions with US,,ChoiceDefinition3,worldnews,12,1,1561229382,/r/worldnews/comments/c3tbq6/iranian_hackers_wage_cyber_campaign_amid_tensions/,https://www.apnews.com/f01492c3dbd14856bce41d776248921f,iran,2025-12-07 13:47:13,Iranian hackers wage cyber campaign amid tensions with US ,neutral,0.4404374957084656,0.5501412153244019,0.0094213206321001,-0.4310161769390106,-0.4310161769390106,2019-06-22 18:49:42,THREAT,0.8,게시글 제목에서 이란 해커들의 사이버 캠페인이 미국과의 긴장 속에서 발생하고 있다는 점을 강조하고 있어 군사적 위협과 관련된 프레임으로 분류할 수 있습니다.
c3qe1z,Iranian views from the street: Trump playing « childish dare game »,,Morgennes,worldnews,8,10,1561214083,/r/worldnews/comments/c3qe1z/iranian_views_from_the_street_trump_playing/,https://www.aljazeera.com/news/2019/06/iranian-views-street-trump-playing-childish-game-190622100239743.html,iran,2025-12-07 13:47:13,Iranian views from the street: Trump playing « childish dare game » ,neutral,0.3831591308116913,0.5977674126625061,0.0190735105425119,-0.3640856146812439,-0.3640856146812439,2019-06-22 14:34:43,NEUTRAL,0.8,"게시글 제목은 이란의 일반적인 의견을 전달하고 있으며, 특정한 위협이나 외교적 요소를 강조하지 않고 중립적인 관점을 유지하고 있습니다."
c3q3kd,Iranian hackers wage cyber campaign amid tensions with US,,idarknight,worldnews,12,2,1561212458,/r/worldnews/comments/c3q3kd/iranian_hackers_wage_cyber_campaign_amid_tensions/,https://apnews.com/f01492c3dbd14856bce41d776248921f,iran,2025-12-07 13:47:13,Iranian hackers wage cyber campaign amid tensions with US ,neutral,0.4404374957084656,0.5501412153244019,0.0094213206321001,-0.4310161769390106,-0.4310161769390106,2019-06-22 14:07:38,THREAT,0.8,"게시글 제목에서 이란 해커의 사이버 캠페인이 미국과의 긴장 속에서 이루어지고 있다고 언급하며, 군사적 위협과 관련된 요소를 강조하고 있기 때문입니다."
c3okln,Iranian General Warns 'Firing One Bullet at Iran' Will 'Set Fire' to US Interests - Reports,,classsiob23b,worldnews,0,28,1561202522,/r/worldnews/comments/c3okln/iranian_general_warns_firing_one_bullet_at_iran/,https://sputniknews.com/middleeast/201906221076016994-iran-general-firing-bullet-iran-set-fire-us-interests-region/,iran,2025-12-07 13:47:13,Iranian General Warns 'Firing One Bullet at Iran' Will 'Set Fire' to US Interests - Reports ,neutral,0.4001471400260925,0.5890524983406067,0.0108003662899136,-0.3893467783927917,-0.3893467783927917,2019-06-22 11:22:02,THREAT,0.9,게시글에서 이란 군 장성이 미국의 공격에 대한 경고를 하며 군사적 위협을 강조하고 있기 때문에 위협 프레임으로 분류됨.
c3oeoo,"Iranian lawyer who defended women’s right to remove hijab gets 38 years, 148 lashes",[deleted],[deleted],worldnews,1,0,1561201296,/r/worldnews/comments/c3oeoo/iranian_lawyer_who_defended_womens_right_to/,https://womenintheworld.com/2019/03/11/iranian-lawyer-who-defended-womens-right-to-remove-hijab-gets-38-years-148-lashes/,iran,2025-12-07 13:47:13,"Iranian lawyer who defended women’s right to remove hijab gets 38 years, 148 lashes [deleted]",negative,0.7423421144485474,0.249868631362915,0.0077892066910862,-0.7345529198646545,-0.7345529198646545,2019-06-22 11:01:36,HUMANITARIAN,0.9,"게시글은 이란에서 여성의 권리와 인권 문제를 다루고 있으며, 변호사가 처벌받는 사례를 통해 인권 침해를 강조하고 있습니다."
c3mc6y,Pentagon secretly struck back against Iranian cyber spies targeting US ships.,,valrulez,worldnews,9,3,1561185153,/r/worldnews/comments/c3mc6y/pentagon_secretly_struck_back_against_iranian/,https://news.yahoo.com/pentagon-secretly-struck-back-against-iranian-cyber-spies-targeting-us-ships-234520824.html?soc_src=hl-viewer&soc_trk=tw,iran,2025-12-07 13:47:13,Pentagon secretly struck back against Iranian cyber spies targeting US ships. ,neutral,0.1810860335826873,0.7969104051589966,0.022003574296832,-0.1590824574232101,-0.1590824574232101,2019-06-22 06:32:33,THREAT,0.9,게시글은 이란의 사이버 스파이 공격에 대한 미국의 군사적 반격을 언급하고 있어 군사적 위협을 강조하고 있습니다.
c3kt54,"On Thursday evening, U.S. Cyber Command launched a retaliatory digital strike against an Iranian spy group that supported last week’s limpet mine attacks on commercial ships, according to two former intelligence officials",,DoremusJessup,worldnews,6,7,1561174924,/r/worldnews/comments/c3kt54/on_thursday_evening_us_cyber_command_launched_a/,https://news.yahoo.com/pentagon-secretly-struck-back-against-iranian-cyber-spies-targeting-us-ships-234520824.html?soc_src=newsroom&soc_trk=com.apple.UIKit.activity.CopyToPasteboard&.tsrc=newsroom,iran,2025-12-07 13:47:13,"On Thursday evening, U.S. Cyber Command launched a retaliatory digital strike against an Iranian spy group that supported last week’s limpet mine attacks on commercial ships, according to two former intelligence officials ",neutral,0.2884851992130279,0.6985621452331543,0.0129526266828179,-0.2755325734615326,-0.2755325734615326,2019-06-22 03:42:04,THREAT,0.9,"게시글은 군사적 대응과 사이버 공격을 언급하며, 이는 군사적 위협과 관련된 내용을 강조하고 있다."
c3j7gq,"Iranian official calls IAEA inspectors 'roaches,' says Tehran should quit NPT. The official said Iran should be able to acquire 90% enriched uranium for research. This is the same enrichment amount for uranium used in nuclear weapons",,HistoryLord,worldnews,0,14,1561165403,/r/worldnews/comments/c3j7gq/iranian_official_calls_iaea_inspectors_roaches/,https://www.timesofisrael.com/top-iranian-official-says-tehran-should-drop-out-of-international-nuclear-treaty/,iran,2025-12-07 13:47:13,"Iranian official calls IAEA inspectors 'roaches,' says Tehran should quit NPT. The official said Iran should be able to acquire 90% enriched uranium for research. This is the same enrichment amount for uranium used in nuclear weapons ",neutral,0.4064754843711853,0.573820173740387,0.019704358652234,-0.3867711126804352,-0.3867711126804352,2019-06-22 01:03:23,THREAT,0.9,"게시글은 이란 고위 관계자가 IAEA 검사들을 비하하며, 이란이 핵무기 제조에 필요한 고농축 우라늄을 확보해야 한다고 주장하는 내용을 담고 있어 군사적 위협을 강조하고 있다."
c3j0j6,Pentagon secretly struck back against Iranian cyberspies targeting U.S. ships,,M7plusoneequalsm8,worldnews,8,14,1561164317,/r/worldnews/comments/c3j0j6/pentagon_secretly_struck_back_against_iranian/,https://news.yahoo.com/pentagon-secretly-struck-back-against-iranian-cyber-spies-targeting-us-ships-234520824.html?,iran,2025-12-07 13:47:13,Pentagon secretly struck back against Iranian cyberspies targeting U.S. ships ,neutral,0.1990679502487182,0.7787874937057495,0.022144628688693,-0.17692331969738,-0.17692331969738,2019-06-22 00:45:17,THREAT,0.85,게시글은 이란 사이버 스파이가 미국 선박을 겨냥한 공격에 대한 보복을 언급하고 있어 군사적 위협을 강조하고 있습니다.
c3h9px,Trump says he called off strikes because of potential Iranian deaths,,freethinker78,worldnews,4,7,1561155113,/r/worldnews/comments/c3h9px/trump_says_he_called_off_strikes_because_of/,https://www.haaretz.com/us-news/trump-says-he-called-off-strike-on-iran-because-was-not-proportionate-1.7400143,iran,2025-12-07 13:47:13,Trump says he called off strikes because of potential Iranian deaths ,neutral,0.4396837055683136,0.5465862154960632,0.0137300509959459,-0.4259536564350128,-0.4259536564350128,2019-06-21 22:11:53,HUMANITARIAN,0.8,"게시글은 트럼프가 이란의 잠재적 사망자 수를 고려하여 군사적 공격을 취소했다고 언급하고 있어, 인권과 생명에 대한 우려를 강조하고 있습니다."
c3gktt,"‘If Trump doesn’t want war, he has to ease sanctions’ – Iranian presidential adviser",,PorTruffle,worldnews,4,78,1561151772,/r/worldnews/comments/c3gktt/if_trump_doesnt_want_war_he_has_to_ease_sanctions/,https://www.rt.com/news/462418-stop-sanctions-prevent-war-trump-iran/,iran,2025-12-07 13:47:13,"‘If Trump doesn’t want war, he has to ease sanctions’ – Iranian presidential adviser ",neutral,0.2485812753438949,0.7244996428489685,0.0269191674888134,-0.2216621041297912,-0.2216621041297912,2019-06-21 21:16:12,ECONOMIC,0.9,게시글은 트럼프 대통령이 전쟁을 원하지 않는다면 제재를 완화해야 한다고 언급하고 있어 경제 제재와 관련된 내용을 강조하고 있습니다.
c3fpha,"Trump calls off Iranian strikes, citing likely deaths",,Username0089,worldnews,7,5,1561147686,/r/worldnews/comments/c3fpha/trump_calls_off_iranian_strikes_citing_likely/,https://www.apnews.com/2a3e1adab1c243a49ba789bd2934e902,iran,2025-12-07 13:47:13,"Trump calls off Iranian strikes, citing likely deaths ",neutral,0.3419128656387329,0.6404392123222351,0.0176478940993547,-0.3242649734020233,-0.3242649734020233,2019-06-21 20:08:06,THREAT,0.85,"게시글 제목에서 'Iranian strikes'와 'likely deaths'라는 표현이 군사적 행동과 그로 인한 인명 피해를 암시하므로, 군사적 위협 프레임으로 분류할 수 있습니다."
c3eewx,"Iranian general says an ""American P8 aircraft with 35 on board"" was also violating Iranian airspace, but Iran refrained from shooting it down",,green_flash,worldnews,20834,2774,1561141733,/r/worldnews/comments/c3eewx/iranian_general_says_an_american_p8_aircraft_with/,https://americanmilitarynews.com/2019/06/iran-almost-shot-down-us-navy-plane-with-35-crew-as-message-to-us/,iran,2025-12-07 13:47:13,"Iranian general says an ""American P8 aircraft with 35 on board"" was also violating Iranian airspace, but Iran refrained from shooting it down ",negative,0.5866471529006958,0.4039129912853241,0.0094398790970444,-0.5772072672843933,-0.5772072672843933,2019-06-21 18:28:53,THREAT,0.8,게시글은 미국 항공기가 이란 영공을 침범했다는 내용을 담고 있어 군사적 긴장과 위협을 암시하고 있다.
c3c7g9,"Trump Pulled Back on Iran Strikes Citing Potential Iranian Casualties Were ""Not Proportional to Shooting Down and Unmanned Drone.""",,steezefabreeze,worldnews,1,0,1561131863,/r/worldnews/comments/c3c7g9/trump_pulled_back_on_iran_strikes_citing/,https://twitter.com/realDonaldTrump/status/1142055388965212161,iran,2025-12-07 13:47:13,"Trump Pulled Back on Iran Strikes Citing Potential Iranian Casualties Were ""Not Proportional to Shooting Down and Unmanned Drone."" ",negative,0.4980654120445251,0.48835089802742,0.0135837076231837,-0.4844816923141479,-0.4844816923141479,2019-06-21 15:44:23,HUMANITARIAN,0.8,게시글은 이란의 군사적 공격에 대한 트럼프의 결정이 이란의 인명 피해를 고려한 것임을 언급하고 있어 인권 및 인명 피해와 관련된 측면을 강조하고 있다.
c3bp61,Iranian general says US was warned several times before drone was shot down,,30ustice4,worldnews,1,0,1561129486,/r/worldnews/comments/c3bp61/iranian_general_says_us_was_warned_several_times/,https://thehill.com/policy/defense/449666-iran-general-says-us-was-warned-several-times-before-drone-was-shot-down,iran,2025-12-07 13:47:13,Iranian general says US was warned several times before drone was shot down ,neutral,0.3538942337036133,0.6309349536895752,0.0151707977056503,-0.3387234210968017,-0.3387234210968017,2019-06-21 15:04:46,THREAT,0.85,게시글은 드론이 격추된 사건과 관련하여 미국에 대한 경고가 있었다고 언급하고 있어 군사적 긴장과 위협을 암시하고 있습니다.
c3bb0z,Killing 150 Iranians 'not proportionate' to shooting down unmanned drone tweets Trump,,cbt711,worldnews,7,20,1561127618,/r/worldnews/comments/c3bb0z/killing_150_iranians_not_proportionate_to/,https://www.nytimes.com/2019/06/21/us/politics/trump-iran-attack.html?fbclid=IwAR1hF-5akSPzJNrp6Ah8p7ERRUi4PIXiv8sXbc91ynf9vBr80snFTjrhr1s,iran,2025-12-07 13:47:13,Killing 150 Iranians 'not proportionate' to shooting down unmanned drone tweets Trump ,negative,0.7291650772094727,0.2636601030826568,0.0071748052723705,-0.7219902873039246,-0.7219902873039246,2019-06-21 14:33:38,THREAT,0.85,게시글은 트럼프의 발언을 인용하며 군사적 행동의 비례성을 언급하고 있어 군사적 위협과 관련된 내용을 강조하고 있습니다.
c3ayfs,Trump says he aborted retaliatory strike to spare Iranian lives,,zecksy,worldnews,14,50,1561125898,/r/worldnews/comments/c3ayfs/trump_says_he_aborted_retaliatory_strike_to_spare/,https://www.reuters.com/article/us-mideast-iran-usa/trump-says-he-aborted-retaliatory-strike-to-spare-iranian-lives-idUSKCN1TL07P?il=0,iran,2025-12-07 13:47:13,Trump says he aborted retaliatory strike to spare Iranian lives ,neutral,0.3551496565341949,0.609686553478241,0.0351637862622737,-0.3199858665466308,-0.3199858665466308,2019-06-21 14:04:58,HUMANITARIAN,0.85,게시글은 트럼프가 이란인의 생명을 구하기 위해 보복 공격을 중단했다고 언급하고 있어 인권과 생명에 대한 고려를 강조하고 있다.
c3at7u,Trump says he aborted retaliatory strike on Iran to spare Iranian lives,,AntifaTaipei,worldnews,12,33,1561125128,/r/worldnews/comments/c3at7u/trump_says_he_aborted_retaliatory_strike_on_iran/,https://www.reuters.com/article/us-mideast-iran-usa/trump-says-he-aborted-retaliatory-strike-on-iran-to-spare-iranian-lives-idUSKCN1TL07P?il=0,iran,2025-12-07 13:47:13,Trump says he aborted retaliatory strike on Iran to spare Iranian lives ,neutral,0.2653484046459198,0.6862956285476685,0.0483559481799602,-0.2169924527406692,-0.2169924527406692,2019-06-21 13:52:08,HUMANITARIAN,0.9,게시글은 이란의 생명을 구하기 위해 보복 공격을 중단했다는 내용을 담고 있어 인권과 관련된 측면을 강조하고 있습니다.
c3aiuw,"Trump warned Tehran the U.S. was about to strike, called for talks: Iranian officials",,General_Prahasth,worldnews,0,1,1561123479,/r/worldnews/comments/c3aiuw/trump_warned_tehran_the_us_was_about_to_strike/,https://www.reuters.com/article/us-mideast-iran-usa/trump-warned-tehran-the-u-s-was-about-to-strike-called-for-talks-iranian-officials-idUSKCN1TL07P,iran,2025-12-07 13:47:13,"Trump warned Tehran the U.S. was about to strike, called for talks: Iranian officials ",neutral,0.1251366585493087,0.8514015078544617,0.0234617441892623,-0.1016749143600463,-0.1016749143600463,2019-06-21 13:24:39,DIPLOMACY,0.85,게시글에서 트럼프가 이란과의 대화를 촉구한 내용이 포함되어 있어 협상과 대화의 가능성을 강조하고 있다.
c3ae1f,President Trump says he stopped attack on Iran because response would not have been proportional to downing of unmanned drone (150 Iranian casualties expected),,Narksdog,worldnews,27,34,1561122700,/r/worldnews/comments/c3ae1f/president_trump_says_he_stopped_attack_on_iran/,https://www.forexlive.com/news/!/trump-says-he-stopped-attack-on-iran-because-it-would-not-have-been-proportional-20190621,iran,2025-12-07 13:47:13,President Trump says he stopped attack on Iran because response would not have been proportional to downing of unmanned drone (150 Iranian casualties expected) ,neutral,0.412909984588623,0.5630176067352295,0.0240724217146635,-0.3888375759124756,-0.3888375759124756,2019-06-21 13:11:40,THREAT,0.85,"게시글은 이란에 대한 군사적 공격을 언급하며, 예상되는 인명 피해를 강조하고 있어 군사적 위협의 프레임으로 분류됩니다."
c3a717,"Advisor to the Iranian President: ""If Trump does not want war with Iran, he should ease the sanctions""",,Narksdog,worldnews,4,9,1561121602,/r/worldnews/comments/c3a717/advisor_to_the_iranian_president_if_trump_does/,https://iran.liveuamap.com/en/2019/21-june-advisor-to-the-iranian-president-if-trump-does-not,iran,2025-12-07 13:47:13,"Advisor to the Iranian President: ""If Trump does not want war with Iran, he should ease the sanctions"" ",neutral,0.1781170815229416,0.7857893109321594,0.036093533039093,-0.1420235484838485,-0.1420235484838485,2019-06-21 12:53:22,ECONOMIC,0.9,게시글은 트럼프 대통령이 이란과의 전쟁을 원하지 않는다면 제재를 완화해야 한다고 언급하며 경제 제재의 중요성을 강조하고 있습니다.
c39xrv,Iran displays parts of wreckage from US drone recovered from within Iranian borders,,investigator919,worldnews,12,7,1561119989,/r/worldnews/comments/c39xrv/iran_displays_parts_of_wreckage_from_us_drone/,https://www.presstv.com/Detail/2019/06/21/599048/Iran-photos-US-drone-wreckage-persian-gulf-IRGC,iran,2025-12-07 13:47:13,Iran displays parts of wreckage from US drone recovered from within Iranian borders ,neutral,0.1271353811025619,0.8427125215530396,0.0301520824432373,-0.0969832986593246,-0.0969832986593246,2019-06-21 12:26:29,THREAT,0.85,"게시글은 미국 드론의 잔해를 이란이 전시했다는 내용으로, 군사적 긴장과 위협을 암시하고 있다."
c39tk5,"Trump warned Tehran a U.S. attack was imminent, called for talks: Iranian officials",,classsiob23b,worldnews,12,31,1561119243,/r/worldnews/comments/c39tk5/trump_warned_tehran_a_us_attack_was_imminent/,https://www.reuters.com/article/us-mideast-iran-usa/trump-warned-tehran-a-u-s-attack-was-imminent-called-for-talks-iranian-officials-idUSKCN1TL07P,iran,2025-12-07 13:47:13,"Trump warned Tehran a U.S. attack was imminent, called for talks: Iranian officials ",neutral,0.2080922126770019,0.7682812809944153,0.0236264653503894,-0.1844657510519027,-0.1844657510519027,2019-06-21 12:14:03,DIPLOMACY,0.85,게시글에서 트럼프가 이란과의 대화를 촉구하며 공격이 임박했다고 경고한 내용이 포함되어 있어 협상과 대화의 가능성을 강조하고 있습니다.
c39qgp,Trump called off ‘limited’ Iranian strike when planes & ships were ‘in position’ – reports,,classsiob23b,worldnews,0,2,1561118668,/r/worldnews/comments/c39qgp/trump_called_off_limited_iranian_strike_when/,https://www.rt.com/usa/462358-iran-strike-trump-order,iran,2025-12-07 13:47:13,Trump called off ‘limited’ Iranian strike when planes & ships were ‘in position’ – reports ,neutral,0.085683986544609,0.8895372152328491,0.024778813123703,-0.060905173420906,-0.060905173420906,2019-06-21 12:04:28,THREAT,0.8,"게시글 제목에서 이란에 대한 군사적 공격이 언급되고 있으며, 이는 군사적 위협을 강조하는 내용으로 해석될 수 있습니다."
c39pup,Iranian commander says Tehran refrained from targeting US plane with 35 on board flying with downed drone,,Narksdog,worldnews,46,63,1561118566,/r/worldnews/comments/c39pup/iranian_commander_says_tehran_refrained_from/,https://www.jpost.com/Breaking-News/Iran-says-it-refrained-from-shooting-down-US-plane-with-35-on-board-Tasnim-news-593262,iran,2025-12-07 13:47:13,Iranian commander says Tehran refrained from targeting US plane with 35 on board flying with downed drone ,neutral,0.3287124931812286,0.6592057943344116,0.0120817581191658,-0.3166307210922241,-0.3166307210922241,2019-06-21 12:02:46,THREAT,0.8,게시글은 이란 군 사령관이 미국 비행기를 타격하지 않았다는 내용을 담고 있어 군사적 긴장과 위협을 암시하고 있다.
c39nna,Iran displays US Spy drone wreckage recovered from inside Iranian waters,,investigator919,worldnews,3,9,1561118166,/r/worldnews/comments/c39nna/iran_displays_us_spy_drone_wreckage_recovered/,https://en.farsnews.com/newstext.aspx?nn=13980331000333,iran,2025-12-07 13:47:13,Iran displays US Spy drone wreckage recovered from inside Iranian waters ,neutral,0.1630168706178665,0.8087129592895508,0.0282702688127756,-0.1347465962171554,-0.1347465962171554,2019-06-21 11:56:06,THREAT,0.85,게시글은 미국의 스파이 드론 잔해를 이란이 전시한 사실을 언급하고 있어 군사적 긴장과 위협을 암시한다.
c39l1t,Iran refrained from targeting US plane with 35 on board flying with downed drone - Iranian commander,,EliteGamer064,worldnews,0,18,1561117673,/r/worldnews/comments/c39l1t/iran_refrained_from_targeting_us_plane_with_35_on/,https://www.rt.com/news/462387-iran-refrained-shooting-us-plane/,iran,2025-12-07 13:47:13,Iran refrained from targeting US plane with 35 on board flying with downed drone - Iranian commander ,neutral,0.3654411435127258,0.6217077374458313,0.0128511022776365,-0.3525900542736053,-0.3525900542736053,2019-06-21 11:47:53,THREAT,0.8,"게시글은 이란의 군사적 행동과 관련된 내용을 다루고 있으며, 미국 비행기를 목표로 하지 않았다는 점에서 군사적 긴장 상태를 암시하고 있습니다."
c395o2,Trump says Iranian shootdown of US military drone may have been a 'mistake',,hellen2019,worldnews,1,0,1561114619,/r/worldnews/comments/c395o2/trump_says_iranian_shootdown_of_us_military_drone/,http://londondailyreport.com/iranian-shootdown-drone-mistake/?fbclid=IwAR1_MF8g6OqkkPt_YQtDAZrgcbrxJ8sD4Y-ga2vEmaaiD-LSzITENW3g9CM,iran,2025-12-07 13:47:13,Trump says Iranian shootdown of US military drone may have been a 'mistake' ,negative,0.5084232687950134,0.4818182587623596,0.0097584752365946,-0.4986647963523865,-0.4986647963523865,2019-06-21 10:56:59,DIPLOMACY,0.7,"트럼프의 발언은 이란의 드론 격추 사건이 실수일 수 있다고 언급하며, 이를 통해 대화와 협상의 가능성을 암시하고 있다."
c391gi,"Trump warned Iran via Oman that U.S. attack was imminent, called for talks - Iranian officials",[deleted],[deleted],worldnews,3,1,1561113718,/r/worldnews/comments/c391gi/trump_warned_iran_via_oman_that_us_attack_was/,https://www.reuters.com/article/us-mideast-iran-usa-oman-exclusive/exclusive-trump-warned-iran-via-oman-that-u-s-attack-was-imminent-called-for-talks-iranian-officials-idUSKCN1TM0UZ,iran,2025-12-07 13:47:13,"Trump warned Iran via Oman that U.S. attack was imminent, called for talks - Iranian officials [deleted]",neutral,0.3060090839862823,0.6763914823532104,0.0175993796437978,-0.2884097099304199,-0.2884097099304199,2019-06-21 10:41:58,DIPLOMACY,0.85,게시글은 미국의 공격 임박 경고와 함께 대화의 필요성을 강조하고 있어 외교적 접근을 나타냅니다.
