id,title,selftext,author,subreddit,score,num_comments,created_utc,permalink,url,topic,collection_date,text,sentiment_label,sentiment_negative,sentiment_neutral,sentiment_positive,sentiment_compound,sentiment_score,datetime,frame,frame_confidence,frame_reason
buxdrr,John Bolton to present his evidence that Iran was behind Gulf attacks,,Kontrolling,geopolitics,373,165,1559244473,/r/geopolitics/comments/buxdrr/john_bolton_to_present_his_evidence_that_iran_was/,https://www.theguardian.com/us-news/2019/may/30/john-bolton-present-evidence-next-week-iran-backed-gulf-attacks,iran,2025-12-07 13:47:13,John Bolton to present his evidence that Iran was behind Gulf attacks ,neutral,0.2362355291843414,0.7432079315185547,0.0205565355718135,-0.2156789898872375,-0.2156789898872375,2019-05-30 19:27:53,THREAT,0.85,게시글 제목에서 이란이 걸프 공격의 배후라는 주장을 강조하고 있어 군사적 위협과 관련된 내용을 암시하고 있습니다.
bufhgt,Saudi Arabia to hold key summits to unite the Islamic world against Iran.,,happy221,geopolitics,523,221,1559140800,/r/geopolitics/comments/bufhgt/saudi_arabia_to_hold_key_summits_to_unite_the/,https://pbs.twimg.com/media/D7sxrjiXsAAAzTs.jpg,iran,2025-12-07 13:47:13,Saudi Arabia to hold key summits to unite the Islamic world against Iran. ,neutral,0.028200440108776,0.8767375349998474,0.0950620993971824,0.0668616592884063,0.0668616592884063,2019-05-29 14:40:00,THREAT,0.8,게시글 제목에서 이란에 대한 단합을 강조하고 있어 군사적 위협의 맥락을 암시하고 있다.
buckcu,"Modi govt plans to resume oil imports from Iran, skirt US sanctions",,Kontrolling,geopolitics,56,5,1559122835,/r/geopolitics/comments/buckcu/modi_govt_plans_to_resume_oil_imports_from_iran/,https://theprint.in/economy/modi-govt-plans-to-resume-oil-imports-from-iran-skirt-us-sanctions/241708/,iran,2025-12-07 13:47:13,"Modi govt plans to resume oil imports from Iran, skirt US sanctions ",neutral,0.0110592991113662,0.623260498046875,0.3656801879405975,0.35462087392807,0.35462087392807,2019-05-29 09:40:35,ECONOMIC,0.9,게시글은 인도 정부의 이란 석유 수입 재개와 미국 제재 회피를 언급하고 있어 경제적 측면을 강조하고 있습니다.
bu5aq4,Trump Undercuts John Bolton on North Korea and Iran,,virtual1observer,geopolitics,188,46,1559076329,/r/geopolitics/comments/bu5aq4/trump_undercuts_john_bolton_on_north_korea_and/,https://www.nytimes.com/2019/05/28/us/politics/trump-john-bolton-north-korea-iran.html,iran,2025-12-07 13:47:13,Trump Undercuts John Bolton on North Korea and Iran ,neutral,0.2150055915117263,0.7383050322532654,0.0466893091797828,-0.1683162748813629,-0.1683162748813629,2019-05-28 20:45:29,DIPLOMACY,0.8,게시글 제목에서 트럼프가 존 볼턴의 입장을 약화시키며 북한과 이란에 대한 외교적 접근을 시사하고 있어 협상과 대화의 가능성을 강조하는 것으로 해석될 수 있습니다.
bu0h2c,I RAN FM Javad Zarif Full Interview on CNN after Donald Trump threatened to Officially End IRAN,,novonic,geopolitics,3,3,1559052590,/r/geopolitics/comments/bu0h2c/i_ran_fm_javad_zarif_full_interview_on_cnn_after/,https://m.youtube.com/watch?v=c1aLUWFtzA4&feature=youtu.be,iran,2025-12-07 13:47:13,I RAN FM Javad Zarif Full Interview on CNN after Donald Trump threatened to Officially End IRAN ,neutral,0.3918493688106537,0.5877191424369812,0.0204314701259136,-0.3714179098606109,-0.3714179098606109,2019-05-28 14:09:50,THREAT,0.9,게시글 제목에서 도널드 트럼프가 이란에 대한 위협을 언급하고 있어 군사적 위협과 관련된 내용을 강조하고 있다.
btbshp,What would a war with Iran be like?,"I understand on paper the US could probably defeat Iran and I also understand that Iran is the best in the world at Guerrilla warfare/Asymmetrical warfare.

A war with Iran would be very costly in terms of money and lives. With that being said, how could this actually play out?",Mjive45,geopolitics,88,247,1558897644,/r/geopolitics/comments/btbshp/what_would_a_war_with_iran_be_like/,https://www.reddit.com/r/geopolitics/comments/btbshp/what_would_a_war_with_iran_be_like/,iran,2025-12-07 13:47:13,"What would a war with Iran be like? I understand on paper the US could probably defeat Iran and I also understand that Iran is the best in the world at Guerrilla warfare/Asymmetrical warfare.

A war with Iran would be very costly in terms of money and lives. With that being said, how could this actually play out?",neutral,0.2109479457139969,0.6861684322357178,0.1028836220502853,-0.1080643236637115,-0.1080643236637115,2019-05-26 19:07:24,THREAT,0.85,게시글은 이란과의 전쟁 가능성과 그로 인한 비용을 강조하며 군사적 위협을 내포하고 있습니다.
bt4prs,"Iran has a weakening and un-diversified economy, how can they be seen as such a threat?","Iran seems to be having a very strong role in middle eastern geopolitics. How are they able to do so with their fragmenting economy and limited resources? Compared with the Gulf states, they are financially very weak yet have such a strong influence, apparently. Am I missing something, if true, then money clearly isn't everything?",SoybeanCola1933,geopolitics,86,27,1558851552,/r/geopolitics/comments/bt4prs/iran_has_a_weakening_and_undiversified_economy/,https://www.reddit.com/r/geopolitics/comments/bt4prs/iran_has_a_weakening_and_undiversified_economy/,iran,2025-12-07 13:47:13,"Iran has a weakening and un-diversified economy, how can they be seen as such a threat? Iran seems to be having a very strong role in middle eastern geopolitics. How are they able to do so with their fragmenting economy and limited resources? Compared with the Gulf states, they are financially very weak yet have such a strong influence, apparently. Am I missing something, if true, then money clearly isn't everything?",negative,0.5969099402427673,0.3819022476673126,0.0211877692490816,-0.5757221579551697,-0.5757221579551697,2019-05-26 06:19:12,ECONOMIC,0.8,"게시글은 이란의 경제적 약화와 자원 제한을 언급하며, 경제적 측면에서의 힘과 영향력에 대해 질문하고 있기 때문에 경제 프레임으로 분류된다."
bsrjlh,"Absent America, will China support Saudi Arabia over Iran?"," It is theorized America due to the internal strife, previous failed interventions, the fracking revolution and rise of automation, that it will take a less of role in policing the world. China has been a challenger to US power supporting nations like Iran and Syria. However it gets many of its oil from all of OPEC, and is a seller of weapons to Saudi Arabia.

In Yemen, it supported the Saudis over the Houthis. Will we see a more ""pro-Sunni"" alignment with China as it takes more of a global military role?",Warriormind556,geopolitics,13,10,1558766366,/r/geopolitics/comments/bsrjlh/absent_america_will_china_support_saudi_arabia/,https://www.reddit.com/r/geopolitics/comments/bsrjlh/absent_america_will_china_support_saudi_arabia/,iran,2025-12-07 13:47:13,"Absent America, will China support Saudi Arabia over Iran?  It is theorized America due to the internal strife, previous failed interventions, the fracking revolution and rise of automation, that it will take a less of role in policing the world. China has been a challenger to US power supporting nations like Iran and Syria. However it gets many of its oil from all of OPEC, and is a seller of weapons to Saudi Arabia.

In Yemen, it supported the Saudis over the Houthis. Will we see a more ""pro-Sunni"" alignment with China as it takes more of a global military role?",neutral,0.2570736110210418,0.7091337442398071,0.0337926149368286,-0.2232809960842132,-0.2232809960842132,2019-05-25 06:39:26,DIPLOMACY,0.7,"게시글은 중국과 사우디 아라비아 간의 관계와 미국의 역할 변화에 대해 논의하며, 협력 가능성을 암시하고 있습니다."
bsq19o,Are we inching closer to war with Iran?,[removed],CW19997,geopolitics,1,0,1558754662,/r/geopolitics/comments/bsq19o/are_we_inching_closer_to_war_with_iran/,https://www.reddit.com/r/geopolitics/comments/bsq19o/are_we_inching_closer_to_war_with_iran/,iran,2025-12-07 13:47:13,Are we inching closer to war with Iran? [removed],neutral,0.3462323844432831,0.6428886651992798,0.0108789261430501,-0.3353534638881683,-0.3353534638881683,2019-05-25 03:24:22,THREAT,0.9,"게시글 제목에서 '전쟁'이라는 단어가 사용되어 군사적 위협을 강조하고 있어, 전반적으로 군사적 긴장 상황을 암시하고 있습니다."
bsokes,"Pentagon will send 1,500 troops, along with drones and fighter jets to the Middle East to counter Iran threat",[deleted],[deleted],geopolitics,1,2,1558744888,/r/geopolitics/comments/bsokes/pentagon_will_send_1500_troops_along_with_drones/,https://www.cnbc.com/2019/05/24/pentagon-to-send-1500-troops-to-the-middle-east-to-counter-iran-threat.html,iran,2025-12-07 13:47:13,"Pentagon will send 1,500 troops, along with drones and fighter jets to the Middle East to counter Iran threat [deleted]",neutral,0.0541748292744159,0.8975654244422913,0.0482597164809703,-0.0059151127934455,-0.0059151127934455,2019-05-25 00:41:28,THREAT,0.9,게시글은 이란의 위협에 대응하기 위해 군사적 자원을 배치하는 내용을 다루고 있어 군사적 위협을 강조하고 있습니다.
bsghj2,"PM Imran, Iranian FM discuss Pak-Iran bilateral relations",,timelordeverywhere,geopolitics,14,12,1558701875,/r/geopolitics/comments/bsghj2/pm_imran_iranian_fm_discuss_pakiran_bilateral/,https://tribune.com.pk/story/1979611/1-iranian-fm-javad-zarif-meets-prime-minister-imran-in-islamabad/,iran,2025-12-07 13:47:13,"PM Imran, Iranian FM discuss Pak-Iran bilateral relations ",neutral,0.0072662611491978,0.8836131691932678,0.1091206595301628,0.1018543988466262,0.1018543988466262,2019-05-24 12:44:35,DIPLOMACY,0.8,게시글 제목에서 파키스탄과 이란의 양국 관계에 대한 논의가 언급되어 있어 협상과 대화의 가능성을 강조하는 것으로 해석될 수 있습니다.
bsf6fh,Why U.S.-Iran tensions could quickly escalate into a crisis,[deleted],[deleted],geopolitics,0,1,1558693252,/r/geopolitics/comments/bsf6fh/why_usiran_tensions_could_quickly_escalate_into_a/,https://www.reuters.com/article/us-usa-iran-communication-insight-idUSKCN1SU11V,iran,2025-12-07 13:47:13,Why U.S.-Iran tensions could quickly escalate into a crisis [deleted],negative,0.5719099640846252,0.4193253219127655,0.0087647158652544,-0.5631452202796936,-0.5631452202796936,2019-05-24 10:20:52,THREAT,0.9,게시글 제목에서 미국과 이란 간의 긴장이 위기로 빠질 수 있다는 점을 강조하고 있어 군사적 위협과 관련된 내용을 암시하고 있습니다.
bs8ijz,Was the war with Iran and all the Arab Spring countries planed in advance ?,,gillbeats,geopolitics,0,1,1558646678,/r/geopolitics/comments/bs8ijz/was_the_war_with_iran_and_all_the_arab_spring/,https://youtu.be/r8YtF76s-yM,iran,2025-12-07 13:47:13,Was the war with Iran and all the Arab Spring countries planed in advance ? ,neutral,0.2841973602771759,0.7001028060913086,0.0156998243182897,-0.2684975266456604,-0.2684975266456604,2019-05-23 21:24:38,THREAT,0.8,게시글 제목이 이란과 아랍의 봄 국가들과의 전쟁이 미리 계획되었는지를 묻고 있어 군사적 위협과 전쟁 위험을 암시하고 있다.
bs7ydl,Trump doubts he needs to send more troops to Middle East to counter Iran,[deleted],[deleted],geopolitics,13,3,1558643754,/r/geopolitics/comments/bs7ydl/trump_doubts_he_needs_to_send_more_troops_to/,https://www.jpost.com/Breaking-News/Trump-doubts-he-needs-to-send-more-troops-to-Middle-East-to-counter-Iran-590553,iran,2025-12-07 13:47:13,Trump doubts he needs to send more troops to Middle East to counter Iran [deleted],neutral,0.34386146068573,0.6430878639221191,0.0130506511777639,-0.3308108150959015,-0.3308108150959015,2019-05-23 20:35:54,THREAT,0.8,게시글은 이란에 대한 군사적 대응과 관련된 트럼프의 의구심을 다루고 있어 군사적 위협을 강조하는 내용으로 해석될 수 있다.
brtb50,Iran’s Qasem Soleimani is the Mastermind Preparing Proxy Armies for War With America,,SuccessfulOperation,geopolitics,7,9,1558554650,/r/geopolitics/comments/brtb50/irans_qasem_soleimani_is_the_mastermind_preparing/,https://www.thedailybeast.com/irans-qasem-soleimani-is-the-mastermind-preparing-proxy-armies-for-war-with-america,iran,2025-12-07 13:47:13,Iran’s Qasem Soleimani is the Mastermind Preparing Proxy Armies for War With America ,negative,0.6384972929954529,0.3495732247829437,0.0119294663891196,-0.6265678405761719,-0.6265678405761719,2019-05-22 19:50:50,THREAT,0.9,게시글 제목에서 이란의 군사적 위협과 미국과의 전쟁 위험을 강조하고 있어 위협 프레임으로 분류됨.
brs3uv,So have we been underestimating Trump with Iran politics? Like am I crazy to think Trump is at the best position right now?,"So something weird has been happening. Turkey is complying with US sanctions to Iran even tho it had butted heads with US on such issues as the S400. UAE, KSA, Israel have given almost absurd amount of restraint with their anti-Iran sentiment than its usually expected. EU has effective stopped caring anymore with special purpose vehicle. And Fox News and CNN are talking about “Bolton’s war”. And Russia seems weirdly nonchalant about Iran- instead focused more on Venezuela. And China has been cutting its imports from Iran- which is still going on with trade deal with the USA. 

Like it feels like everything is going for Trumps favor right now. If Iran stops compliance with the JCPOA, the world will turn on Iran more so than now and if it does comply with it, US still is crippling its economy and there is no way for it to survive for 10-15 years until sunset clauses expire. Iran doesn’t have a parasitic relationship with any nations like DPRK. 

So right now, Trump is in middle of a trade deal that China that desperately wants, with Huawei ban, and CTO in extradition process and DPRK opening up more than ever. 
Russia is straining itself with Syria, Iran, Venezuela, DPRK, Ukraine, Georgia, but most importantly, Russia does not have the economic power now oil need to help out Iran for its own purpose without cutting itself deep. Russia does benefit from expensive oil of its own when Iran cannot trade its cheaper crude.
Turkey, in middle of almost recession, having f35s blocked and tying for the EU membership and domestic policies like Istanbul win shows Erdogan is not as truly controlling. But, after US leaving Syria (I’m guessing Turkey feels was a gift from US), it would seem too much to then not send the favor to USA back. 

EU has been bit voiceful but the companies still have no opened up to Iran if they may lose US market either. And with Brexit debacle, where UK will probably side with US for a trade deal to heal Brexit, EU will have less tooth then. Especially when Trump keeps bring up NATO 2%. And after China, EU may be the new “new deal” time for Trump. Germany’s Auto sector is already sweating from sanctions with Nord stream 2. 

So if with all this, everything still fails, (Trump has said he doesn’t want war to his officers), it seems Fox News and Trump are ready to blame Bolton as the true mouth piece. 

It’s like a movie script of one sided power balance honestly.",Nosirt,geopolitics,25,86,1558548743,/r/geopolitics/comments/brs3uv/so_have_we_been_underestimating_trump_with_iran/,https://www.reddit.com/r/geopolitics/comments/brs3uv/so_have_we_been_underestimating_trump_with_iran/,iran,2025-12-07 13:47:13,"So have we been underestimating Trump with Iran politics? Like am I crazy to think Trump is at the best position right now? So something weird has been happening. Turkey is complying with US sanctions to Iran even tho it had butted heads with US on such issues as the S400. UAE, KSA, Israel have given almost absurd amount of restraint with their anti-Iran sentiment than its usually expected. EU has effective stopped caring anymore with special purpose vehicle. And Fox News and CNN are talking about “Bolton’s war”. And Russia seems weirdly nonchalant about Iran- instead focused more on Venezuela. And China has been cutting its imports from Iran- which is still going on with trade deal with the USA. 

Like it feels like everything is going for Trumps favor right now. If Iran stops compliance with the JCPOA, the world will turn on Iran more so than now and if it does comply with it, US still is crippling its economy and there is no way for it to survive for 10-15 years until sunset clauses expire. Iran doesn’t have a parasitic relationship with any nations like DPRK. 

So right now, Trump is in middle of a trade deal that China that desperately wants, with Huawei ban, and CTO in extradition process and DPRK opening up more than ever. 
Russia is straining itself with Syria, Iran, Venezuela, DPRK, Ukraine, Georgia, but most importantly, Russia does not have the economic power now oil need to help out Iran for its own purpose without cutting itself deep. Russia does benefit from expensive oil of its own when Iran cannot trade its cheaper crude.
Turkey, in middle of almost recession, having f35s blocked and tying for the EU membership and domestic policies like Istanbul win shows Erdogan is not as truly controlling. But, after US leaving Syria (I’m guessing Turkey feels was a gift from US), it would seem too much to then not send the favor to USA back. 

EU has been bit voiceful but the companies still have no opened up to Iran if they may lose US market either. And with Brexit debacle, where UK will probably side with US for a trade deal to heal Brexit, EU will have less tooth then. Especially when Trump keeps bring up NATO 2%. And after China, EU may be the new “new deal” time for Trump. Germany’s Auto sector is already sweating from sanctions with Nord stream 2. 

So if with all this, everything still fails, (Trump has said he doesn’t want war to his officers), it seems Fox News and Trump are ready to blame Bolton as the true mouth piece. 

It’s like a movie script of one sided power balance honestly.",negative,0.604527473449707,0.3744571805000305,0.0210153888911008,-0.5835120677947998,-0.5835120677947998,2019-05-22 18:12:23,ECONOMIC,0.8,게시글은 미국의 이란 제재와 관련된 여러 국가들의 반응을 언급하며 경제적 측면을 강조하고 있습니다.
brj3g0,"Trump suddenly reverses course on Iran, says there is ‘no indication’ of threats",,GoldenDesiderata,geopolitics,3,9,1558491087,/r/geopolitics/comments/brj3g0/trump_suddenly_reverses_course_on_iran_says_there/,https://thinkprogress.org/trump-says-no-indication-of-threat-from-iran-2084505cdbdb/,iran,2025-12-07 13:47:13,"Trump suddenly reverses course on Iran, says there is ‘no indication’ of threats ",neutral,0.1488944441080093,0.8078840374946594,0.043221578001976,-0.1056728661060333,-0.1056728661060333,2019-05-22 02:11:27,NEUTRAL,0.9,"게시글은 트럼프의 발언을 전달하고 있으며, 특정한 위협이나 협상, 경제적 측면을 강조하지 않고 중립적인 정보만을 제공하고 있다."
bremm8,Does anyone else suspect that the recent escalation with Iran has more to do with putting pressure on China's oil supply than anything they say Iran has actually done?,[removed],DukeOfCrydee,geopolitics,37,40,1558466437,/r/geopolitics/comments/bremm8/does_anyone_else_suspect_that_the_recent/,https://www.reddit.com/r/geopolitics/comments/bremm8/does_anyone_else_suspect_that_the_recent/,iran,2025-12-07 13:47:13,Does anyone else suspect that the recent escalation with Iran has more to do with putting pressure on China's oil supply than anything they say Iran has actually done? [removed],neutral,0.4624244272708893,0.5257972478866577,0.0117783341556787,-0.4506461024284363,-0.4506461024284363,2019-05-21 19:20:37,ECONOMIC,0.85,"게시글은 이란과의 긴장이 중국의 석유 공급에 대한 압박과 관련이 있다고 언급하며, 경제적 측면을 강조하고 있습니다."
bre3uw,"Despite rhetoric, Turkey complies with U.S. oil sanctions on Iran",,virtual1observer,geopolitics,280,44,1558463891,/r/geopolitics/comments/bre3uw/despite_rhetoric_turkey_complies_with_us_oil/,https://www.reuters.com/article/iran-oil-turkey/despite-rhetoric-turkey-complies-with-u-s-oil-sanctions-on-iran-idUSL5N22W3GK,iran,2025-12-07 13:47:13,"Despite rhetoric, Turkey complies with U.S. oil sanctions on Iran ",neutral,0.0482226125895977,0.8412419557571411,0.110535480082035,0.0623128674924373,0.0623128674924373,2019-05-21 18:38:11,ECONOMIC,0.9,게시글은 미국의 이란에 대한 석유 제재 준수에 대한 내용을 다루고 있어 경제적 측면을 강조하고 있습니다.
bre0fw,A Path to War With Iran: How Washington’s Escalation Could Lead to Unintended Catastrophe,,ForeignAffairsMag,geopolitics,12,15,1558463430,/r/geopolitics/comments/bre0fw/a_path_to_war_with_iran_how_washingtons/,https://www.foreignaffairs.com/articles/iran/2019-05-20/path-war-iran,iran,2025-12-07 13:47:13,A Path to War With Iran: How Washington’s Escalation Could Lead to Unintended Catastrophe ,negative,0.5514378547668457,0.4377737641334533,0.0107884230092167,-0.5406494140625,-0.5406494140625,2019-05-21 18:30:30,THREAT,0.9,게시글 제목에서 '전쟁 위험'과 '사고'를 언급하며 군사적 긴장을 강조하고 있기 때문입니다.
br8f3g,"Will the US go to war with Iran? Your 9 main questions, answered.",,Benny_36SXA71435461,geopolitics,176,116,1558432231,/r/geopolitics/comments/br8f3g/will_the_us_go_to_war_with_iran_your_9_main/,https://www.vox.com/2019/5/20/18628977/usa-iran-war-proxy-nuclear-oil,iran,2025-12-07 13:47:13,"Will the US go to war with Iran? Your 9 main questions, answered. ",neutral,0.0927967503666877,0.8786220550537109,0.0285811852663755,-0.064215563237667,-0.064215563237667,2019-05-21 09:50:31,THREAT,0.8,게시글 제목이 '전쟁 위험'에 대한 질문을 다루고 있어 군사적 위협을 강조하는 것으로 보임.
bqz38z,The USA do >not< actively provoke a conflict with Iran to get its oil!!!,[removed],petpah,geopolitics,1,1,1558375855,/r/geopolitics/comments/bqz38z/the_usa_do_not_actively_provoke_a_conflict_with/,https://www.reddit.com/r/geopolitics/comments/bqz38z/the_usa_do_not_actively_provoke_a_conflict_with/,iran,2025-12-07 13:47:13,The USA do >not< actively provoke a conflict with Iran to get its oil!!! [removed],negative,0.6358451843261719,0.3430356681346893,0.0211191903799772,-0.6147260069847107,-0.6147260069847107,2019-05-20 18:10:55,DIPLOMACY,0.8,게시글은 미국이 이란과의 갈등을 유발하지 않으려는 의도를 강조하고 있어 협상이나 대화의 가능성을 시사한다.
bqlvlo,"President Trump on Twitter just now: ""If Iran wants to fight, that will be the official end of Iran. Never threaten the United States again!""",[removed],contantofaz,geopolitics,87,51,1558298986,/r/geopolitics/comments/bqlvlo/president_trump_on_twitter_just_now_if_iran_wants/,https://www.reddit.com/r/geopolitics/comments/bqlvlo/president_trump_on_twitter_just_now_if_iran_wants/,iran,2025-12-07 13:47:13,"President Trump on Twitter just now: ""If Iran wants to fight, that will be the official end of Iran. Never threaten the United States again!"" [removed]",neutral,0.4321327209472656,0.5024366974830627,0.0654305517673492,-0.3667021691799164,-0.3667021691799164,2019-05-19 20:49:46,THREAT,0.9,게시글은 트럼프 대통령의 발언을 인용하며 이란에 대한 군사적 위협을 강조하고 있기 때문에 'THREAT' 프레임으로 분류됩니다.
bqetvi,The truth about Iran and Trump,,mikemann55,geopolitics,51,17,1558257077,/r/geopolitics/comments/bqetvi/the_truth_about_iran_and_trump/,https://v.redd.it/30gn0eujw4z21,iran,2025-12-07 13:47:13,The truth about Iran and Trump ,neutral,0.3111989796161651,0.6592963337898254,0.0295046400278806,-0.2816943526268005,-0.2816943526268005,2019-05-19 09:11:17,NEUTRAL,0.8,"게시글 제목이 특정한 주제를 다루고 있지만, 본문이 없어서 중립적인 정보 전달로 분류할 수 있음."
bq5cqk,"As a response to Iran's recent attacks - and lack of US response - Arab states are considering funding rebels and opposition inside Iran, to create a breakaway state in the Sunni-majority region of Ahwaz.",,happy221,geopolitics,11,35,1558194276,/r/geopolitics/comments/bq5cqk/as_a_response_to_irans_recent_attacks_and_lack_of/,https://pbs.twimg.com/media/D62qLxsWsAYvvcT.jpg,iran,2025-12-07 13:47:13,"As a response to Iran's recent attacks - and lack of US response - Arab states are considering funding rebels and opposition inside Iran, to create a breakaway state in the Sunni-majority region of Ahwaz. ",neutral,0.2763858735561371,0.7002944350242615,0.0233196839690208,-0.2530661821365356,-0.2530661821365356,2019-05-18 15:44:36,THREAT,0.85,게시글은 이란의 공격과 미국의 무응답에 대한 반응으로 아랍 국가들이 반군과 반대 세력을 지원하려는 계획을 언급하고 있어 군사적 위협과 전쟁 위험을 강조하고 있다.
