id,title,selftext,author,subreddit,score,num_comments,created_utc,permalink,url,topic,collection_date
b1wlz3,China Shields a Jihadist: Beijing blocks a U.N. attempt to sanction the Kashmir killer.,,NihiloEx,geopolitics,438,83,1552766441,/r/geopolitics/comments/b1wlz3/china_shields_a_jihadist_beijing_blocks_a_un/,https://www.wsj.com/articles/china-shields-a-jihadist-11552690459,china,2025-12-08 10:57:24
aq4f4a,"Hey mods, why was this post critical of China's treatment of Uighurs delisted 40 minutes after I posted it? Are you compromised by Beijing special interests too?",,athrowawayaccount55,geopolitics,0,3,1550046199,/r/geopolitics/comments/aq4f4a/hey_mods_why_was_this_post_critical_of_chinas/,https://www.reddit.com/r/geopolitics/comments/aq3ces/chinas_brutal_empire_xinjiang_and_the_uyghurs/,china,2025-12-08 10:57:24
a5poj3,Another Canadian Goes Missing in China After Former Diplomat Detained in Beijing,,seanDL_,geopolitics,49,22,1544672048,/r/geopolitics/comments/a5poj3/another_canadian_goes_missing_in_china_after/,https://www.thedailybeast.com/another-canadian-goes-missing-in-china-after-former-diplomat-detained-in-beijing,china,2025-12-08 10:57:24
a31iiy,"US-China Conflict Inevitable; But Beijing Prepared With Lessons From USSR Debacle | EurAsian Times: Latest Asian, Middle-East, EurAsian, Indian News",,eurasiantimesnews,geopolitics,1,0,1543936378,/r/geopolitics/comments/a31iiy/uschina_conflict_inevitable_but_beijing_prepared/,https://eurasiantimes.com/us-china-conflict-inevitable-but-beijing-prepared-with-lessons-from-ussr-debacle/,china,2025-12-08 10:57:24
9zwq8u,Has Duterte 'surrendered' to Beijing on the South China Sea,,nysom1227,geopolitics,14,29,1543046094,/r/geopolitics/comments/9zwq8u/has_duterte_surrendered_to_beijing_on_the_south/,https://www.dw.com/en/has-duterte-surrendered-to-beijing-on-the-south-china-sea/a-46390503,china,2025-12-08 10:57:24
9uekf3,China’s plan to tax global income facing opposition from US to Beijing,,brianscholar,geopolitics,1,4,1541432540,/r/geopolitics/comments/9uekf3/chinas_plan_to_tax_global_income_facing/,https://www.scmp.com/news/china/diplomacy/article/2171461/how-chinas-ambitious-plan-tax-global-income-faces-opposition-us#comments,china,2025-12-08 10:57:24
9oysoy,Beijing’s Nuclear Option: Why a U.S.-Chinese War Could Spiral Out of Control,,ForeignAffairsMag,geopolitics,8,27,1539783945,/r/geopolitics/comments/9oysoy/beijings_nuclear_option_why_a_uschinese_war_could/,https://www.foreignaffairs.com/articles/china/2018-10-15/beijings-nuclear-option,china,2025-12-08 10:57:24
9na51j,Beijing ‘looking into joining trans-Pacific trade pact’ to hedge against US,,TheGreatMountain,geopolitics,21,11,1539265892,/r/geopolitics/comments/9na51j/beijing_looking_into_joining_transpacific_trade/,https://www.scmp.com/news/china/diplomacy/article/2168147/beijing-looking-joining-trans-pacific-trade-pact-hedge-against,china,2025-12-08 10:57:24
9mm7km,Trump Reaches for Checkbook Diplomacy to Counter China: Washington ramps up development finance to offer countries an alternative to Beijing’s deep pockets.,,Rapsberry,geopolitics,21,6,1539060151,/r/geopolitics/comments/9mm7km/trump_reaches_for_checkbook_diplomacy_to_counter/,https://foreignpolicy.com/2018/10/08/trump-reaches-for-checkbook-diplomacy-to-counter-china/,china,2025-12-08 10:57:24
9h31pn,Beijing pushback just beginning,,Sir-Matilda,geopolitics,0,4,1537341646,/r/geopolitics/comments/9h31pn/beijing_pushback_just_beginning/,https://www.theaustralian.com.au/opinion/global-pushback-against-china-just-beginning/news-story/bd41e3e9d323d6fddfef6e23d8a6bd97,china,2025-12-08 10:57:24
9dg32n,"British Navy warship sails near South China Sea islands, angering Beijing",[deleted],[deleted],geopolitics,2,0,1536219714,/r/geopolitics/comments/9dg32n/british_navy_warship_sails_near_south_china_sea/,https://uk.reuters.com/article/uk-britain-china-southchinasea-exclusive/exclusive-british-navy-warship-sails-near-south-china-sea-islands-angering-beijing-idUKKCN1LM00V?rpc=401&,china,2025-12-08 10:57:24
9d78d2,"The China Hype: While Beijing’s military gains are impressive, their value fades in the circumstances we’re told to worry about.",,Mukhasim,geopolitics,63,26,1536158854,/r/geopolitics/comments/9d78d2/the_china_hype_while_beijings_military_gains_are/,https://www.defenseone.com/ideas/2018/09/china-hype/150996/,china,2025-12-08 10:57:24
997p7f,Taiwan says China 'out of control' as it loses El Salvador to Beijing,,yesterdaytomorrow321,geopolitics,278,134,1534890340,/r/geopolitics/comments/997p7f/taiwan_says_china_out_of_control_as_it_loses_el/,https://www.reuters.com/article/us-taiwan-diplomacy/taiwan-says-china-out-of-control-as-it-loses-el-salvador-to-beijing-idUSKCN1L6058,china,2025-12-08 10:57:24
978wlu,Chinese company buys Tijuana radio station to transmit broadcasts in Mandarin; the purchase has sparked fears that China will use the station to spread pro-Beijing propaganda to Chinese Americans,,Jackson3125,geopolitics,0,5,1534257595,/r/geopolitics/comments/978wlu/chinese_company_buys_tijuana_radio_station_to/,http://www.dailymail.co.uk/news/article-6056799/Chinese-investors-purchase-Mexican-radio-station.html,china,2025-12-08 10:57:24
95pzig,Trade war puts dent in Beijing’s plan to turn Hong Kong and surrounding cities into new Silicon Valley: announcement delayed to avoid backlash similar to reaction from Washington to Made in China 2025 plan,,Rapsberry,geopolitics,4,19,1533761838,/r/geopolitics/comments/95pzig/trade_war_puts_dent_in_beijings_plan_to_turn_hong/,https://www.scmp.com/news/hong-kong/politics/article/2158873/trade-war-puts-dent-beijings-plan-turn-hong-kong-and,china,2025-12-08 10:57:24
94rb28,How French ‘political messengers’ counter Beijing in South China Sea,,Jarijari7,geopolitics,12,2,1533469593,/r/geopolitics/comments/94rb28/how_french_political_messengers_counter_beijing/,https://www.scmp.com/news/china/diplomacy-defence/article/2157702/how-french-militarys-political-messengers-are,china,2025-12-08 10:57:24
927hk7,Did China think Trump was bluffing? How Beijing got it wrong,,This_Is_The_End,geopolitics,24,25,1532648761,/r/geopolitics/comments/927hk7/did_china_think_trump_was_bluffing_how_beijing/,https://www.scmp.com/news/china/diplomacy-defence/article/2157028/did-china-think-donald-trump-was-bluffing-trade-how,china,2025-12-08 10:57:24
919tap,Beijing lays down a gauntlet to Brussels in the Balkans,,ReichSmasher2018,geopolitics,0,11,1532371961,/r/geopolitics/comments/919tap/beijing_lays_down_a_gauntlet_to_brussels_in_the/,https://asia.nikkei.com/Opinion/Beijing-lays-down-a-gauntlet-to-Brussels-in-the-Balkans,china,2025-12-08 10:57:24
8y22fv,"‘Shocked’ by Latest U.S. Tariff Plan, Beijing Seeks Retaliatory Action",,portagul,geopolitics,7,4,1531333393,/r/geopolitics/comments/8y22fv/shocked_by_latest_us_tariff_plan_beijing_seeks/,https://www.wsj.com/articles/shocked-by-latest-u-s-tariffs-beijing-seeks-retaliatory-action-1531313522,china,2025-12-08 10:57:24
8rfg75,New Delhi and Beijing can build bridges despite the QUAD,,KingfisherPlayboy,geopolitics,29,7,1529106349,/r/geopolitics/comments/8rfg75/new_delhi_and_beijing_can_build_bridges_despite/,http://www.dnaindia.com/analysis/column-new-delhi-and-beijing-can-build-bridges-despite-the-quad-2625418,china,2025-12-08 10:57:24
8pry27,Putin arrives in Beijing for state visit with birthday buddy Xi Jinping,,fertileland,geopolitics,5,0,1528540157,/r/geopolitics/comments/8pry27/putin_arrives_in_beijing_for_state_visit_with/,https://edition.cnn.com/2018/06/08/asia/putin-china-beijing-state-visit-intl/index.html,china,2025-12-08 10:57:24
8p3ngd,"Since we're legally bound to defend Taiwan in the event of a Chinese invasion, should we keep troops in South Korea to keep Beijing and the Yellow Sea in check?",[removed],Captainmanic,geopolitics,2,30,1528313839,/r/geopolitics/comments/8p3ngd/since_were_legally_bound_to_defend_taiwan_in_the/,https://www.reddit.com/r/geopolitics/comments/8p3ngd/since_were_legally_bound_to_defend_taiwan_in_the/,china,2025-12-08 10:57:24
8ntgwa,"US disregards Beijing's nonsense, says it can take down South China Sea islands",,dtlv5813,geopolitics,0,37,1527871932,/r/geopolitics/comments/8ntgwa/us_disregards_beijings_nonsense_says_it_can_take/,https://amp.businessinsider.com/us-disregards-beijing-nonsense-says-it-can-destroy-south-china-sea-2018-6,china,2025-12-08 10:57:24
8miqo8,U.S. warships sail near South China Sea islands claimed by Beijing,[deleted],[deleted],geopolitics,6,1,1527437493,/r/geopolitics/comments/8miqo8/us_warships_sail_near_south_china_sea_islands/,https://www.reuters.com/article/us-usa-china-military-exclusive/exclusive-u-s-warships-sail-near-south-china-sea-islands-claimed-by-beijing-idUSKCN1IS07W,china,2025-12-08 10:57:24
8k43da,Is North Korea Going to Withdraw from the Summit? The Answer Is In Beijing,,patronicous,geopolitics,0,16,1526562312,/r/geopolitics/comments/8k43da/is_north_korea_going_to_withdraw_from_the_summit/,http://criticalspectator.com/politics/is-north-korea-going-to-withdraw-from-the-summit-the-answer-is-in-beijing,china,2025-12-08 10:57:24
8giyf9,Most Latin Americans Can’t Name a Chinese Singer. Why That’s Great for Beijing.,,josuealvo,geopolitics,10,51,1525280186,/r/geopolitics/comments/8giyf9/most_latin_americans_cant_name_a_chinese_singer/,http://www.americasquarterly.org/content/most-latin-americans-cant-name-chinese-singers-great-beijing,china,2025-12-08 10:57:24
8evtwo,Did india make a big mistake by confronting China in dhoklam issue? Is the new Delhi playing the underdog to Beijing after realising the mistake?,[removed],Shiva_uchiha,geopolitics,1,0,1524680594,/r/geopolitics/comments/8evtwo/did_india_make_a_big_mistake_by_confronting_china/,https://www.reddit.com/r/geopolitics/comments/8evtwo/did_india_make_a_big_mistake_by_confronting_china/,china,2025-12-08 10:57:24
89at4u,Kim Jong-un’s Beijing Trip: China-North Korea Relationship is Still “Special”,,Ippreview,geopolitics,1,1,1522737803,/r/geopolitics/comments/89at4u/kim_jonguns_beijing_trip_chinanorth_korea/,http://ippreview.com/index.php/Blog/single/id/680.html,china,2025-12-08 10:57:24
87dbvx,Has Kim Jong-un taken a train to Beijing?,,EnergyEnthusiast,geopolitics,8,1,1522103338,/r/geopolitics/comments/87dbvx/has_kim_jongun_taken_a_train_to_beijing/,http://www.bbc.com/news/world-asia-43547044,china,2025-12-08 10:57:24
87b6xl,Kim Jong-un ‘is in Beijing on first-known trip outside North Korea since 2011’ ahead of possible US meeting say multiple sources,,DaBIGmeow888,geopolitics,294,43,1522087215,/r/geopolitics/comments/87b6xl/kim_jongun_is_in_beijing_on_firstknown_trip/,http://www.scmp.com/news/china/diplomacy-defence/article/2138985/high-ranking-north-korean-official-said-be-visiting,china,2025-12-08 10:57:24
7ylrsy,Scoop: Skirmish in Beijing over the nuclear football,,nietzscheanhammer,geopolitics,0,11,1519036153,/r/geopolitics/comments/7ylrsy/scoop_skirmish_in_beijing_over_the_nuclear/,https://www.axios.com/scoop-skirmish-in-beijing-over-the-nuclear-football-1518992774-1e7a513d-4190-459d-ad4f-2c8746fecc6f.html,china,2025-12-08 10:57:24
7vht66,On the Vatican’s Reported Capitulation to Beijing On the Vatican’s Reported Capitulation to Beijing,[deleted],[deleted],geopolitics,1,0,1517863407,/r/geopolitics/comments/7vht66/on_the_vaticans_reported_capitulation_to_beijing/,http://www.nationalreview.com/article/456107/vatican-china-dispute-church-capitulates-naming-bishops,china,2025-12-08 10:57:24
7ku0tk,Vietnam Follows Beijing With South China Sea Upgrades of Its Own,,ProConsulGorba,geopolitics,8,7,1513698144,/r/geopolitics/comments/7ku0tk/vietnam_follows_beijing_with_south_china_sea/,https://www.bloomberg.com/news/articles/2017-12-17/vietnam-follows-beijing-with-south-china-sea-upgrades-of-its-own,china,2025-12-08 10:57:24
7gdvv4,"China: unveiled the Dongfeng-41, Beijing’s next-gen Intercontinental Ballistic Missile",,silverf0x001,geopolitics,67,35,1511967934,/r/geopolitics/comments/7gdvv4/china_unveiled_the_dongfeng41_beijings_nextgen/,https://www.tbglobalist.com/2017/11/29/china-unveiled-intercontinental-ballistic-missiles/,china,2025-12-08 10:57:24
7a36o0,"If the Russian Federation would propose its Far East region for sale to the People’s Republic of China for $500 billion, would Beijing accept Kremlin's offer?","Sorry for my English, please.

Details of my request:

I'm not speaking about the probability of such proposition by Russian. I do understands, this probability is somewhere very-very near 0%. What I am asking for and interested in, is **the Chinese government reaction on it.**

Russian Far East the name of historical region, terrestrially almost identical to the current administrative division called [Far Eastern Federal District](https://en.wikipedia.org/wiki/Far_Eastern_Federal_District). 

You also can look at the [Russian Far East map](https://i.imgur.com/Op6cxak.jpg).
Population: around 6 million people, or 4% of Russian total population.
Area: around 6,200,000 square kilometers, or 36% of total Russian area.

Assume that Russian proposition include such unconditional provisions:

- $500 billion, direct compensation to Russian government;
- immediate Chinese citizenship to every resident of Far East region, if such resident claims his/her will to receive Chinese citizenship;
- $100 thousand given to every person who wish to relocate to Russian proper territories and would reject Chinese citizenship + compensation for property and untransferable assets at the full market prices of year before;
- $20 thousand given to every person who wish to stay in Far East region, receive immediate Chinese citizenship and renounce the Russian citizenship, after Chinese authorities receive proof of such renunciation;
- 10 years citizenry deferral period, during which residents of Far East region are allowed to hold two citizenship's (however, not receiving any transition bonus/compensation mentioned above). After 10 years governments of China and Russia are allowed to denounce citizenship of non-resident dual citizens;
- every Chinese citizen, who was Russian citizen and legal resident of Far Eastern Federal District at the moment of sovereignty transition, would be provided with social protections at levels not below levels of the same year in Russia, with no time limits, forever: pensions, medical care, etc. (For example: government pension to certain category of retirees in China is lower than in Russia, then China will pay higher pension to its citizens of this categories, who were Russian citizens and FEDF residents at the time of transition);
- $150 billion would be payed for the Pacific Fleet of the Russian Navy and all military infrastructure of the region, excluding nuclear arsenal, which would be relocated to the Russian proper territory at Chinese expenses.

In total it bring us no less than $1 trillion.
But consider: territory of Russian Far East - 6,2 million square kilometers. Territory of China - 9,5 million square kilometer.

How do you think, would Chinese government agree or reject such offer?

Thanks.
Once again, sorry for my English.",Evgeneey,geopolitics,10,26,1509538659,/r/geopolitics/comments/7a36o0/if_the_russian_federation_would_propose_its_far/,https://www.reddit.com/r/geopolitics/comments/7a36o0/if_the_russian_federation_would_propose_its_far/,china,2025-12-08 10:57:24
6wlkfs,"Doklam standoff ends: India pulls troops, no word on Beijing’s road along border",[removed],Canchito,geopolitics,2,1,1503946916,/r/geopolitics/comments/6wlkfs/doklam_standoff_ends_india_pulls_troops_no_word/,https://www.reddit.com/r/geopolitics/comments/6wlkfs/doklam_standoff_ends_india_pulls_troops_no_word/,china,2025-12-08 10:57:24
6v73rm,South China Sea: Beijing raises the temperature again,,tayaravaknin,geopolitics,0,16,1503359145,/r/geopolitics/comments/6v73rm/south_china_sea_beijing_raises_the_temperature/,https://www.lowyinstitute.org/the-interpreter/china-raises-temperature-again-south-china-sea,china,2025-12-08 10:57:24
6sfehw,"Vietnam, Yielding to Beijing, Backs Off South China Sea Drilling",,youdidntreddit,geopolitics,25,4,1502216479,/r/geopolitics/comments/6sfehw/vietnam_yielding_to_beijing_backs_off_south_china/,https://www.nytimes.com/2017/08/04/world/asia/vietnam-south-china-sea-repsol.html?_r=0,china,2025-12-08 10:57:24
6q1kgw,India and Pakistan's SCO membership: a Beijing-Moscow proxy struggle,,papa4444,geopolitics,62,9,1501216991,/r/geopolitics/comments/6q1kgw/india_and_pakistans_sco_membership_a/,http://www.foreignbrief.com/multilateral/sco-membership-beijing-moscow-proxy-power-struggle,china,2025-12-08 10:57:24
6ha28k,Chinese investment in Africa: Beijing's testing ground,,leeyuuh,geopolitics,164,24,1497470721,/r/geopolitics/comments/6ha28k/chinese_investment_in_africa_beijings_testing/,https://www.ft.com/content/0f534aa4-4549-11e7-8519-9f94ee97d996,china,2025-12-08 10:57:24
6e7qkv,"In the South China Sea, the U.S. is Struggling to Halt Beijing’s Advance",,dieyoufool3,geopolitics,32,57,1496155264,/r/geopolitics/comments/6e7qkv/in_the_south_china_sea_the_us_is_struggling_to/,http://foreignpolicy.com/2017/05/25/in-the-south-china-sea-the-u-s-is-struggling-to-halt-beijings-advance/,china,2025-12-08 10:57:24
6dami9,U.S. Warship Sails Near Island Claimed by Beijing in South China Sea,,Die-Nacht,geopolitics,38,37,1495728885,/r/geopolitics/comments/6dami9/us_warship_sails_near_island_claimed_by_beijing/,https://www.nytimes.com/2017/05/24/world/asia/south-china-sea-us-navy-warship-spratly-islands.html,china,2025-12-08 10:57:24
60z284,Tillerson’s Beijing Visit Was a Home Run for China: State Media,,OmarBinGhazaliAMA,geopolitics,48,18,1490233895,/r/geopolitics/comments/60z284/tillersons_beijing_visit_was_a_home_run_for_china/,http://www.nbcnews.com/news/china/tillerson-s-beijing-visit-declared-home-run-china-state-media-n735626,china,2025-12-08 10:57:24
5ypcfp,Beijing says it has reached agreement with ASEAN over disputed South China Sea,,CADBP,geopolitics,29,7,1489186153,/r/geopolitics/comments/5ypcfp/beijing_says_it_has_reached_agreement_with_asean/,http://www.adelaidenow.com.au/news/world/beijing-says-it-has-reached-agreement-with-asean-over-disputed-south-china-sea/news-story/5d44717d3b50a90761e1fa59c2ea1b65,china,2025-12-08 10:57:24
5prc04,Beijing Is No Champion of Globalization,,Orc_of_sauron,geopolitics,8,10,1485202465,/r/geopolitics/comments/5prc04/beijing_is_no_champion_of_globalization/,https://www.foreignaffairs.com/articles/china/2017-01-22/beijing-no-champion-globalization,china,2025-12-08 10:57:24
5onm6d,"As Trump era looms, Beijing fortifies the South China Sea",[deleted],[deleted],geopolitics,1,0,1484718293,/r/geopolitics/comments/5onm6d/as_trump_era_looms_beijing_fortifies_the_south/,http://howdyearth.com/trump-era-looms-beijing-fortifies-south-china-sea/,china,2025-12-08 10:57:24
5lztwr,"Fuming over perceived U.S. slight, Duterte says he will set aside South China Sea ruling against Beijing | The Japan Times",,Usernamemeh,geopolitics,15,11,1483545044,/r/geopolitics/comments/5lztwr/fuming_over_perceived_us_slight_duterte_says_he/,http://www.japantimes.co.jp/news/2016/12/17/asia-pacific/philippines-duterte-says-bye-bye-america-delayed-aid-package/#.WG0ZV_A8KEe,china,2025-12-08 10:57:24
bxmhjh,The Perfect Storm Confronting Xi Jinping,,EtCustodIpsosCustod,geopolitics,0,46,1559857730,/r/geopolitics/comments/bxmhjh/the_perfect_storm_confronting_xi_jinping/,https://warontherocks.com/2019/06/the-perfect-storm-confronting-xi-jinping/,china,2025-12-08 10:57:24
bpjvum,How Xi Jinping's Colleagues Rejected an Unequal Trade Deal,,i-am-automaton,geopolitics,42,50,1558050001,/r/geopolitics/comments/bpjvum/how_xi_jinpings_colleagues_rejected_an_unequal/,https://asia.nikkei.com/Editor-s-Picks/China-up-close/How-Xi-Jinping-s-colleagues-rejected-an-unequal-trade-deal,china,2025-12-08 10:57:24
bpjful,How Xi’s Last-Minute Switch on U.S.-China Trade Deal Upended It - Xi Jinping miscalculated President Trump’s willingness to accept a changed deal. Now angry rhetoric could complicate efforts to return to negotiations.,,CurlyWurly20,geopolitics,11,9,1558047490,/r/geopolitics/comments/bpjful/how_xis_lastminute_switch_on_uschina_trade_deal/,https://www.nytimes.com/2019/05/16/world/asia/trade-xi-jinping-trump-china-united-states.html,china,2025-12-08 10:57:24
blneep,Xi Jinping Wanted Global Dominance. He Overshot.,,CurlyWurly20,geopolitics,0,14,1557211233,/r/geopolitics/comments/blneep/xi_jinping_wanted_global_dominance_he_overshot/,https://www.nytimes.com/2019/05/07/opinion/xi-trump-trade-war-china-leadership.html?action=click&module=Opinion&pgtype=Homepage,china,2025-12-08 10:57:24
bhp5wb,Talk - Xi Jinping's Third Revolution and the Future of U.S.-China Relations,,LockedOutOfElfland,geopolitics,8,4,1556300504,/r/geopolitics/comments/bhp5wb/talk_xi_jinpings_third_revolution_and_the_future/,https://www.youtube.com/watch?v=mTBLKtRz-sA&feature=youtu.be&fbclid=IwAR0MMoO5RJt-k-u2siVqWXN6ZKn879wfjSQwRn26nCbjDLP8KNguVq1SqXU,china,2025-12-08 10:57:24
bhbst3,Xi Jinping's Rocket Force is nullifying U.S. military primacy in Asia,,SuccessfulOperation,geopolitics,280,106,1556215510,/r/geopolitics/comments/bhbst3/xi_jinpings_rocket_force_is_nullifying_us/,https://www.reuters.com/investigates/special-report/china-army-rockets/,china,2025-12-08 10:57:24
b630ot,Xi Jinping in Europe: A Tale of 2 Countries,[deleted],[deleted],geopolitics,1,1,1553684157,/r/geopolitics/comments/b630ot/xi_jinping_in_europe_a_tale_of_2_countries/,https://thediplomat.com/2019/03/xi-jinping-in-europe-a-tale-of-2-countries/,china,2025-12-08 10:57:24
aldh2o,Magic Weapons: China's political influence activities under Xi Jinping,[deleted],[deleted],geopolitics,0,1,1548860417,/r/geopolitics/comments/aldh2o/magic_weapons_chinas_political_influence/,https://www.wilsoncenter.org/article/magic-weapons-chinas-political-influence-activities-under-xi-jinping,china,2025-12-08 10:57:24
aidvsi,Former China Envoys Call on Xi Jinping to Release Two Detained Canadians,,Otisthealleycat,geopolitics,13,10,1548099872,/r/geopolitics/comments/aidvsi/former_china_envoys_call_on_xi_jinping_to_release/,https://www.theguardian.com/world/2019/jan/21/former-china-envoys-call-on-xi-jinping-to-release-two-detained-canadians,china,2025-12-08 10:57:24
ag1kjm,Xi Jinping will Give Donald Trump a Victory on Trade - Graham Allison,,DukeofDixieland,geopolitics,25,20,1547506605,/r/geopolitics/comments/ag1kjm/xi_jinping_will_give_donald_trump_a_victory_on/,https://nationalinterest.org/feature/xi-jinping-will-give-donald-trump-victory-trade-41257,china,2025-12-08 10:57:24
abn9wt,The Book That Prevents China’s President Xi Jinping from sleeping! And Why You Must read it!,,Paekches_Principle,geopolitics,0,4,1546385178,/r/geopolitics/comments/abn9wt/the_book_that_prevents_chinas_president_xi/,https://v.redd.it/l9vk92mlaw721,china,2025-12-08 10:57:24
aasd5o,Inside Xi Jinping’s Plan to Dominate the World,,7hr0w4w4y_00,geopolitics,0,3,1546141351,/r/geopolitics/comments/aasd5o/inside_xi_jinpings_plan_to_dominate_the_world/,https://www.bloomberg.com/opinion/articles/2018-12-28/xi-jinping-s-plan-for-china-to-dominate-the-world,china,2025-12-08 10:57:24
aa48o1,The Book That Keeps China's Xi Jinping from Sleeping!,,Paekches_Principle,geopolitics,0,10,1545951618,/r/geopolitics/comments/aa48o1/the_book_that_keeps_chinas_xi_jinping_from/,https://v.redd.it/vsy0uif9hw621,china,2025-12-08 10:57:24
a8a87y,The World According to Xi Jinping | ARTE in English,,Orolol,geopolitics,82,17,1545400716,/r/geopolitics/comments/a8a87y/the_world_according_to_xi_jinping_arte_in_english/,https://www.arte.tv/en/videos/078193-000-A/the-world-according-to-xi-jinping/,china,2025-12-08 10:57:24
9ymezv,"After Pence’s China warning, Xi Jinping writes an affectionate letter to the Philippines",,NeatConnection,geopolitics,0,14,1542671123,/r/geopolitics/comments/9ymezv/after_pences_china_warning_xi_jinping_writes_an/,https://qz.com/1468230/chinas-xi-jinping-writes-affectionate-letter-to-philippines-before-first-state-visit/,china,2025-12-08 10:57:24
9rdldf,"Who is Xi Jinping, the man?","As a westerner, I read a lot about and feel I have a good grasp of the personalities of most of the world's prominent leaders (Obama, Trump, Putin, Modi, Merkel, Macron, May, Trudeau, Erdogan, MBS, AMLO, etc). I could tell you things about their character, their reputation, their background, motivations, etc.

&#x200B;

I would be at something of a loss, however, if asked to describe the *personality* of Xi Jinping. [This recent NYT article](https://www.nytimes.com/2018/03/05/world/asia/xi-jinping-china-leader.html) reflects my sentiment. What is he like, personally? What is the nature of his disposition, mannerisms, relationships, friendships, and family life? How does he make decisions? Who is his closest historical or contemporary comparison in this sense?",jack732,geopolitics,218,63,1540496698,/r/geopolitics/comments/9rdldf/who_is_xi_jinping_the_man/,https://www.reddit.com/r/geopolitics/comments/9rdldf/who_is_xi_jinping_the_man/,china,2025-12-08 10:57:24
