id,title,selftext,author,subreddit,score,num_comments,created_utc,permalink,url,topic,collection_date
c60nuk,"Donald Trump leaves for G20 Summit, to meet Narendra Modi, Xi Jinping and Vladimir Putin",,db2920,worldnews,2,1,1561607627,/r/worldnews/comments/c60nuk/donald_trump_leaves_for_g20_summit_to_meet/,https://www.indiatoday.in/world/story/trump-leaves-for-summit-meet-modi-xi-putin-1556914-2019-06-27,china,2025-12-08 10:57:24
c5k8sa,More Australians trust Xi Jinping than Trump,,[deleted],worldnews,798,345,1561518715,/r/worldnews/comments/c5k8sa/more_australians_trust_xi_jinping_than_trump/,https://edition.cnn.com/2019/06/25/australia/australia-china-us-trump-intl-hnk/index.html,china,2025-12-08 10:57:24
c5dyf7,Trump isn’t the only major world leader who will challenge China’s Xi Jinping at the G20 meeting,,viralupfeed,worldnews,1,0,1561491621,/r/worldnews/comments/c5dyf7/trump_isnt_the_only_major_world_leader_who_will/,https://viralupfeed.com/trump-isnt-the-only-major-world-leader-who-will-challenge-chinas-xi-jinping-at-the-g20-meeting/,china,2025-12-08 10:57:24
c3zsfq,"People power will test Xi Jinping, but he can wait it out.",,LazyPieceOfFlesh,worldnews,5,2,1561268537,/r/worldnews/comments/c3zsfq/people_power_will_test_xi_jinping_but_he_can_wait/,https://www.smh.com.au/world/asia/people-power-will-test-xi-jinping-but-he-can-wait-it-out-20190620-p51zpf.html,china,2025-12-08 10:57:24
c3j8np,"North Korean leader Kim Jong Un and China’s President Xi Jinping reached a consensus on “important issues,” and agreed on Friday they will carry forward friendly relations “whatever the international situation,” North Korean state media KCNA said on Saturday.",,madam1,worldnews,15,1,1561165611,/r/worldnews/comments/c3j8np/north_korean_leader_kim_jong_un_and_chinas/,https://www.reuters.com/article/us-northkorea-china/kim-xi-reach-consensus-to-develop-relations-no-matter-the-international-situation-kcna-idUSKCN1TM2P2?feedType=RSS&feedName=topNews,china,2025-12-08 10:57:24
c3j7at,The Quick Read About… President Xi Jinping’s Trip to North Korea,,meenayzain032,worldnews,1,1,1561165377,/r/worldnews/comments/c3j7at/the_quick_read_about_president_xi_jinpings_trip/,http://www.topnewstrends.tk/2019/06/the-quick-read-about-president-xi.html,china,2025-12-08 10:57:24
c36uno,"Kim Jong Un and Xi Jinping Have Discussed Korean Peninsula Issues, the North's State Media Says",,imstayinalive,worldnews,14,4,1561096542,/r/worldnews/comments/c36uno/kim_jong_un_and_xi_jinping_have_discussed_korean/,https://time.com/5611787/north-korea-kim-jong-un-china-xi-jinping-meeting/,china,2025-12-08 10:57:24
c351zr,Former Philippine Foreign Secretary who filed a case against Xi Jinping is currently being held at Hong Kong Airport,,Lexidoge,worldnews,91,12,1561084818,/r/worldnews/comments/c351zr/former_philippine_foreign_secretary_who_filed_a/,https://globalnation.inquirer.net/176726/ex-foreign-secretary-del-rosario-held-questioned-at-hong-kong-airport,china,2025-12-08 10:57:24
c2uagp,"Xi Jinping Arrives in North Korea, With Many Eyes on Trump",,dorafins,worldnews,3,2,1561025960,/r/worldnews/comments/c2uagp/xi_jinping_arrives_in_north_korea_with_many_eyes/,https://www.nytimes.com/2019/06/20/world/asia/xi-jinping-china-north-korea.html,china,2025-12-08 10:57:24
c2sl25,Xi Jinping visits N Korea to boost China's ties with Kim,,divansh_mehta11,worldnews,7,1,1561012580,/r/worldnews/comments/c2sl25/xi_jinping_visits_n_korea_to_boost_chinas_ties/,https://www.bbc.com/news/world-asia-48672306,china,2025-12-08 10:57:24
c2r54z,Xi Jinping visits N Korea to boost China's ties with Kim,,usmanjuttg,worldnews,5,5,1561002793,/r/worldnews/comments/c2r54z/xi_jinping_visits_n_korea_to_boost_chinas_ties/,https://www.bbc.com/news/world-asia-48672306,china,2025-12-08 10:57:24
c2qwvx,Xi Jinping lands in North Korea to meet Kim ahead of Trump talks,,poclee,worldnews,2,3,1561001331,/r/worldnews/comments/c2qwvx/xi_jinping_lands_in_north_korea_to_meet_kim_ahead/,https://www.theguardian.com/world/2019/jun/20/xi-jinping-north-korea-kim-jong-un-nuclear-trump-talks-g20,china,2025-12-08 10:57:24
c2qtl4,Xi Jinping visits N Korea to boost China's ties with Kim,,imstayinalive,worldnews,3,2,1561000768,/r/worldnews/comments/c2qtl4/xi_jinping_visits_n_korea_to_boost_chinas_ties/,https://www.bbc.com/news/world-asia-48672306,china,2025-12-08 10:57:24
c2o4zh,Xi Jinping Says Pyongyang Is Moving in the 'Right Direction' Ahead of His Visit to North Korea,,princey12,worldnews,7,9,1560985522,/r/worldnews/comments/c2o4zh/xi_jinping_says_pyongyang_is_moving_in_the_right/,https://time.com/5609795/xi-china-support-north-korea-visit/,china,2025-12-08 10:57:24
c2d3qr,"China's Xi Jinping to reportedly give Kim Jong Un 10,000 tons of food to feed his hungry people",,PepeBabinski,worldnews,7,15,1560922661,/r/worldnews/comments/c2d3qr/chinas_xi_jinping_to_reportedly_give_kim_jong_un/,https://www.newsweek.com/china-north-korea-food-kim-jong-un-1444610,china,2025-12-08 10:57:24
c23nu1,Xi Jinping to make first official visit to North Korea,[deleted],[deleted],worldnews,1,1,1560871909,/r/worldnews/comments/c23nu1/xi_jinping_to_make_first_official_visit_to_north/,https://edition.cnn.com/2019/06/17/asia/xi-jinping-north-korea-visit-intl/index.html,china,2025-12-08 10:57:24
c1z1ol,Chinese President Xi Jinping To Visit North Korea This Week,,gamung,worldnews,1,8,1560841458,/r/worldnews/comments/c1z1ol/chinese_president_xi_jinping_to_visit_north_korea/,https://www.npr.org/2019/06/17/733343002/chinese-president-xi-jinping-to-visit-north-korea-this-week,china,2025-12-08 10:57:24
c1u62o,Hong Kong's Retreat Chips Away at Xi Jinping's Iron Image,[deleted],[deleted],worldnews,1,1,1560810673,/r/worldnews/comments/c1u62o/hong_kongs_retreat_chips_away_at_xi_jinpings_iron/,https://www.nytimes.com/2019/06/16/world/asia/hong-kong-xi-jinping.html,china,2025-12-08 10:57:24
c1ttpj,Chinese President Xi Jinping to make first official visit to North Korea,,imstayinalive,worldnews,13,5,1560809021,/r/worldnews/comments/c1ttpj/chinese_president_xi_jinping_to_make_first/,https://www.cnn.com/2019/06/17/asia/xi-jinping-north-korea-visit-intl/index.html,china,2025-12-08 10:57:24
c1rper,China's Xi Jinping to make first state visit to North Korea,,ahmad3093,worldnews,5,0,1560798720,/r/worldnews/comments/c1rper/chinas_xi_jinping_to_make_first_state_visit_to/,https://www.bbc.co.uk/news/world-asia-48666423,china,2025-12-08 10:57:24
c1qjrz,Chinese President Xi Jinping to visit North Korea from June 20 to 21,,ChocolaWeeb,worldnews,2,1,1560793175,/r/worldnews/comments/c1qjrz/chinese_president_xi_jinping_to_visit_north_korea/,https://www.nknews.org/2019/06/chinese-president-xi-jinping-to-visit-north-korea-from-june-20-to-21/?c=1560773121468,china,2025-12-08 10:57:24
c1q8n5,Chinese President Xi Jinping to visit North Korea: Xi Jinping is set to become the first Chinese president to travel to North Korea in 14 years. The visit comes as denuclearization talks between North Korea and the United States appear to be at a standstill,,DoremusJessup,worldnews,10,1,1560791724,/r/worldnews/comments/c1q8n5/chinese_president_xi_jinping_to_visit_north_korea/,https://www.dw.com/en/chinese-president-xi-jinping-to-visit-north-korea/a-49234526,china,2025-12-08 10:57:24
c1mohi,China’s Xi Jinping to visit North Korea this week,,AllenGinsberg3,worldnews,6,0,1560772873,/r/worldnews/comments/c1mohi/chinas_xi_jinping_to_visit_north_korea_this_week/,https://www.pbs.org/newshour/world/chinas-xi-jinping-to-visit-north-korea-this-week,china,2025-12-08 10:57:24
c1mlxc,Chinese President Xi Jinping to make first official trip to North Korea this week,,DonVox,worldnews,6,0,1560772384,/r/worldnews/comments/c1mlxc/chinese_president_xi_jinping_to_make_first/,https://www.scmp.com/news/china/diplomacy/article/3014898/chinese-president-xi-jinping-make-first-official-trip-north,china,2025-12-08 10:57:24
c1j17a,"Donald Trump to raise Hong Kong extradition protests with Xi Jinping at G20, Mike Pompeo says",,imstayinalive,worldnews,39,15,1560744139,/r/worldnews/comments/c1j17a/donald_trump_to_raise_hong_kong_extradition/,https://www.scmp.com/news/hong-kong/article/3014740/donald-trump-raise-hong-kong-extradition-protests-xi-jinping-g20,china,2025-12-08 10:57:24
c0o1bp,Donald Trump says ‘it doesn’t matter’ if Xi Jinping agrees to meeting at G20 because US is ‘collecting billions in tariffs’ from China,,ScaryChange,worldnews,637,235,1560539601,/r/worldnews/comments/c0o1bp/donald_trump_says_it_doesnt_matter_if_xi_jinping/,https://www.scmp.com/news/china/article/3014618/donald-trump-says-it-doesnt-matter-if-xi-jinping-agrees-meeting-g20,china,2025-12-08 10:57:24
by5gtp,"Chinese President Xi Jinping had the ultimate tour guide on his visit to the St. Petersburg International Economic Forum this week: His ""bosom friend,"" Russian President Vladimir Putin.",,murryburry73,worldnews,2,0,1559978681,/r/worldnews/comments/by5gtp/chinese_president_xi_jinping_had_the_ultimate/,https://edition.cnn.com/2019/06/08/europe/putin-xi-st-petersburg-intl/index.html,china,2025-12-08 10:57:24
bx9pqy,China’s Xi Jinping visits ‘best friend’ Vladimir Putin,,viralupfeed,worldnews,1,0,1559778498,/r/worldnews/comments/bx9pqy/chinas_xi_jinping_visits_best_friend_vladimir/,https://viralupfeed.com/chinas-xi-jinping-visits-best-friend-vladimir-putin/,china,2025-12-08 10:57:24
bx9n2n,China’s Xi Jinping visits ‘best friend’ Vladimir Putin,,tnewst,worldnews,1,1,1559778073,/r/worldnews/comments/bx9n2n/chinas_xi_jinping_visits_best_friend_vladimir/,https://tnewst.com/chinas-xi-jinping-visits-best-friend-vladimir-putin/,china,2025-12-08 10:57:24
bx9mnw,China’s Xi Jinping visits ‘best friend’ Vladimir Putin,,viralnewsdrift,worldnews,1,0,1559778008,/r/worldnews/comments/bx9mnw/chinas_xi_jinping_visits_best_friend_vladimir/,https://viralnewsdrift.com/chinas-xi-jinping-visits-best-friend-vladimir-putin/,china,2025-12-08 10:57:24
bx9ma6,China’s Xi Jinping visits ‘best friend’ Vladimir Putin,,trendnewsworld,worldnews,1,0,1559777949,/r/worldnews/comments/bx9ma6/chinas_xi_jinping_visits_best_friend_vladimir/,https://trendnewsworld.com/2019/06/05/chinas-xi-jinping-visits-best-friend-vladimir-putin/,china,2025-12-08 10:57:24
bx9lbo,China’s Xi Jinping visits ‘best friend’ Vladimir Putin,,newsunbox,worldnews,1,0,1559777783,/r/worldnews/comments/bx9lbo/chinas_xi_jinping_visits_best_friend_vladimir/,https://newsunbox.com/chinas-xi-jinping-visits-best-friend-vladimir-putin/,china,2025-12-08 10:57:24
bx73p7,"Vladimir Putin and Xi Jinping talk Russia-China relations The Russian and Chinese leaders hailed ties that had reached an ""unprecedented level"" after having cozied up repeatedly in recent years",,GorgeousPriceless,worldnews,15,10,1559764676,/r/worldnews/comments/bx73p7/vladimir_putin_and_xi_jinping_talk_russiachina/,https://www.dw.com/en/vladimir-putin-and-xi-jinping-talk-russia-china-relations/a-49060041,china,2025-12-08 10:57:24
bwmrdh,China Offers Money to Tibetans to Display Portraits of Xi Jinping,,rieslingatkos,worldnews,16,2,1559640888,/r/worldnews/comments/bwmrdh/china_offers_money_to_tibetans_to_display/,https://www.rfa.org/english/news/tibet/display-06032019173517.html,china,2025-12-08 10:57:24
burdt9,China ready to hit back at U.S. with rare earths: newspapers - President Xi Jinping’s visit to a rare earths plant last week had sparked speculation that China would use its dominant position as an exporter of rare earths to the United States as leverage in the trade war.,,ManiaforBeatles,worldnews,464,203,1559211085,/r/worldnews/comments/burdt9/china_ready_to_hit_back_at_us_with_rare_earths/,https://www.reuters.com/article/us-usa-trade-china-rareearth/china-ready-to-hit-back-at-u-s-with-rare-earths-newspapers-idUSKCN1SZ07V,china,2025-12-08 10:57:24
bub8us,Prime Minister Narendra Modi To Host Xi Jinping For An Informal Summit: Foreign Ministry,,michrafsa,worldnews,1,1,1559111599,/r/worldnews/comments/bub8us/prime_minister_narendra_modi_to_host_xi_jinping/,https://mcnews.ml/prime-minister-narendra-modi-to-host-xi-jinping-for-an-informal-summit-foreign-ministry/,china,2025-12-08 10:57:24
bu9z1c,Xi Jinping says China is not after ‘sphere of influence’ in Pacific,,paulfromatlanta,worldnews,5,9,1559102362,/r/worldnews/comments/bu9z1c/xi_jinping_says_china_is_not_after_sphere_of/,https://www.scmp.com/news/china/diplomacy/article/3012226/xi-jinping-says-china-not-after-pacific-sphere-influence,china,2025-12-08 10:57:24
brz3wi,Philippines demands Hong Kong explain grilling of former official who accused President Xi Jinping of crimes against humanity at International Criminal Court,,HKnational,worldnews,6,0,1558587592,/r/worldnews/comments/brz3wi/philippines_demands_hong_kong_explain_grilling_of/,https://sg.news.yahoo.com/philippines-demands-explanation-over-top-082609773.html,china,2025-12-08 10:57:24
brnyrv,"China must prepare for difficult times as the international situation is increasingly complex, President Xi Jinping said in comments carried by state media on Wednesday, as the U.S.-China trade war took a mounting toll on tech giant Huawei.",,madam1,worldnews,9,9,1558526780,/r/worldnews/comments/brnyrv/china_must_prepare_for_difficult_times_as_the/,https://mobile.reuters.com/article/amp/idUSKCN1SS13H,china,2025-12-08 10:57:24
brld2g,"Trade war: Xi Jinping visits rare-earth factory, hints at next move",,peak-achoo,worldnews,3,1,1558507119,/r/worldnews/comments/brld2g/trade_war_xi_jinping_visits_rareearth_factory/,https://amp.businessinsider.com/trade-war-xi-jinping-rare-earth-factory-hint-cripple-us-tech-military-2019-5,china,2025-12-08 10:57:24
brcas9,"Xi Jinping says China is embarking on a 'new Long March,' signaling no end to trade war soon",[deleted],[deleted],worldnews,24,24,1558455091,/r/worldnews/comments/brcas9/xi_jinping_says_china_is_embarking_on_a_new_long/,https://www.cnbc.com/2019/05/21/xi-jinping-says-china-is-embarking-on-a-new-long-march-signaling-no-end-to-trade-war-soon.html,china,2025-12-08 10:57:24
brc4uy,"Xi Jinping says China is embarking on a 'new Long March,' signaling no end to trade war soon",,pipsdontsqueak,worldnews,571,541,1558454284,/r/worldnews/comments/brc4uy/xi_jinping_says_china_is_embarking_on_a_new_long/,https://www.cnbc.com/id/105924786?view=story&trk=mostpopular::2:102527204,china,2025-12-08 10:57:24
brc1sy,Former Philippine Supreme Court official who accused President Xi Jinping of crimes against humanity at International Criminal Court ‘held’ by Hong Kong immigration officers,,HKnational,worldnews,22,5,1558453861,/r/worldnews/comments/brc1sy/former_philippine_supreme_court_official_who/,https://sg.news.yahoo.com/former-philippine-supreme-court-official-125544391.html,china,2025-12-08 10:57:24
brbmgy,Xi Jinping calls for ‘new Long March’ as China digs in for long trade war,,SirT6,worldnews,8,3,1558451727,/r/worldnews/comments/brbmgy/xi_jinping_calls_for_new_long_march_as_china_digs/,https://www.scmp.com/economy/china-economy/article/3011186/xi-jinping-calls-new-long-march-dramatic-sign-china-preparing,china,2025-12-08 10:57:24
bqtik5,"Xi Jinping visits rare earth minerals facility, amid talk of use as weapon in US-China trade war",,MrSerious1,worldnews,15,19,1558346035,/r/worldnews/comments/bqtik5/xi_jinping_visits_rare_earth_minerals_facility/,https://www.scmp.com/economy/china-economy/article/3010977/xi-jinping-visits-rare-earth-minerals-facility-amid-talk-use,china,2025-12-08 10:57:24
bp12ir,"Responding to US' description of competition with China as ‘a fight with a really different civilisation’, Chinese President Xi Jinping warned that one civilisation forcing itself on another would be “stupid” and “disastrous”",,shadilal_gharjode,worldnews,25,9,1557942525,/r/worldnews/comments/bp12ir/responding_to_us_description_of_competition_with/,https://www.scmp.com/news/china/diplomacy/article/3010287/cultural-superiority-stupid-and-disastrous-chinese-president,china,2025-12-08 10:57:24
boxes8,"Amid Trade War With US, China's Xi Jinping Says No Civilization Superior",,AshishShrivas,worldnews,9,5,1557923814,/r/worldnews/comments/boxes8/amid_trade_war_with_us_chinas_xi_jinping_says_no/,https://www.ndtv.com/world-news/amid-trade-war-chinas-president-xi-jinping-preaches-openness-says-no-civilization-superior-2038113,china,2025-12-08 10:57:24
blqhv7,Xi Jinping Wanted Global Dominance. He Overshot.,,Luciifuge,worldnews,1,0,1557234466,/r/worldnews/comments/blqhv7/xi_jinping_wanted_global_dominance_he_overshot/,https://www-nytimes-com.cdn.ampproject.org/v/s/www.nytimes.com/2019/05/07/opinion/xi-trump-trade-war-china-leadership.amp.html?amp_js_v=a2&amp_gsa=1#referrer=https%3A%2F%2Fwww.google.com&amp_tf=From%20%251%24s&ampshare=https%3A%2F%2Fwww.nytimes.com%2F2019%2F05%2F07%2Fopinion%2Fxi-trump-trade-war-china-leadership.html,china,2025-12-08 10:57:24
bjuy67,"Bernie Sanders to fulfill Xi's vision for the world here in America. ""Xi Jinping: Socialism Is ‘Essence of Patriotism’""",,gonewildinvt,worldnews,0,19,1556803710,/r/worldnews/comments/bjuy67/bernie_sanders_to_fulfill_xis_vision_for_the/,https://www.breitbart.com/national-security/2019/04/30/xi-jinping-socialism-is-essence-of-patriotism/,china,2025-12-08 10:57:24
bj18z2,Xi Jinping celebrates 1919 students protests while sidestepping Tiananmen Square massacre,,smashedmanontherun,worldnews,8,3,1556616061,/r/worldnews/comments/bj18z2/xi_jinping_celebrates_1919_students_protests/,https://www.abc.net.au/news/2019-04-30/xi-jinping-100-years-since-student-protests-in-china/11059206,china,2025-12-08 10:57:24
biojix,Law professor who criticized President Xi Jinping barred from leaving China,,alanwong,worldnews,1387,169,1556538513,/r/worldnews/comments/biojix/law_professor_who_criticized_president_xi_jinping/,https://www.inkstonenews.com/politics/law-professor-xu-zhangrun-barred-leaving-china/article/3008103,china,2025-12-08 10:57:24
binu5d,Chinese President Xi Jinping watches and cites Game of Thrones,[deleted],[deleted],worldnews,1,0,1556533112,/r/worldnews/comments/binu5d/chinese_president_xi_jinping_watches_and_cites/,https://www.inkstonenews.com/politics/xi-jinping-li-keqiang-watch-and-cite-game-thrones/article/3008086,china,2025-12-08 10:57:24
bid27e,"China is watching Western democracy eat itself.It is the flagship policy of Chinese President Xi Jinping, and it seeks to bring the world into China's economic embrace by building infrastructure on a mass scale, ultimately improving transport, ties with and reliance on China across the world.",[deleted],[deleted],worldnews,1,0,1556469196,/r/worldnews/comments/bid27e/china_is_watching_western_democracy_eat_itselfit/,https://edition.cnn.com/2019/04/27/opinions/brexit-and-trump-making-room-for-china-robertson-intl/index.html,china,2025-12-08 10:57:24
bhlnsp,China promises global infrastructure initiative will be ‘green’ and corruption-free | Xi Jinping has promised to set high standards for Beijing’s sweeping infrastructure-building initiative as fellow leaders praised the effort despite worries it is saddling some countries with too much debt,,ionised,worldnews,10,6,1556281294,/r/worldnews/comments/bhlnsp/china_promises_global_infrastructure_initiative/,https://www.pbs.org/newshour/world/china-promises-global-infrastructure-initiative-will-be-green-and-corruption-free,china,2025-12-08 10:57:24
bhk37i,Xi Jinping vows transparency over Belt and Road,,VietnameseComrade01,worldnews,5,1,1556268515,/r/worldnews/comments/bhk37i/xi_jinping_vows_transparency_over_belt_and_road/,https://www.bbc.com/news/business-48061951,china,2025-12-08 10:57:24
bh8wth,Xi Jinping's Rocket Force is nullifying U.S. military primacy in Asia,,MrSerious1,worldnews,3,16,1556200494,/r/worldnews/comments/bh8wth/xi_jinpings_rocket_force_is_nullifying_us/,https://www.reuters.com/investigates/special-report/china-army-rockets/,china,2025-12-08 10:57:24
bh8mod,Xi Jinping's Rocket Force is nullifying U.S. military primacy in Asia,,vilekangaree,worldnews,15,45,1556198894,/r/worldnews/comments/bh8mod/xi_jinpings_rocket_force_is_nullifying_us/,https://www.reuters.com/investigates/special-report/china-army-rockets/,china,2025-12-08 10:57:24
bgd4ch,Chinese President Xi Jinping says his job is 'very tiring' in letter to US high school students,,caonimma,worldnews,56,19,1556001500,/r/worldnews/comments/bgd4ch/chinese_president_xi_jinping_says_his_job_is_very/,https://www.abc.net.au/news/2019-04-22/xi-jinping-sends-letter-to-us-high-school-students/11035512,china,2025-12-08 10:57:24
bfy9k1,"'Add oil, work hard': Xi Jinping writes letter to US students saying they're the future of US-Chinese relations",,wearetheaybesee,worldnews,18,13,1555909878,/r/worldnews/comments/bfy9k1/add_oil_work_hard_xi_jinping_writes_letter_to_us/,https://www.abc.net.au/news/2019-04-22/xi-jinping-sends-letter-to-us-high-school-students/11035512,china,2025-12-08 10:57:24
bdlypx,"Mark Zuckerberg bought copies of Xi Jinping's ""The Governance of China"" for his colleagues because he wanted them to understand socialism with Chinese characteristics",,lizongyang,worldnews,2,1,1555366102,/r/worldnews/comments/bdlypx/mark_zuckerberg_bought_copies_of_xi_jinpings_the/,http://www.chinadaily.com.cn/a/201705/09/WS59bb930aa310d4d9ab7ea96a.html,china,2025-12-08 10:57:24
bdgumu,"Xi Jinping to attend Osaka G20, says Taro Kono, in China leader's first visit to Japan since 2013",,somewhatimportantnew,worldnews,4,0,1555339802,/r/worldnews/comments/bdgumu/xi_jinping_to_attend_osaka_g20_says_taro_kono_in/,https://www.japantimes.co.jp/news/2019/04/15/national/politics-diplomacy/beijing-taro-kono-chinese-premier-li-keqiang-discuss-possible-xi-visit-japan-g20/#.XLSY_hnlI0M,china,2025-12-08 10:57:24
bb88i8,FUCK CHINA. FUCK XI JINPING THE POOH. Reddit is censoring this video: Chinese police forcefully enter woman's home and arrest her for internet posts.,,Neidorst,worldnews,1,0,1554818176,/r/worldnews/comments/bb88i8/fuck_china_fuck_xi_jinping_the_pooh_reddit_is/,https://www.youtube.com/watch?v=cCOAbkTs_a4,china,2025-12-08 10:57:24
bax4hx,China ‘forces millions of people’ to download app and earn points by following President Xi Jinping news,[deleted],[deleted],worldnews,1,2,1554747252,/r/worldnews/comments/bax4hx/china_forces_millions_of_people_to_download_app/,https://www.independent.co.uk/news/world/asia/china-xi-jinping-app-millions-forced-download-a8859511.html,china,2025-12-08 10:57:24
b9kk4m,Xi Jinping Says Substantial Progress Made in U.S.-China Trade Talks,[deleted],[deleted],worldnews,1,1,1554424213,/r/worldnews/comments/b9kk4m/xi_jinping_says_substantial_progress_made_in/,https://www.bloomberg.com/news/articles/2019-04-05/xi-jinping-says-substantial-progress-made-in-u-s-china-trade-talks,china,2025-12-08 10:57:24
b9ilsn,Trump refuses to have summit with China’s Xi Jinping until trade war deal is final,,Individual99991,worldnews,4,5,1554413066,/r/worldnews/comments/b9ilsn/trump_refuses_to_have_summit_with_chinas_xi/,https://www.scmp.com/news/china/diplomacy/article/3004759/no-summit-chinas-xi-jinping-until-deal-end-trade-war-final,china,2025-12-08 10:57:24
b9ihua,"Trump says no big summit with Xi Jinping just yet, wants China trade deal first",,yLov,worldnews,0,11,1554412512,/r/worldnews/comments/b9ihua/trump_says_no_big_summit_with_xi_jinping_just_yet/,https://www.washingtontimes.com/news/2019/apr/4/trump-says-no-big-summit-xi-jinping-just-yet/,china,2025-12-08 10:57:24
b9dlch,Trump set to announce plans for summit with Chinese President Xi Jinping to reach an end to trade war,,[deleted],worldnews,5,7,1554388993,/r/worldnews/comments/b9dlch/trump_set_to_announce_plans_for_summit_with/,https://www.washingtonpost.com/business/economy/trump-set-to-announce-plans-for-summit-with-chinese-president-xi-jinping-to-reach-an-end-to-trade-war/2019/04/04/1b0af20e-56e3-11e9-814f-e2f46684196e_story.html?utm_term=.7f527d7fad25,china,2025-12-08 10:57:24
b8xnp3,Trump says Xi Jinping liked it when he called the Chinese president ‘king’,,trendyupdatenews,worldnews,1,0,1554296515,/r/worldnews/comments/b8xnp3/trump_says_xi_jinping_liked_it_when_he_called_the/,https://trendyupdatenews.com/trump-says-xi-jinping-liked-it-when-he-called-the-chinese-president-king/,china,2025-12-08 10:57:24
b8vti3,"Chinese president Xi Jinping ‘liked’ being called a king, says Trump",[deleted],[deleted],worldnews,10,5,1554284388,/r/worldnews/comments/b8vti3/chinese_president_xi_jinping_liked_being_called_a/,https://www.inkstonenews.com/trump-called-xi-king-and-xi-liked-it/article/3004493,china,2025-12-08 10:57:24
b8u7a2,US President Trump says he called Xi Jinping the 'king' of China,,funsynonym,worldnews,5,9,1554271130,/r/worldnews/comments/b8u7a2/us_president_trump_says_he_called_xi_jinping_the/,https://edition.cnn.com/2019/04/02/politics/trump-xi-king-of-china-intl/index.html,china,2025-12-08 10:57:24
b8belj,PM in China: Jacinda Ardern meets Xi Jinping,,louisamarisa,worldnews,5,2,1554162441,/r/worldnews/comments/b8belj/pm_in_china_jacinda_ardern_meets_xi_jinping/,https://www.nzherald.co.nz/nz/news/article.cfm?c_id=1&objectid=12217953,china,2025-12-08 10:57:24
b6dom7,"In Philippines, support mounts for South China Sea ‘crimes against humanity’ case against Xi Jinping",,peak-achoo,worldnews,5,1,1553742456,/r/worldnews/comments/b6dom7/in_philippines_support_mounts_for_south_china_sea/,https://www.scmp.com/week-asia/geopolitics/article/3003379/philippines-support-mounts-south-china-sea-crimes-against,china,2025-12-08 10:57:24
b64bng,Xi Jinping calls for an end to 'suspicions' between Europe and China,,vlad_albulescu,worldnews,4,5,1553692332,/r/worldnews/comments/b64bng/xi_jinping_calls_for_an_end_to_suspicions_between/,https://www.telegraph.co.uk/news/2019/03/26/xi-jinping-calls-end-suspicions-europe-china/,china,2025-12-08 10:57:24
