id,title,selftext,author,subreddit,score,num_comments,created_utc,permalink,url,topic,collection_date
bspbvl,Did China overlook ideological differences? The democratic world is teaming up on the CCP,"I was very skeptical of Trump, that China will come out on top of this trade war, with Europe and Canada being more pro-China. However it doesn't seem like the case. Both US and China are suffering from trade war but I do believe China is suffering more. My Chinese stocks are going down and I sold them all. The problem is China is simply too reliant on foreign markets in order to function effectively.

&#x200B;

Despite the desire for free trade, it seems like the EU and Canada and Australia and being pro-US despite it not benefiting their economies. A good example is the Canadian ban on Huawei, it will help the Canadian tech industry a lot, the security of alliance with US trumps it. Australian politicians are growing more and more worried about China despite it being such a large partner with China.

If you have been watching comments by Steve Bannon, this is purely ideological not diplomatic. Men like Bannon hate the fact China is a command economy and rising. China is not a huge threat on American security, but a threat on the American identity *of what nation should be* and democracies from Japan to Germany are supporting America on this.

This is not a ""raw raw China bad"" post but it shows a alternative-realist perspective where it is not only about economics, but a fight for identity and cultural power. US is at a point where it doesn't need Mid-East oil, it has automation to replace foreign workers and factories, and has a fairly self-sufficient tech industry. The anti-China actions represents a ideological battle than a battle for resources.",Warriormind556,geopolitics,2,49,1558749889,/r/geopolitics/comments/bspbvl/did_china_overlook_ideological_differences_the/,https://www.reddit.com/r/geopolitics/comments/bspbvl/did_china_overlook_ideological_differences_the/,china,2025-12-08 10:57:24
bsisw9,Rare earth elements aren’t the secret weapon China thinks they are,,SuccessfulOperation,geopolitics,75,23,1558714350,/r/geopolitics/comments/bsisw9/rare_earth_elements_arent_the_secret_weapon_china/,https://www.theverge.com/2019/5/23/18637071/rare-earth-china-production-america-demand-trade-war-tariffs,china,2025-12-08 10:57:24
brx7gi,"Re: Forbes' ""China Rolls Out The Currency Weapon""",[removed],MEATPOPSCI_irl,geopolitics,1,1,1558575517,/r/geopolitics/comments/brx7gi/re_forbes_china_rolls_out_the_currency_weapon/,https://www.reddit.com/r/geopolitics/comments/brx7gi/re_forbes_china_rolls_out_the_currency_weapon/,china,2025-12-08 10:57:24
brtes2,The reason why China's technological rise is unstoppable.,,lizongyang,geopolitics,0,12,1558555138,/r/geopolitics/comments/brtes2/the_reason_why_chinas_technological_rise_is/,https://cnindustry.quora.com/Learning-by-Doing-the-Ultimate-Source-of-Technology-Innovation,china,2025-12-08 10:57:24
brn2z7,Vietnam profits from the US-China trade war!,[deleted],[deleted],geopolitics,3,11,1558521198,/r/geopolitics/comments/brn2z7/vietnam_profits_from_the_uschina_trade_war/,https://i.redd.it/ejcwpr65qqz21.jpg,china,2025-12-08 10:57:24
brlcu6,Electric cars: China powers the battery supply chain,,NeatConnection,geopolitics,128,14,1558507070,/r/geopolitics/comments/brlcu6/electric_cars_china_powers_the_battery_supply/,https://www.ft.com/content/455fe41c-7185-11e9-bf5c-6eeb837566c5,china,2025-12-08 10:57:24
brgvin,US - China Trade War,,lilyinnit,geopolitics,0,2,1558477864,/r/geopolitics/comments/brgvin/us_china_trade_war/,https://youtu.be/B7npGpoO6aE,china,2025-12-08 10:57:24
bremm8,Does anyone else suspect that the recent escalation with Iran has more to do with putting pressure on China's oil supply than anything they say Iran has actually done?,[removed],DukeOfCrydee,geopolitics,37,40,1558466437,/r/geopolitics/comments/bremm8/does_anyone_else_suspect_that_the_recent/,https://www.reddit.com/r/geopolitics/comments/bremm8/does_anyone_else_suspect_that_the_recent/,china,2025-12-08 10:57:24
brdee3,EU Business Org Reports Increasing Pace of Forced Technology Transfer in China Despite April EU-China Joint Statement on Reform,"https://www.reuters.com/article/us-china-eu/chinas-tech-transfer-problem-is-growing-eu-business-group-says-idUSKCN1SQ0I7?utm_source=share&utm_medium=ios_app

https://eeas.europa.eu/delegations/china_en/60836/Joint%20statement%20of%20the%2021st%20EU-China%20summit

Edit: very sorry I cant reply to any more comments as I’ve been banned",rdrptr,geopolitics,11,122,1558460439,/r/geopolitics/comments/brdee3/eu_business_org_reports_increasing_pace_of_forced/,https://www.reddit.com/r/geopolitics/comments/brdee3/eu_business_org_reports_increasing_pace_of_forced/,china,2025-12-08 10:57:24
brc0t4,Tom Friedman explains why he agrees with Trump's China trade approach,,[deleted],geopolitics,0,17,1558453714,/r/geopolitics/comments/brc0t4/tom_friedman_explains_why_he_agrees_with_trumps/,https://www.youtube.com/watch?v=nVBqSOPWIUw,china,2025-12-08 10:57:24
bqvk2x,Freedom of Navigation in the South China Sea: A Practical Guide,,NeatConnection,geopolitics,8,8,1558359018,/r/geopolitics/comments/bqvk2x/freedom_of_navigation_in_the_south_china_sea_a/,https://www.belfercenter.org/publication/freedom-navigation-south-china-sea-practical-guide,china,2025-12-08 10:57:24
bqlcap,Would the TPP have forced China to the negotiating table?,"It’s difficult to deal in hypotheticals, but had the United States not pulled out of the Trans-Pacific Partnership, could it have used the multilateral treaty to confront China instead of its current strategy of tariffs?  Despite its admission to the WTO two decades ago, China regularly flaunts the organization rules concerning industrial dumping and state-subsidies.
  
Opposition to China is now a bipartisan issue, and regardless of which party wins in 2020, the trade impasse will likely continue alongside heightened geopolitical tensions concerning the South China Sea, the Arctic Ocean, and cyber security. My question boils down to if the US had stayed in the TPP, would it have had the same ability to bring China to the negotiating table as the current strategy has?",Mcfinley,geopolitics,19,7,1558296167,/r/geopolitics/comments/bqlcap/would_the_tpp_have_forced_china_to_the/,https://www.reddit.com/r/geopolitics/comments/bqlcap/would_the_tpp_have_forced_china_to_the/,china,2025-12-08 10:57:24
bqhext,What is the future for the US if China becomes the new hyper power in 20 years? Is there anyway to stop an escalation of new weapons systems so it does not lead to huge casualties and WW3? I feel worried as an American that we will not,[deleted],[deleted],geopolitics,1,1,1558275390,/r/geopolitics/comments/bqhext/what_is_the_future_for_the_us_if_china_becomes/,https://www.reddit.com/r/geopolitics/comments/bqhext/what_is_the_future_for_the_us_if_china_becomes/,china,2025-12-08 10:57:24
c74am3,Libyan fighters seize U.S. and Chinese missiles from Haftar's forces,[deleted],[deleted],geopolitics,1,1,1561840747,/r/geopolitics/comments/c74am3/libyan_fighters_seize_us_and_chinese_missiles/,https://world-news-monitor.com/geopolitics/2019/06/29/libyan-fighters-seize-u-s-and-chinese-missiles-from-haftars-forces/,china,2025-12-08 10:57:24
c6kahx,Tanzania scraps massive Chinese port project,,ToharBaap,geopolitics,507,134,1561729032,/r/geopolitics/comments/c6kahx/tanzania_scraps_massive_chinese_port_project/,https://splash247.com/tanzania-scraps-massive-chinese-port-project/,china,2025-12-08 10:57:24
c6iwu6,The other side of the table: The Chinese view point from the Trade war.,,Race_to_infinity,geopolitics,77,13,1561720306,/r/geopolitics/comments/c6iwu6/the_other_side_of_the_table_the_chinese_view/,https://www.foreignaffairs.com/articles/china/2019-06-27/how-china-really-sees-trade-war,china,2025-12-08 10:57:24
c595r9,America Must Prepare for the Coming Chinese Empire,,atomic_rabbit,geopolitics,399,442,1561471971,/r/geopolitics/comments/c595r9/america_must_prepare_for_the_coming_chinese_empire/,https://nationalinterest.org/feature/america-must-prepare-coming-chinese-empire-63102,china,2025-12-08 10:57:24
c4hbw6,"A Chinese invasion of Taiwan would be a bloody, logistical nightmare",,FishingAddict209,geopolitics,0,3,1561345031,/r/geopolitics/comments/c4hbw6/a_chinese_invasion_of_taiwan_would_be_a_bloody/,https://www.cnn.com/2019/06/23/asia/taiwan-china-invasion-intl-hnk/index.html,china,2025-12-08 10:57:24
c3pzdy,US is close to sanctioning Chinese officials over Muslim camps,,Brushner,geopolitics,596,17,1561211807,/r/geopolitics/comments/c3pzdy/us_is_close_to_sanctioning_chinese_officials_over/,https://www.inkstonenews.com/politics/mnuchin-holding-xinjiang-sanctions-due-trade-talks-worries/article/3015525,china,2025-12-08 10:57:24
c34z3s,Trump’s tariffs on Chinese goods could lead to a Bible shortage in the US,,ibobriakov,geopolitics,12,3,1561084350,/r/geopolitics/comments/c34z3s/trumps_tariffs_on_chinese_goods_could_lead_to_a/,https://qz.com/1647667/trump-tariffs-on-chinese-goods-could-lead-to-us-bible-shortage/,china,2025-12-08 10:57:24
c1iexj,Chinese PLA general talks about the ccp’s views on Hong Kong in November 2018,[deleted],[deleted],geopolitics,1,1,1560739980,/r/geopolitics/comments/c1iexj/chinese_pla_general_talks_about_the_ccps_views_on/,https://www.youtube.com/watch?v=AliAc6veH0w  Just curious if anyone had more info in English on the view/analysis that's expressed in the video? And are there any good books on the views and aims of the CCP?  Thanks,china,2025-12-08 10:57:24
c1iafy,Chinese PLA general talks about the ccp’s views on Hong Kong in November 2018,[deleted],[deleted],geopolitics,1,1,1560739162,/r/geopolitics/comments/c1iafy/chinese_pla_general_talks_about_the_ccps_views_on/,https://www.reddit.com/r/geopolitics/comments/c1iafy/chinese_pla_general_talks_about_the_ccps_views_on/,china,2025-12-08 10:57:24
c14b7b,WHAT THE CHINESE COMMUNIST PARTY LEARNED FROM THE FALL OF THE USSR,,ChickenTitilater,geopolitics,0,2,1560646258,/r/geopolitics/comments/c14b7b/what_the_chinese_communist_party_learned_from_the/,https://www.ianwelsh.net/what-the-chinese-communist-party-learned-from-the-fall-of-the-ussr/,china,2025-12-08 10:57:24
c0w5tj,How fractured or united are US political and economic elites compared to their Chinese counterparts?,"How fractured or united are US political and economic elites compared to their Chinese counterparts, is the US political process a lot less effective in terms of long term geopolitical strategies compared to what is going on in Beijing? Are US elites and policy makers a lot less competent in the long run compared to Chinese elites?",fg412,geopolitics,3,10,1560596692,/r/geopolitics/comments/c0w5tj/how_fractured_or_united_are_us_political_and/,https://www.reddit.com/r/geopolitics/comments/c0w5tj/how_fractured_or_united_are_us_political_and/,china,2025-12-08 10:57:24
bzjf9d,An average Chinese is now as rich as an average European,[removed],MyRedditB,geopolitics,0,3,1560293775,/r/geopolitics/comments/bzjf9d/an_average_chinese_is_now_as_rich_as_an_average/,https://www.reddit.com/r/geopolitics/comments/bzjf9d/an_average_chinese_is_now_as_rich_as_an_average/,china,2025-12-08 10:57:24
bzj7q5,An average Chinese will consume more electricity than an average European from next year,[removed],MyRedditB,geopolitics,0,5,1560292620,/r/geopolitics/comments/bzj7q5/an_average_chinese_will_consume_more_electricity/,https://www.reddit.com/r/geopolitics/comments/bzj7q5/an_average_chinese_will_consume_more_electricity/,china,2025-12-08 10:57:24
bzcy40,Global shares rise as Trump plans to meet Chinese leader,[deleted],[deleted],geopolitics,0,1,1560262119,/r/geopolitics/comments/bzcy40/global_shares_rise_as_trump_plans_to_meet_chinese/,https://apnews.com/8ca5f8da2e794abc942f330d997b36f4,china,2025-12-08 10:57:24
bzafr2,Parting the Red Sea: Why the Chinese and U.S. armies are fortifying this tiny African country,,SuccessfulOperation,geopolitics,177,48,1560246474,/r/geopolitics/comments/bzafr2/parting_the_red_sea_why_the_chinese_and_us_armies/,https://www.theglobeandmail.com/world/article-parting-the-red-sea-why-the-chinese-and-us-armies-are-fortifying/,china,2025-12-08 10:57:24
byxq3v,The balance of the trade war has been tilted towards the Chinese side,[deleted],[deleted],geopolitics,1,1,1560172559,/r/geopolitics/comments/byxq3v/the_balance_of_the_trade_war_has_been_tilted/,https://translate.google.com/translate?sl=zh-CN&tl=en&u=https%3A%2F%2Fm.haiwainet.cn%2Fttc%2F3541093%2F2019%2F0610%2Fcontent_31571495_1.html%3Ftt_group_id%3D6700656845410796043,china,2025-12-08 10:57:24
bymybc,"Modi woos Sri Lanka, Maldives as India fends off Chinese influence",,ToharBaap,geopolitics,212,39,1560102847,/r/geopolitics/comments/bymybc/modi_woos_sri_lanka_maldives_as_india_fends_off/,https://www.dw.com/en/modi-woos-sri-lanka-maldives-as-india-fends-off-chinese-influence/a-49117835,china,2025-12-08 10:57:24
bxxf5x,Chinese AI Talent in Six Charts,,hollyhe611,geopolitics,16,4,1559929004,/r/geopolitics/comments/bxxf5x/chinese_ai_talent_in_six_charts/,https://macropolo.org/china-ai-research-talent-data/,china,2025-12-08 10:57:24
bwnzwk,Trump's Next Trade War Target: Chinese Students at Elite Schools,,DamnedDemiurge,geopolitics,9,5,1559650409,/r/geopolitics/comments/bwnzwk/trumps_next_trade_war_target_chinese_students_at/,https://www.bloomberg.com/amp/news/articles/2019-06-03/trump-s-next-trade-war-target-chinese-students-at-elite-schools,china,2025-12-08 10:57:24
bvxonr,The Chinese Enlightenment at 100: How the Communist Party Seized the Legacy of May Fourth,,ForeignAffairsMag,geopolitics,25,2,1559484309,/r/geopolitics/comments/bvxonr/the_chinese_enlightenment_at_100_how_the/,https://www.foreignaffairs.com/articles/china/2019-05-03/chinese-enlightenment-100?gpp=4xnPjzt2Nq7g91B4Mx9%2BCDphS09YaERGZnZXNW1Od1FER09DeGVzZE9jY0t3clRKVi85aU1FaGV0Um9iUm5reDhGck9BSWhOSTdkSTRrNnpFOjU3ODczMTZkNjk4NTI3ZjZmNGRiMWE2ZmQxNjE2MTZkNjZmYzBmNTlmM2M3ZDc3ZWI5YWJkNTM3ZDVkZjc2NGI%3D,china,2025-12-08 10:57:24
busiiu,140 Chinese Companies now Blacklisted by the Commerce Department.,,Petrolicious66,geopolitics,305,41,1559219090,/r/geopolitics/comments/busiiu/140_chinese_companies_now_blacklisted_by_the/,https://sg.news.yahoo.com/amphtml/huawei-among-more-140-chinese-114115768.html,china,2025-12-08 10:57:24
bt726l,$1 Billion In Iranian Crude Is Stuck At This Chinese Oil Hub,[deleted],[deleted],geopolitics,1,1,1558871599,/r/geopolitics/comments/bt726l/1_billion_in_iranian_crude_is_stuck_at_this/,https://oilprice.com/Energy/Crude-Oil/1-Billion-In-Iranian-Crude-Is-Stuck-At-This-Chinese-Oil-Hub.html,china,2025-12-08 10:57:24
bssghf,Will the Chinese eventually win in Xinjiang?,Are the tactics they're using to absorb the natives into the greater Han population and culture working? Will Xin jiang eventually move from troubled province to nationalistic? Or is their re-education campaign doomed to fail?,seands,geopolitics,76,70,1558774576,/r/geopolitics/comments/bssghf/will_the_chinese_eventually_win_in_xinjiang/,https://www.reddit.com/r/geopolitics/comments/bssghf/will_the_chinese_eventually_win_in_xinjiang/,china,2025-12-08 10:57:24
bsaok8,Chinese cultural revolution possible?,[removed],[deleted],geopolitics,0,10,1558659532,/r/geopolitics/comments/bsaok8/chinese_cultural_revolution_possible/,https://www.reddit.com/r/geopolitics/comments/bsaok8/chinese_cultural_revolution_possible/,china,2025-12-08 10:57:24
brciwl,2019 Chinese Geopolitical Views,,speakthetruth1,geopolitics,0,5,1558456192,/r/geopolitics/comments/brciwl/2019_chinese_geopolitical_views/,https://i.redd.it/onb57k2tclz21.jpg,china,2025-12-08 10:57:24
bq2u16,"Trade war casualty: Major USA-set Chinese show ""Over the Sea I Come to You"" cancelled 2 days before airing",[removed],[deleted],geopolitics,1,0,1558177467,/r/geopolitics/comments/bq2u16/trade_war_casualty_major_usaset_chinese_show_over/,https://www.reddit.com/r/geopolitics/comments/bq2u16/trade_war_casualty_major_usaset_chinese_show_over/,china,2025-12-08 10:57:24
bogh3i,Avoiding a Chinese burn: how the west should handle China,,M_McFly,geopolitics,100,57,1557824980,/r/geopolitics/comments/bogh3i/avoiding_a_chinese_burn_how_the_west_should/,https://1828uk.com/2019/05/10/avoiding-a-chinese-burn-how-the-west-should-handle-china/,china,2025-12-08 10:57:24
bmvylh,Trump just raised tariffs on Chinese goods. China says it will hit back,,Enammul,geopolitics,180,53,1557478810,/r/geopolitics/comments/bmvylh/trump_just_raised_tariffs_on_chinese_goods_china/,https://edition.cnn.com/2019/05/10/business/china-us-tariffs-trade/index.html,china,2025-12-08 10:57:24
bmbzqi,"Taiwan to Improve Ties With India, Official Says, Despite Chinese Disfavour",,Reader_0b100,geopolitics,31,60,1557355444,/r/geopolitics/comments/bmbzqi/taiwan_to_improve_ties_with_india_official_says/,https://www.nytimes.com/reuters/2019/05/08/business/08reuters-india-taiwan-trade.html,china,2025-12-08 10:57:24
blg0cx,The Chinese Surveillance State Part 1 (NYTimes Podcast),,Spinnakerr,geopolitics,0,12,1557168497,/r/geopolitics/comments/blg0cx/the_chinese_surveillance_state_part_1_nytimes/,https://www.nytimes.com/2019/05/06/podcasts/the-daily/china-surveillance-uighurs.html,china,2025-12-08 10:57:24
bl3ctw,US to raise tariffs on $200 billion of Chinese goods up to 25%,,ShortTrifle0,geopolitics,238,101,1557092033,/r/geopolitics/comments/bl3ctw/us_to_raise_tariffs_on_200_billion_of_chinese/,https://www.dw.com/en/us-to-raise-tariffs-on-200-billion-of-chinese-goods-up-to-25/a-48610158,china,2025-12-08 10:57:24
bgpzz5,"On South America’s largest solar farm, Chinese power radiates",,NeatConnection,geopolitics,234,45,1556077930,/r/geopolitics/comments/bgpzz5/on_south_americas_largest_solar_farm_chinese/,https://graphics.reuters.com/ARGENTINA-CHINA-SOLAR/010091JZ29H/index.html,china,2025-12-08 10:57:24
bfcwi0,U.S. intelligence says Huawei funded by Chinese state security,,theoryofdoom,geopolitics,626,16,1555771430,/r/geopolitics/comments/bfcwi0/us_intelligence_says_huawei_funded_by_chinese/,https://www.reuters.com/article/us-usa-trade-china-huawei/u-s-intelligence-says-huawei-funded-by-chinese-state-security-report-idUSKCN1RW03D,china,2025-12-08 10:57:24
bfad3g,"U.S. intelligence says Huawei funded by Chinese state security, report shared with allies.",[deleted],[deleted],geopolitics,0,3,1555751447,/r/geopolitics/comments/bfad3g/us_intelligence_says_huawei_funded_by_chinese/,https://www.reuters.com/article/us-usa-trade-china-huawei/u-s-intelligence-says-huawei-funded-by-chinese-state-security-report-idUSKCN1RW03D?il=0,china,2025-12-08 10:57:24
be58g0,China’s Hardball Responses To U.S. Trade Threats Reveal Chinese Weakness,,CurlyWurly20,geopolitics,0,22,1555488572,/r/geopolitics/comments/be58g0/chinas_hardball_responses_to_us_trade_threats/,https://www.theepochtimes.com/chinas-hardball-responses-to-u-s-trade-threats-reveal-weakness_2882183.html,china,2025-12-08 10:57:24
bbofw3,"Recent reports of a Chinese woman entering Mar-a-Lago under false pretenses raise concerns about access, physical security, influence peddling, and espionage. Let's examine the pros and cons of her being an agent.",,wyldcat,geopolitics,9,2,1554915705,/r/geopolitics/comments/bbofw3/recent_reports_of_a_chinese_woman_entering/,https://www.csis.org/analysis/was-she-spy-probably-not,china,2025-12-08 10:57:24
bb9w30,Animation of GPS data showing Chinese research vessels getting very close to US military bases in the Pacific,[deleted],[deleted],geopolitics,1,2,1554826784,/r/geopolitics/comments/bb9w30/animation_of_gps_data_showing_chinese_research/,https://v.redd.it/mi74kutnk9r21,china,2025-12-08 10:57:24
ba3msi,Chinese meddling in Indian elections?,,10100011a10100011a,geopolitics,5,65,1554552233,/r/geopolitics/comments/ba3msi/chinese_meddling_in_indian_elections/,https://youtu.be/evVuhN8Enos,china,2025-12-08 10:57:24
b9taty,Presence of Chinese vessels around Pag-asa Island 'illegal',"Over 600 Chinese vessels have been circling Pag-asa Island since January this year, the military said. 

Presidential Spokesperson Salvador Panelo on Monday said Manila has already filed a diplomatic protest on the incursions. He did not provide more details. 

China has ramped up island building and militarization activities in the  South China Sea, shunning a July 2016 ruling of a United Nations-backed arbitral tribunal that invalidated its nine-dash line claim over nearly  all of the waters.  

[https://news.abs-cbn.com/news/04/04/19/presence-of-chinese-vessels-around-pag-asa-island-illegal-dfa](https://news.abs-cbn.com/news/04/04/19/presence-of-chinese-vessels-around-pag-asa-island-illegal-dfa)

**Comments / significance:**

* *China does not recognize Philippine claims and cites how Chinese vessels have fished in the area for over a hundred years.*
* *The use of 100's of Chinese fishing boats clogs up fishing waters for Philippines.  China can place these fishing vessels under Chinese Navy control in times of war or crisis.*
* *The USS Wasp, amphibious assault ship, arrived in Philippines March 30 with at least 10 F-35B's.*

&#x200B;",MindStreamer,geopolitics,11,14,1554481539,/r/geopolitics/comments/b9taty/presence_of_chinese_vessels_around_pagasa_island/,https://www.reddit.com/r/geopolitics/comments/b9taty/presence_of_chinese_vessels_around_pagasa_island/,china,2025-12-08 10:57:24
b5n78d,"China’s press freedom crackdown poses a threat to int’l democracies, says media watchdog. The report condemned Chinese President Xi Jinping as an “enemy of democracy, universal values, human rights and press freedom.”",,msnahuzt,geopolitics,425,83,1553589373,/r/geopolitics/comments/b5n78d/chinas_press_freedom_crackdown_poses_a_threat_to/,https://www.hongkongfp.com/2019/03/25/new-world-order-chinas-crackdown-press-freedom-poses-threat-intl-democracies-says-media-watchdog/,china,2025-12-08 10:57:24
b4ltpw,Chinese dissidents using bots to radicalize VPN users,,Interpine,geopolitics,19,6,1553362468,/r/geopolitics/comments/b4ltpw/chinese_dissidents_using_bots_to_radicalize_vpn/,https://www.tandfonline.com/doi/abs/10.1080/1369118X.2018.1476576?journalCode=rics20&,china,2025-12-08 10:57:24
b4gjox,"Italy Signs on for Chinese ""Belt and Road"" Port Investments",,lllIIIIIIIlIIIIIlll,geopolitics,1,0,1553327293,/r/geopolitics/comments/b4gjox/italy_signs_on_for_chinese_belt_and_road_port/,https://www.maritime-executive.com/article/italy-signs-on-for-chinese-belt-and-road-port-investments,china,2025-12-08 10:57:24
