id,title,selftext,author,subreddit,score,num_comments,created_utc,permalink,url,topic,collection_date
c76clv,Trade war escalation averted as US-China agree to resume talks,,viralnewsdrift,worldnews,1,0,1561852068,/r/worldnews/comments/c76clv/trade_war_escalation_averted_as_uschina_agree_to/,https://viralnewsdrift.com/trade-war-escalation-averted-as-us-china-agree-to-resume-talks/,china,2025-12-08 10:57:24
c764mv,Trudeau raises detention of 2 Canadians with China’s Xi at G20 summit,,princey12,worldnews,23,16,1561850766,/r/worldnews/comments/c764mv/trudeau_raises_detention_of_2_canadians_with/,https://globalnews.ca/news/5445702/trudeau-xi-g20/,china,2025-12-08 10:57:24
c75a0u,"'It's a temporary timeout': Trump and Xi agree to negotiations, but offer no clear path to end US-China trade war",,shehzad,worldnews,7,2,1561846011,/r/worldnews/comments/c75a0u/its_a_temporary_timeout_trump_and_xi_agree_to/,https://www.cnbc.com/2019/06/29/g20-summit-trump-and-xi-agree-to-talks-but-offer-no-clear-path-to-end-the-trade-war.html,china,2025-12-08 10:57:24
c756n6,"'It's a temporary timeout': Trump and Xi agree to negotiations, but offer no clear path to end US-China trade war",,SSG47,worldnews,4,1,1561845517,/r/worldnews/comments/c756n6/its_a_temporary_timeout_trump_and_xi_agree_to/,https://www.cnbc.com/2019/06/29/g20-summit-trump-and-xi-agree-to-talks-but-offer-no-clear-path-to-end-the-trade-war.html,china,2025-12-08 10:57:24
c74in2,They Come For Us At Night: Inside China’s Hidden War on Uighurs,,trendyupdatenews,worldnews,1,0,1561841927,/r/worldnews/comments/c74in2/they_come_for_us_at_night_inside_chinas_hidden/,https://trendyupdatenews.com/they-come-for-us-at-night-inside-chinas-hidden-war-on-uighurs/,china,2025-12-08 10:57:24
c746on,US and China agree to restart trade talks,[deleted],[deleted],worldnews,22,2,1561840169,/r/worldnews/comments/c746on/us_and_china_agree_to_restart_trade_talks/,https://www.bbc.com/news/world-48810070,china,2025-12-08 10:57:24
c73y44,Trump tries to persuade supporters that no deal on China is a win,,trendyupdatenews,worldnews,1,0,1561838917,/r/worldnews/comments/c73y44/trump_tries_to_persuade_supporters_that_no_deal/,https://trendyupdatenews.com/trump-tries-to-persuade-supporters-that-no-deal-on-china-is-a-win/,china,2025-12-08 10:57:24
c72ws9,Trump tries to persuade supporters that no deal on China is a win,,dailytrendshunter,worldnews,1,0,1561833522,/r/worldnews/comments/c72ws9/trump_tries_to_persuade_supporters_that_no_deal/,https://dailytrendshunter.com/trump-tries-to-persuade-supporters-that-no-deal-on-china-is-a-win/,china,2025-12-08 10:57:24
c71ki4,"China’s first 100MW molten salt solar plant hits maximum power. The facility, which serves as a solar thermal power generation demonstration project, has exceeded the amount of power it was originally planned to produce",[deleted],[deleted],worldnews,1,1,1561826976,/r/worldnews/comments/c71ki4/chinas_first_100mw_molten_salt_solar_plant_hits/,https://www.energylivenews.com/2019/06/21/chinas-first-100mw-molten-salt-solar-plant-hits-maximum-power/,china,2025-12-08 10:57:24
c7075p,Trump reveals US companies will be allowed to sell to Huawei as China trade talks get ‘back on track’,,trendynewstime,worldnews,1,0,1561821880,/r/worldnews/comments/c7075p/trump_reveals_us_companies_will_be_allowed_to/,https://trendynewstime.com/trump-reveals-us-companies-will-be-allowed-to-sell-to-huawei-as-china-trade-talks-get-back-on-track/,china,2025-12-08 10:57:24
c6zr26,"Truce in US-China trade war as 2 rivals seek breakthrough. President Donald Trump and China’s Xi Jinping agreed to a cease-fire Saturday in their nations’ yearlong trade war, averting for now an escalation feared by financial markets, businesses and farmers.",,oskar81,worldnews,24,3,1561819488,/r/worldnews/comments/c6zr26/truce_in_uschina_trade_war_as_2_rivals_seek/,https://www.apnews.com/e65bb15053cb437794a464a597ee565f,china,2025-12-08 10:57:24
c6zg0s,"Trump suspends new tariffs, U.S. and China to restart trade talks",,themarxistworker,worldnews,3,7,1561817739,/r/worldnews/comments/c6zg0s/trump_suspends_new_tariffs_us_and_china_to/,https://www.cbsnews.com/news/us-china-trade-talks-restarted-trump-suspends-new-tariffs-today-2019-06-29/,china,2025-12-08 10:57:24
c6yh3z,China Orders Halt to Advanced Placement History Tests,,IntlEdMan13,worldnews,4,5,1561811916,/r/worldnews/comments/c6yh3z/china_orders_halt_to_advanced_placement_history/,https://www.scmp.com/news/china/diplomacy/article/3015506/china-orders-halt-history-tests-students-seeking-credits-us,china,2025-12-08 10:57:24
c6y912,"Huawei trade ban is set to be lifted by President Trump who referred to Huawei as a “threat to national security“, that opinion seems to have softened as this ban is likely being lifted as part of a trade deal with China.",,hastagelf,worldnews,5,4,1561810412,/r/worldnews/comments/c6y912/huawei_trade_ban_is_set_to_be_lifted_by_president/,https://9to5google.com/2019/06/29/huawei-trade-ban-lifted/,china,2025-12-08 10:57:24
c6xvnc,China and US agree to restart trade talks,,Bit-Random,worldnews,15,2,1561807760,/r/worldnews/comments/c6xvnc/china_and_us_agree_to_restart_trade_talks/,https://www.reuters.com/article/us-g20-summit-trade/back-on-track-china-and-u-s-agree-to-restart-trade-talks-idUSKCN1TT373,china,2025-12-08 10:57:24
c6xv0l,Trump eases Huawei ban as part of trade truce with China,,toaster_hitman,worldnews,14,4,1561807633,/r/worldnews/comments/c6xv0l/trump_eases_huawei_ban_as_part_of_trade_truce/,https://www.fin24.com/Companies/trump-eases-huawei-ban-as-part-of-trade-truce-with-china-20190629,china,2025-12-08 10:57:24
c6xtug,US dared: Help Philippines stop China | Philstar.com,,AntiSocialLurker,worldnews,7,2,1561807387,/r/worldnews/comments/c6xtug/us_dared_help_philippines_stop_china_philstarcom/,https://www.philstar.com/headlines/2019/06/27/1929977/us-dared-help-philippines-stop-china,china,2025-12-08 10:57:24
c6xjkv,"Abe's G-20 show eclipsed by Trump-China trade talks, tweets",[deleted],[deleted],worldnews,2,1,1561805204,/r/worldnews/comments/c6xjkv/abes_g20_show_eclipsed_by_trumpchina_trade_talks/,https://www.apnews.com/57f7b79c7da14afda9ac87fd13cccd83,china,2025-12-08 10:57:24
c6xims,Trump says U.S. will hold off on new China tariffs as trade talks restart,,shehzad,worldnews,5,2,1561805011,/r/worldnews/comments/c6xims/trump_says_us_will_hold_off_on_new_china_tariffs/,https://www.nbcnews.com/politics/politics-news/u-s-china-restart-trade-talks-trump-xi-meet-n1024891,china,2025-12-08 10:57:24
c6x7u8,Apple to move Mac Pro production to China: WSJ,,StypticParasite,worldnews,37,3,1561802752,/r/worldnews/comments/c6x7u8/apple_to_move_mac_pro_production_to_china_wsj/,https://www.france24.com/en/20190629-apple-move-mac-pro-production-china-wsj,china,2025-12-08 10:57:24
c6x6no,"Trump relents on Huawei in China truce, reviving stalled talks.",,Morgennes,worldnews,12,3,1561802505,/r/worldnews/comments/c6x6no/trump_relents_on_huawei_in_china_truce_reviving/,https://www.bloomberg.com/news/articles/2019-06-29/xi-trump-agree-to-restart-trade-talks-china-says,china,2025-12-08 10:57:24
c6x0f2,"US and China agree to restart trade talks - The United States and China have agreed to resume trade negotiations, easing a protracted row that has fuelled a global economic slowdown.",,tipselite,worldnews,33,8,1561801188,/r/worldnews/comments/c6x0f2/us_and_china_agree_to_restart_trade_talks_the/,https://www.bbc.com/news/world-48810070,china,2025-12-08 10:57:24
c6wwgn,"Trump says agreed U.S. won't raise tariffs, China will buy U.S. farm goods",,snicker33,worldnews,7,3,1561800321,/r/worldnews/comments/c6wwgn/trump_says_agreed_us_wont_raise_tariffs_china/,https://www.reuters.com/article/us-g20-summit-trump/trump-says-agreed-u-s-wont-raise-tariffs-china-will-buy-u-s-farm-goods-idUSKCN1TU08B?feedType=RSS&feedName=businessNews&utm_source=reddit.com,china,2025-12-08 10:57:24
c6wsmj,Trump announces negotiations with China are ‘back on track’,,trendyupdatenews,worldnews,1,0,1561799497,/r/worldnews/comments/c6wsmj/trump_announces_negotiations_with_china_are_back/,https://trendyupdatenews.com/trump-announces-negotiations-with-china-are-back-on-track/,china,2025-12-08 10:57:24
c6wn9e,Trump Says He’ll Allow China’s Huawei to Buy From U.S. Suppliers,[deleted],[deleted],worldnews,1,1,1561798295,/r/worldnews/comments/c6wn9e/trump_says_hell_allow_chinas_huawei_to_buy_from/,https://www.bloomberg.com/news/articles/2019-06-29/trump-says-he-ll-allow-china-s-huawei-to-buy-from-u-s-suppliers,china,2025-12-08 10:57:24
c6wn42,G20 summit: Trump and Xi agree to restart US-China trade talks,[deleted],[deleted],worldnews,3,1,1561798257,/r/worldnews/comments/c6wn42/g20_summit_trump_and_xi_agree_to_restart_uschina/,https://www.bbc.com/news/world-48810070,china,2025-12-08 10:57:24
c6wdzv,Trump and Xi agree to restart US-China trade talks,[deleted],[deleted],worldnews,1,1,1561796230,/r/worldnews/comments/c6wdzv/trump_and_xi_agree_to_restart_uschina_trade_talks/,https://www.bbc.com/news/world-48810070,china,2025-12-08 10:57:24
c6w8dt,"The US and China just reached a trade-war truce, delaying $300 billion worth of planned tariffs | Markets Insider",,Derpycwynn,worldnews,10,4,1561794996,/r/worldnews/comments/c6w8dt/the_us_and_china_just_reached_a_tradewar_truce/,https://markets.businessinsider.com/news/stocks/trump-xi-meeting-g20-june-us-china-trade-war-ceasefire-2019-6-1028318823,china,2025-12-08 10:57:24
c6w34o,Trump says U.S. will hold off on new China tariffs 'for the time being' as trade talks resume,,MyBoggartIsABoggart,worldnews,8,1,1561793883,/r/worldnews/comments/c6w34o/trump_says_us_will_hold_off_on_new_china_tariffs/,https://www.usatoday.com/story/news/politics/2019/06/28/donald-trump-xi-jinping-hold-make-break-trade-meeting/1592712001/,china,2025-12-08 10:57:24
c6w0zq,China says it won't allow discussion on Hong Kong at G20 summit in Osaka,,Blackhk,worldnews,1,1,1561793450,/r/worldnews/comments/c6w0zq/china_says_it_wont_allow_discussion_on_hong_kong/,https://japantoday.com/category/politics/china-%27won%27t-allow%27-g20-discussion-on-hong-kong,china,2025-12-08 10:57:24
c6vy3o,China agrees to restart U.S. trade talks as Trump says “back on track”,,dhruvdhanda15,worldnews,0,1,1561792871,/r/worldnews/comments/c6vy3o/china_agrees_to_restart_us_trade_talks_as_trump/,https://www.thehindu.com/news/international/china-us-agree-at-xi-trump-meeting-to-restart-trade-talks-xinhua/article28224657.ece?homepage=true,china,2025-12-08 10:57:24
c6v3n8,Trump announces negotiations with China are ‘back on track’,,dailytrendshunter,worldnews,1,0,1561786696,/r/worldnews/comments/c6v3n8/trump_announces_negotiations_with_china_are_back/,https://dailytrendshunter.com/trump-announces-negotiations-with-china-are-back-on-track/,china,2025-12-08 10:57:24
c6uyhg,"'We're right back on track', says Trump after high-stake meeting with China's Xi",,chilltenor,worldnews,7,1,1561785718,/r/worldnews/comments/c6uyhg/were_right_back_on_track_says_trump_after/,https://www.straitstimes.com/asia/east-asia/trump-xi-begin-high-stakes-g-20-meeting-on-trade-tensions,china,2025-12-08 10:57:24
c6tu0a,"Iran may stand down on nuclear threat after Europe, China work to bypass US sanctions",,hyperiony17,worldnews,108,22,1561778630,/r/worldnews/comments/c6tu0a/iran_may_stand_down_on_nuclear_threat_after/,https://abcnews.go.com/Politics/iran-stand-nuclear-threat-europe-china-work-bypass/story?id=64021813,china,2025-12-08 10:57:24
c6sznn,G20: Crunch time as US-China showdown looms,,Onlevelup,worldnews,1,1,1561773513,/r/worldnews/comments/c6sznn/g20_crunch_time_as_uschina_showdown_looms/,http://hindutimeindia.blogspot.com/2019/06/g20-crunch-time-as-us-china-showdown.html,china,2025-12-08 10:57:24
c6se6a,China is Starting to Lean Into Hydrogen Fuel Cells,,bluefirecorp,worldnews,18,19,1561769948,/r/worldnews/comments/c6se6a/china_is_starting_to_lean_into_hydrogen_fuel_cells/,https://www.insidercarnews.com/china-is-starting-to-lean-into-hydrogen-fuel-cells/,china,2025-12-08 10:57:24
c6sckt,"China’s first 100MW molten salt solar plant hits maximum power. The facility, which serves as a solar thermal power generation demonstration project, has exceeded the amount of power it was originally planned to produce",,solar-cabin,worldnews,464,225,1561769673,/r/worldnews/comments/c6sckt/chinas_first_100mw_molten_salt_solar_plant_hits/,https://www.energylivenews.com/2019/06/21/chinas-first-100mw-molten-salt-solar-plant-hits-maximum-power/,china,2025-12-08 10:57:24
c6qyh4,AMD denies violating US laws in China chip venture,,aktivate74,worldnews,3,3,1561762093,/r/worldnews/comments/c6qyh4/amd_denies_violating_us_laws_in_china_chip_venture/,https://www.businessinsider.com/amd-denies-violating-us-laws-china-processors-2019-6,china,2025-12-08 10:57:24
c6ol3a,Apple is reportedly moving production of its only major product assembled in the US to China,[deleted],[deleted],worldnews,2,2,1561750552,/r/worldnews/comments/c6ol3a/apple_is_reportedly_moving_production_of_its_only/,https://www.businessinsider.com/apple-moves-mac-pro-production-to-china-from-us-wsj-2019-6,china,2025-12-08 10:57:24
c6oeyw,"Stock market players are simple and fearful amateurs, because the US-China trade deal appears elusive at G20 summit",,TirelessProsecutor,worldnews,0,0,1561749715,/r/worldnews/comments/c6oeyw/stock_market_players_are_simple_and_fearful/,https://www.aljazeera.com/ajimpact/slipping-china-trade-deal-appears-elusive-g20-summit-190628120908184.html,china,2025-12-08 10:57:24
c6nzpc,Explainer: U.S.-China trade war - the levers each country can pull,,showmethepokemon,worldnews,2,2,1561747674,/r/worldnews/comments/c6nzpc/explainer_uschina_trade_war_the_levers_each/,https://www.reuters.com/article/us-usa-china-trade-levers-explainer/explainer-u-s-china-trade-war-the-levers-each-country-can-pull-idUSKCN1TT2Q1,china,2025-12-08 10:57:24
c6kuf4,"Apple stops Mac Pro production in China, moves it to the U.S.",[deleted],[deleted],worldnews,0,23,1561732093,/r/worldnews/comments/c6kuf4/apple_stops_mac_pro_production_in_china_moves_it/,https://world-news-monitor.com/technology/2019/06/28/apple-stops-mac-pro-production-in-china-moves-it-to-the-u-s/,china,2025-12-08 10:57:24
c6jhcn,US ambassador: We need the EU as a partner to tackle China,,FedRepofEurope,worldnews,0,10,1561724131,/r/worldnews/comments/c6jhcn/us_ambassador_we_need_the_eu_as_a_partner_to/,https://www.euractiv.com/section/politics/news/us-ambassador-we-need-the-eu-as-a-partner-to-tackle-china/,china,2025-12-08 10:57:24
c6j6r2,India treads a fine line with US-Japan and China-Russia at G-20,,J_A_P_A_N,worldnews,1,1,1561722225,/r/worldnews/comments/c6j6r2/india_treads_a_fine_line_with_usjapan_and/,https://asia.nikkei.com/Politics/G-20-summit-Osaka/India-treads-a-fine-line-with-US-Japan-and-China-Russia-at-G-20,china,2025-12-08 10:57:24
c6it35,"G20: Protests in Osaka over Hong Kong extradition law, as Japan's Abe raises concerns with China's Xi Jinping",,limoto,worldnews,198,29,1561719562,/r/worldnews/comments/c6it35/g20_protests_in_osaka_over_hong_kong_extradition/,https://www.hongkongfp.com/2019/06/28/g20-protests-osaka-hong-kong-extradition-law-japans-abe-raises-concerns-chinas-xi-jinping/,china,2025-12-08 10:57:24
c6iaeg,Russia and China agree to ditch US dollar in favor of trade in ruble and yuan.,[deleted],[deleted],worldnews,21,18,1561715535,/r/worldnews/comments/c6iaeg/russia_and_china_agree_to_ditch_us_dollar_in/,https://www.rt.com/business/462884-russia-china-ruble-yuan-trade/,china,2025-12-08 10:57:24
c6i605,Faces for cookware: data collection industry flourishes as China pursues AI ambitions,,Albion_Tourgee,worldnews,10,0,1561714566,/r/worldnews/comments/c6i605/faces_for_cookware_data_collection_industry/,https://www.reuters.com/article/us-china-ai-data-insight/faces-for-cookware-data-collection-industry-flourishes-as-china-pursues-ai-ambitions-idUSKCN1TS3EA?feedType=RSS&feedName=topNews&utm_source=feedburner&utm_medium=feed&utm_campaign=Feed%3A+reuters%2FtopNews+%28News+%2F+US+%2F+Top+News%29,china,2025-12-08 10:57:24
c6gdn3,Nike pulls products in China after designer sparks social media outrage,,imstayinalive,worldnews,10,4,1561700592,/r/worldnews/comments/c6gdn3/nike_pulls_products_in_china_after_designer/,https://www.cnn.com/2019/06/27/business/nike-china-japan-hong-kong/index.html,china,2025-12-08 10:57:24
c6fy3g,"Trump talks trade at G20, China's Xi warns against protectionism",,antherxee,worldnews,1,0,1561697707,/r/worldnews/comments/c6fy3g/trump_talks_trade_at_g20_chinas_xi_warns_against/,https://www.reuters.com/article/us-g20-summit-trump-abe/trump-talks-trade-at-g20-chinas-xi-warns-against-protectionism-idUSKCN1TT00H,china,2025-12-08 10:57:24
c6fngq,China hawks fear Trump is ready to deal on Huawei,,saifali51,worldnews,1,4,1561695770,/r/worldnews/comments/c6fngq/china_hawks_fear_trump_is_ready_to_deal_on_huawei/,https://www.washingtonpost.com/business/economy/china-hawks-fear-trump-is-ready-to-deal-on-huawei/2019/06/27/1093e49c-991a-11e9-916d-9c61607d8190_story.html?utm_term=.0aaf1068a87a,china,2025-12-08 10:57:24
c6fmtc,"U.S. and China Angle for Trade Truce, but Both Insist the Other Will Back Down",[deleted],[deleted],worldnews,1,1,1561695659,/r/worldnews/comments/c6fmtc/us_and_china_angle_for_trade_truce_but_both/,https://www.nytimes.com/2019/06/27/us/politics/us-china-g20-trade.html,china,2025-12-08 10:57:24
c6d1tn,How the US-China Trade War Could Impact US-EU Negotiations and the WTO,,Teutonic_Action,worldnews,1,0,1561680288,/r/worldnews/comments/c6d1tn/how_the_uschina_trade_war_could_impact_useu/,https://www.atlanticcouncil.org/blogs/new-atlanticist/how-the-us-china-trade-war-could-impact-us-eu-negotiations-and-the-wto,china,2025-12-08 10:57:24
c6cpbq,"China's military warns the U.S. must get with the times: ""Those who resist will perish""",,vilekangaree,worldnews,0,17,1561678310,/r/worldnews/comments/c6cpbq/chinas_military_warns_the_us_must_get_with_the/,https://www.newsweek.com/china-warn-us-perish-1446338,china,2025-12-08 10:57:24
c6c53g,"Baoshang Bank collapse may me China's Lehman moment, threatens China's economy and may trigger central bank response",[deleted],[deleted],worldnews,4,2,1561675209,/r/worldnews/comments/c6c53g/baoshang_bank_collapse_may_me_chinas_lehman/,https://www.abc.net.au/news/2019-06-28/baoshang-bank-collapse-hits-lending-threatens-chinese-economy/11252022,china,2025-12-08 10:57:24
c6c0xk,Could the collapse of a small regional bank be China’s ‘Lehman moment’?,,newsunbox,worldnews,1,0,1561674565,/r/worldnews/comments/c6c0xk/could_the_collapse_of_a_small_regional_bank_be/,https://newsunbox.com/could-the-collapse-of-a-small-regional-bank-be-chinas-lehman-moment/,china,2025-12-08 10:57:24
c6bbaw,"Dutch PM says China has stuck to climate goals despite economy, trade war",,StypticParasite,worldnews,23,20,1561670880,/r/worldnews/comments/c6bbaw/dutch_pm_says_china_has_stuck_to_climate_goals/,http://www.euronews.com/2019/06/27/dutch-pm-says-china-has-stuck-to-climate-goals-despite-economy-trade-war,china,2025-12-08 10:57:24
c69445,Nike forced to pull shoe line in China after designer supports Hong Kong protest,[deleted],[deleted],worldnews,100,8,1561660206,/r/worldnews/comments/c69445/nike_forced_to_pull_shoe_line_in_china_after/,https://world-news-monitor.com/top-news/2019/06/27/nike-forced-to-pull-shoe-line-in-china-after-designer-supports-hong-kong-protest/,china,2025-12-08 10:57:24
c676gn,Report: China fighters buzz Canada warship in East China Sea,,tarnok,worldnews,5,4,1561650723,/r/worldnews/comments/c676gn/report_china_fighters_buzz_canada_warship_in_east/,https://newsinfo.inquirer.net/1134969/report-china-fighters-buzz-canada-warship-in-east-china-sea,china,2025-12-08 10:57:24
c66xoq,Canadian navy ships sailed through Taiwan strait amid tension with China,,yourSAS,worldnews,21,4,1561649500,/r/worldnews/comments/c66xoq/canadian_navy_ships_sailed_through_taiwan_strait/,https://www.reuters.com/article/us-china-canada-taiwanstrait/canadian-navy-ships-sailed-through-taiwan-strait-amid-tension-with-china-idUSKCN1TS0ZX,china,2025-12-08 10:57:24
c66hvd,Will China be the next world superpower?,,JenniferHollister,worldnews,1,1,1561647327,/r/worldnews/comments/c66hvd/will_china_be_the_next_world_superpower/,https://thepurepolitics.com/2019/06/24/will-china-be-the-next-world-superpower/,china,2025-12-08 10:57:24
c66gjl,Elaine Chao Learned From the Best The transportation secretary is part of a long line of individuals who’ve bridged China and the United States—and done well for themselves in the process.,,kaffmoo,worldnews,3,1,1561647125,/r/worldnews/comments/c66gjl/elaine_chao_learned_from_the_best_the/,https://foreignpolicy.com/2019/06/26/971797-elaine-chao-anna-chennault-china-united-states-mitch-mcconnell/,china,2025-12-08 10:57:24
c6626v,China fighters buzz Canada warship in East China Sea: report,,idarknight,worldnews,10,6,1561645048,/r/worldnews/comments/c6626v/china_fighters_buzz_canada_warship_in_east_china/,https://www.ctvnews.ca/canada/china-fighters-buzz-canada-warship-in-east-china-sea-report-1.4484852,china,2025-12-08 10:57:24
c65nii,"Hey China, while you're in all our servers, can you fix these support tickets? IBM, HPE, Tata CS, Fujitsu, NTT and their customers pwned",[deleted],[deleted],worldnews,11,4,1561642834,/r/worldnews/comments/c65nii/hey_china_while_youre_in_all_our_servers_can_you/,https://www.theregister.co.uk/2019/06/26/china_apt10_hpe_ibm_dxc_hacked/,china,2025-12-08 10:57:24
c65ldj,China's Xi to present Trump with terms for settling trade deal: WSJ,,sshort21,worldnews,3,14,1561642486,/r/worldnews/comments/c65ldj/chinas_xi_to_present_trump_with_terms_for/,https://www.cnbc.com/2019/06/27/chinas-xi-to-present-trump-with-terms-for-settling-trade-deal-wsj.html,china,2025-12-08 10:57:24
c64zl0,"Beyond Meat's Asia Ally Taking Alt-Pork to Swine Fever-Hit China - After its success distributing Beyond Meat's products in Asia, start-up Green Monday has a new food challenge: convince Chinese consumers to try its lab-grown meatless pork",[deleted],[deleted],worldnews,0,4,1561638940,/r/worldnews/comments/c64zl0/beyond_meats_asia_ally_taking_altpork_to_swine/,https://finance.yahoo.com/news/beyond-meats-asia-ally-taking-044350013.html,china,2025-12-08 10:57:24
c64qx3,Japan PM Abe Says Hopes for 'New Era' in Japan-China Relations,,wizardofthefuture,worldnews,13,6,1561637412,/r/worldnews/comments/c64qx3/japan_pm_abe_says_hopes_for_new_era_in_japanchina/,https://www.usnews.com/news/world/articles/2019-06-27/japan-pm-abe-says-hopes-for-new-era-in-japan-china-relations,china,2025-12-08 10:57:24
c64o7e,"China’s education authorities have ordered an elite university to stop offering as much as 500,000 yuan (US$72,670) in the race to attract the country’s top-scoring high school students.",,ManiaforBeatles,worldnews,16,1,1561636931,/r/worldnews/comments/c64o7e/chinas_education_authorities_have_ordered_an/,https://www.scmp.com/news/china/society/article/3016360/why-did-one-chinas-elite-universities-need-offer-big-money-get,china,2025-12-08 10:57:24
c64i3n,A fly-on-the-wall account of what China tells American bigwigs,,OverallAdvisor,worldnews,5,2,1561635762,/r/worldnews/comments/c64i3n/a_flyonthewall_account_of_what_china_tells/,https://www.economist.com/china/2019/06/22/a-fly-on-the-wall-account-of-what-china-tells-american-bigwigs,china,2025-12-08 10:57:24
c64gv2,China Guizhou Orphanage Provides Sex Services to Pedophiles,,joker9387,worldnews,1,1,1561635535,/r/worldnews/comments/c64gv2/china_guizhou_orphanage_provides_sex_services_to/,https://www.sixthtone.com/news/1004199/guizhou-to-investigate-rumors-of-orphanage-sex-abuse,china,2025-12-08 10:57:24
c63kbw,"Huawei employees reportedly worked with China's military on multiple research projects, strengthening concerns over state ties",,viva_la_vinyl,worldnews,32,12,1561628904,/r/worldnews/comments/c63kbw/huawei_employees_reportedly_worked_with_chinas/,https://www.businessinsider.com/report-huawei-employees-helped-china-military-on-research-projects-2019-6,china,2025-12-08 10:57:24
c63js1,"Trump threatens Vietnam, which has been benefiting from U.S. tariffs on China",,viva_la_vinyl,worldnews,20,4,1561628788,/r/worldnews/comments/c63js1/trump_threatens_vietnam_which_has_been_benefiting/,https://www.marketwatch.com/story/trump-threatens-vietnam-which-has-been-benefiting-from-us-tariffs-on-china-2019-06-26,china,2025-12-08 10:57:24
c63692,"Watch The Trailer For The VICE News Tonight Special Report, “They Come For Us At Night: China’s Vanishing Muslims”",,trendyupdatenews,worldnews,1,0,1561625795,/r/worldnews/comments/c63692/watch_the_trailer_for_the_vice_news_tonight/,https://trendyupdatenews.com/watch-the-trailer-for-the-vice-news-tonight-special-report-they-come-for-us-at-night-chinas-vanishing-muslims/,china,2025-12-08 10:57:24
c635at,“EU treats us worse than China does!” Trump lashes out at Brussels anti-Americanism,,DebtJubilee,worldnews,1,1,1561625575,/r/worldnews/comments/c635at/eu_treats_us_worse_than_china_does_trump_lashes/,https://www.express.co.uk/news/world/1145927/Donald-Trump-news-USA-EU-Google-Facebook-G20-Japan-latest-update,china,2025-12-08 10:57:24
c6357d,"Food industry experts are pushing back after China halted all Canadian meat imports, saying there is no widespread problem when it comes to counterfeit veterinary-health certificates in Canada and that China should investigate its own supply chains.",,ManiaforBeatles,worldnews,11,2,1561625550,/r/worldnews/comments/c6357d/food_industry_experts_are_pushing_back_after/,https://globalnews.ca/news/5434091/china-canada-forged-canadian-meat-certificates-experts/,china,2025-12-08 10:57:24
