id,title,selftext,author,subreddit,score,num_comments,created_utc,permalink,url,period,topic,collection_date
e96ch0,The anti-Putin ‘shaman warrior’ who spooked the Kremlin,[deleted],[deleted],politics,7,2,1576066454,/r/politics/comments/e96ch0/the_antiputin_shaman_warrior_who_spooked_the/,https://www.politico.eu/article/alexander-gabyshev-anti-putin-shaman-warrior-who-spooked-the-kremlin/,post_hanoi,russia,2025-12-12 17:32:42
e8tis1,The ‘Russia Hoax’ Is a Hoax: A report by the FBI inspector general debunks the claims that the investigation into political interference by the Kremlin was a left-wing conspiracy to depose the president.,[deleted],[deleted],politics,6,2,1575998253,/r/politics/comments/e8tis1/the_russia_hoax_is_a_hoax_a_report_by_the_fbi/,https://www.theatlantic.com/ideas/archive/2019/12/there-was-never-deep-state-conspiracy-get-trump/603361/,post_hanoi,russia,2025-12-12 17:32:42
e8qq8j,How Russian Agents Hunt Down Kremlin Opponents,[deleted],[deleted],politics,9,2,1575985215,/r/politics/comments/e8qq8j/how_russian_agents_hunt_down_kremlin_opponents/,https://www.spiegel.de/international/world/how-russian-agents-hunt-down-kremlin-opponents-in-europe-a-1300091.html,post_hanoi,russia,2025-12-12 17:32:42
e8pt79,"Bill Barr Is About To Strike Again; Just As the Attorney General Lied About the Mueller Report, He’s Now About to Undercut a Report on the Origins of the Trump-Kremlin Investigation",,Thinkingonsleeping,politics,2,3,1575979760,/r/politics/comments/e8pt79/bill_barr_is_about_to_strike_again_just_as_the/,https://www.dcreport.org/2019/12/09/attorney-general-bill-barr-is-poised-to-strike-again/,post_hanoi,russia,2025-12-12 17:32:42
e8lre1,How Russian Agents Hunt Down Kremlin Opponents,[deleted],[deleted],politics,22,3,1575952384,/r/politics/comments/e8lre1/how_russian_agents_hunt_down_kremlin_opponents/,https://www.spiegel.de/international/world/how-russian-agents-hunt-down-kremlin-opponents-in-europe-a-1300091.html,post_hanoi,russia,2025-12-12 17:32:42
e75awq,Trump and Giuliani's Unsecured Calls Mean Kremlin Likely Knows More Than Impeachment Inquiry: CIA's Ex-Russia Ops Chief,,nclobo,politics,494,17,1575669729,/r/politics/comments/e75awq/trump_and_giulianis_unsecured_calls_mean_kremlin/,https://www.newsweek.com/trump-giuliani-call-logs-russia-ukraine-impeachment-cia-1475868?utm_campaign=NewsweekTwitter&utm_source=Twitter&utm_medium=Social,post_hanoi,russia,2025-12-12 17:32:42
e6ynhw,"Trump and Giuliani's unsecured calls mean Kremlin likely knows more than impeachment inquiry, suggests CIA's ex-Russia ops chief",,qdude1,politics,1189,48,1575638333,/r/politics/comments/e6ynhw/trump_and_giulianis_unsecured_calls_mean_kremlin/,https://www.newsweek.com/trump-giuliani-call-logs-russia-ukraine-impeachment-cia-1475868,post_hanoi,russia,2025-12-12 17:32:42
e6j4c5,Impeachment Is Pushing Republicans Closer to Russia | GOP lawmakers used to oppose the president’s embrace of Putin and the Kremlin. Not anymore.,,billthomson,politics,860,49,1575561478,/r/politics/comments/e6j4c5/impeachment_is_pushing_republicans_closer_to/,https://www.theatlantic.com/politics/archive/2019/12/impeachment-republican-party-russia/603088/,post_hanoi,russia,2025-12-12 17:32:42
e5xun3,The Republican Party Is Now Living in a Kremlin Fantasy World,,chris-jjj,politics,3066,76,1575458747,/r/politics/comments/e5xun3/the_republican_party_is_now_living_in_a_kremlin/,https://washingtonmonthly.com/2019/12/03/the-republican-party-is-now-living-in-a-kremlin-fantasy-world/,post_hanoi,russia,2025-12-12 17:32:42
e5im0d,Nicolle Wallace Quips Putin Must Have ‘Lots of Pee Tapes’ for GOP to Push Kremlin Line,[deleted],[deleted],politics,2,4,1575386606,/r/politics/comments/e5im0d/nicolle_wallace_quips_putin_must_have_lots_of_pee/,https://m.huffpost.com/us/entry/us_5de5b8bfe4b0913e6f841485,post_hanoi,russia,2025-12-12 17:32:42
e5hu1v,Nicolle Wallace Quips Putin Must Have ‘Lots Of Pee Tapes’ For GOP To Push Kremlin Line,,heinderhead,politics,7436,344,1575383170,/r/politics/comments/e5hu1v/nicolle_wallace_quips_putin_must_have_lots_of_pee/,https://www.huffpost.com/entry/nicolle-wallace-pee-tapes-putin-election-interference_n_5de5b8bfe4b0913e6f841485,post_hanoi,russia,2025-12-12 17:32:42
e503zf,What to do about the Kremlin’s propagandists,,formeraide,politics,316,25,1575298404,/r/politics/comments/e503zf/what_to_do_about_the_kremlins_propagandists/,https://www.washingtonpost.com/opinions/2019/12/02/what-do-about-kremlins-propagandists/,post_hanoi,russia,2025-12-12 17:32:42
e28hqq,Kremlin funds viral videos aimed at millennials,,optout1,politics,9,5,1574818747,/r/politics/comments/e28hqq/kremlin_funds_viral_videos_aimed_at_millennials/,https://www.cnn.com/videos/politics/2019/02/15/facebook-page-russian-government-kremlin-millenial-left-leaning-maffick-digital-griffin-pkg-vpx.cnn,post_hanoi,russia,2025-12-12 17:32:42
e1gtxl,"GOP officials ignore warnings, help echo Kremlin propaganda",,shill_hunter_x,politics,6596,130,1574692423,/r/politics/comments/e1gtxl/gop_officials_ignore_warnings_help_echo_kremlin/,http://www.msnbc.com/rachel-maddow-show/gop-officials-ignore-warnings-help-echo-kremlin-propaganda,post_hanoi,russia,2025-12-12 17:32:42
e13tra,Video: Russia’s opposition leader claims to have figured out the Trump campaign’s Kremlin connection,,30ustice4,politics,1,1,1574626126,/r/politics/comments/e13tra/video_russias_opposition_leader_claims_to_have/,https://qz.com/1202800/alexey-navalny-says-oleg-deripaska-transmitted-trump-campaign-information-from-paul-manafort-to-the-kremlin/,post_hanoi,russia,2025-12-12 17:32:42
e139vs,Russian Activist Alleges New Link Between the Kremlin and Paul Manafort,,30ustice4,politics,1,1,1574623889,/r/politics/comments/e139vs/russian_activist_alleges_new_link_between_the/,https://www.motherjones.com/politics/2018/02/escort-paul-manafort-sergey-prikhodko-nastya-rybka-oleg-deripaska/,post_hanoi,russia,2025-12-12 17:32:42
e049jc,Tulsi Gabbard is overwhelming favorite of Kremlin news outlets,,-Ph03niX-,politics,1,1,1574444133,/r/politics/comments/e049jc/tulsi_gabbard_is_overwhelming_favorite_of_kremlin/,http://www.hawaiifreepress.com/ArticlesMain/tabid/56/ID/24473/Tulsi-Gabbard-is-overwhelming-favorite-of-Kremlin-news-outlets.aspx,post_hanoi,russia,2025-12-12 17:32:42
dzpbtm,"Americans Steal Kremlin’s Playbook, for Clicks and Profit—An investigation found that a former Fox News executive hired Macedonians to write culturally and politically divisive content for his websites.",,upnorthgirl,politics,530,13,1574367944,/r/politics/comments/dzpbtm/americans_steal_kremlins_playbook_for_clicks_and/,https://www.nytimes.com/2019/11/21/technology/LaCorte-edition-news.html,post_hanoi,russia,2025-12-12 17:32:42
dzntyu,Trump Russia adviser scolds Republicans for repeating Kremlin lies,,wyldcat,politics,1242,18,1574362061,/r/politics/comments/dzntyu/trump_russia_adviser_scolds_republicans_for/,https://www.smh.com.au/world/north-america/trump-russia-adviser-scolds-republicans-for-repeating-kremlin-lies-20191122-p53cz6.html,post_hanoi,russia,2025-12-12 17:32:42
dznpta,"Americans Steal Kremlin’s Playbook, for Clicks and Profit",[deleted],[deleted],politics,8,2,1574361590,/r/politics/comments/dznpta/americans_steal_kremlins_playbook_for_clicks_and/,https://www.nytimes.com/2019/11/21/technology/LaCorte-edition-news.html,post_hanoi,russia,2025-12-12 17:32:42
dykuqq,"The Kremlin has Rudy's phone, and probably listens to all his discussions with his ""client"". It means that Putin knows more about the president's actions, problems and views than the American people.",,30ustice4,politics,1,1,1574172420,/r/politics/comments/dykuqq/the_kremlin_has_rudys_phone_and_probably_listens/,https://www.nytimes.com/2019/11/18/us/politics/giuliani-cellphone-hacking-russia-ukraine.html?smid=nytcore-ios-share,post_hanoi,russia,2025-12-12 17:32:42
dxaije,National security expert: Things Trump advocates benefit Kremlin,,nclobo,politics,664,19,1573928703,/r/politics/comments/dxaije/national_security_expert_things_trump_advocates/,http://www.msnbc.com/am-joy/watch/gop-lawmakers-repeat-debunked-ukraine-interference-conspiracy-73591365810,post_hanoi,russia,2025-12-12 17:32:42
dx7s5s,Russia Loves the Impeachment Hearings Because GOP Is Parroting Kremlin Propaganda,[deleted],[deleted],politics,5,2,1573915825,/r/politics/comments/dx7s5s/russia_loves_the_impeachment_hearings_because_gop/,https://www.thedailybeast.com/watching-impeachment-russian-media-delighted-trump-doesnt-give-a-s-t-about-ukraine?via=ios,post_hanoi,russia,2025-12-12 17:32:42
dvsiry,Trump impeachment: Russia says claims against US president 'far-fetched' as public hearings begin. Kremlin compares process to remove Trump from office to allegations of 2016 interference.,,chelsea707,politics,36,31,1573655327,/r/politics/comments/dvsiry/trump_impeachment_russia_says_claims_against_us/,https://www.independent.co.uk/news/world/americas/us-politics/trump-impeachment-hearings-tody-russia-putin-public-a9201411.html,post_hanoi,russia,2025-12-12 17:32:42
dvs2wl,The Latest: Kremlin weighs in on Trump impeachment hearings,,bdsaddam39,politics,4,12,1573653270,/r/politics/comments/dvs2wl/the_latest_kremlin_weighs_in_on_trump_impeachment/,https://www.washingtonpost.com/politics/the-latest-kremlin-weighs-in-on-trump-impeachment-hearings/2019/11/13/df19d790-061b-11ea-9118-25d6bd37dfb1_story.html,post_hanoi,russia,2025-12-12 17:32:42
dv03qk,Why the Kremlin Targets Veterans,,wyldcat,politics,33,10,1573510956,/r/politics/comments/dv03qk/why_the_kremlin_targets_veterans/,https://www.csis.org/analysis/why-kremlin-targets-veterans,post_hanoi,russia,2025-12-12 17:32:42
dsmyz1,The American Prisoner Caught Between Trump and the Kremlin,[deleted],[deleted],politics,2,1,1573075978,/r/politics/comments/dsmyz1/the_american_prisoner_caught_between_trump_and/,https://www.theatlantic.com/politics/archive/2019/11/paul-whelan-caught-between-trump-and-kremlin/601411/,post_hanoi,russia,2025-12-12 17:32:42
dseaa1,"Thanks to Rand Paul, Russian Media Are Naming the Alleged Whistleblower - Outing “the whistleblower” is the most egregious, but certainly not the only, example of Kremlin-funded media cheerleading the fight against impeachment. They love “their” Trump",,madam1,politics,1786,80,1573034812,/r/politics/comments/dseaa1/thanks_to_rand_paul_russian_media_are_naming_the/,https://www.thedailybeast.com/thanks-to-trump-booster-rand-paul-russian-media-are-naming-the-alleged-ukraine-whistleblower,post_hanoi,russia,2025-12-12 17:32:42
ds51n1,Trump offers Putin help with Siberian wildfires: Kremlin,[deleted],[deleted],politics,24,12,1572985753,/r/politics/comments/ds51n1/trump_offers_putin_help_with_siberian_wildfires/,https://www.reuters.com/article/us-usa-russia-trump-putin-wildfires/trump-offers-putin-help-with-siberian-wildfires-kremlin-idUSKCN1UQ2UC?fbclid=IwAR1WadioJLUVsk4F6xJdIL3xyaSzf7ut_MFWBTU3tM1YEcSOOOe17_7hmjk,post_hanoi,russia,2025-12-12 17:32:42
drzxi5,Trump offers Putin help with Siberian wildfires: Kremlin,,xbwtyz,politics,124,41,1572964357,/r/politics/comments/drzxi5/trump_offers_putin_help_with_siberian_wildfires/,https://www.reuters.com/article/us-usa-russia-trump-putin-wildfires/trump-offers-putin-help-with-siberian-wildfires-kremlin-idUSKCN1UQ2UC?fbclid=IwAR0srHwSJKGUZ46t6l0F4p8-zVtZeqLX1aALQqOlrE-bRMtHq4gdHq9yQLY,post_hanoi,russia,2025-12-12 17:32:42
drkjeu,Trump offers Putin help with Siberian wildfires: Kremlin,,feelthepress,politics,3,5,1572887069,/r/politics/comments/drkjeu/trump_offers_putin_help_with_siberian_wildfires/,https://www.reuters.com/article/us-usa-russia-trump-putin-wildfires-idUSKCN1UQ2UC,post_hanoi,russia,2025-12-12 17:32:42
dqcygd,Pro-Trump Channel One America News Deploys a Former Kremlin Propagandist to Blast the 'Russia Hoax',,madam1,politics,1652,40,1572654240,/r/politics/comments/dqcygd/protrump_channel_one_america_news_deploys_a/,https://www.thedailybeast.com/pro-trump-channel-one-america-news-deploys-a-former-kremlin-propagandist-to-blast-the-russia-hoax?ref=scroll,post_hanoi,russia,2025-12-12 17:32:42
dp0q73,"You didn’t really think all Russian assets & Kremlin puppets in the US have already been exposed, did you?",[deleted],[deleted],politics,1,1,1572403189,/r/politics/comments/dp0q73/you_didnt_really_think_all_russian_assets_kremlin/,https://shelbybusinessjournal.com/you-didnt-really-think-all-russian-assets-kremlin-puppets-in-the-us-have-already-been-exposed-did-you/,post_hanoi,russia,2025-12-12 17:32:42
dmwv6p,Russian operative Maria Butina set for deportation after prison release - She remains the only Russian to be arrested in connection with a government probe into the Kremlin's interference in the 2016 election.,,Boofing_with_Squee,politics,45,8,1572007115,/r/politics/comments/dmwv6p/russian_operative_maria_butina_set_for/,https://www.nbcnews.com/news/us-news/russian-operative-maria-butina-set-deportation-after-prison-release-n1071801,post_hanoi,russia,2025-12-12 17:32:42
dlz67u,"Kremlin says U.S. betrayed Kurds in Syria, tells Kurds to withdraw or be mauled",,MainEchidna0,politics,3905,164,1571836607,/r/politics/comments/dlz67u/kremlin_says_us_betrayed_kurds_in_syria_tells/,https://www.euronews.com/2019/10/23/kremlin-says-us-betrayed-kurds-in-syria-tells-kurds-to-withdraw-or-be-mauled,post_hanoi,russia,2025-12-12 17:32:42
dlyq22,"""The reason Russia is interested in Tulsi is that Tulsi is interested in dictators. She's tolerant of Kremlin crimes and she's friendly with Trump associates. This is not that complicated."" -- Sarah Kendzior @gaslitnation",[deleted],[deleted],politics,2,1,1571834414,/r/politics/comments/dlyq22/the_reason_russia_is_interested_in_tulsi_is_that/,https://www.patreon.com/posts/tulsi-gabbard-30965342,post_hanoi,russia,2025-12-12 17:32:42
dlhwy6,"The Kremlin’s Strategy for the 2020 U.S. Election: Secure the Base, Split the Opposition",,The-Straight-Story,politics,2,4,1571750774,/r/politics/comments/dlhwy6/the_kremlins_strategy_for_the_2020_us_election/,https://www.thedailybeast.com/the-kremlins-strategy-for-the-2020-us-election-secure-the-base-split-the-opposition?source=twitter&via=desktop,post_hanoi,russia,2025-12-12 17:32:42
dkfmcb,Truth Is A Kremlin Talking Point,,redditor01020,politics,0,20,1571550118,/r/politics/comments/dkfmcb/truth_is_a_kremlin_talking_point/,http://ronpaulinstitute.org/archives/featured-articles/2019/october/17/truth-is-a-kremlin-talking-point/,post_hanoi,russia,2025-12-12 17:32:42
djfith,Truth Is A Kremlin Talking Point,,PowerfulDot1,politics,1,1,1571359124,/r/politics/comments/djfith/truth_is_a_kremlin_talking_point/,https://medium.com/@caityjohnstone/truth-is-a-kremlin-talking-point-5b21202b2df3,post_hanoi,russia,2025-12-12 17:32:42
dj8nyl,Kremlin questions language of 'unusual' Trump letter to Erdogan,,BrautanGud,politics,3,7,1571329109,/r/politics/comments/dj8nyl/kremlin_questions_language_of_unusual_trump/,https://www.reuters.com/article/us-syria-security-trump-erdogan-kremlin-idUSKBN1WW19R,post_hanoi,russia,2025-12-12 17:32:42
dio6ry,"Trump’s Syria Troop Withdrawal Is A ‘Lottery Win’ For Putin, States Kremlin-Backed Paper",,moby323,politics,394,8,1571226624,/r/politics/comments/dio6ry/trumps_syria_troop_withdrawal_is_a_lottery_win/,https://www.newsweek.com/russia-turkey-erdogan-putin-syria-trump-u-s-troops-1465589,post_hanoi,russia,2025-12-12 17:32:42
dhctgg,"Kremlin relishes US pullback from Syria, turmoil in Ukraine",,progress18,politics,946,23,1570984274,/r/politics/comments/dhctgg/kremlin_relishes_us_pullback_from_syria_turmoil/,https://www.apnews.com/e2aa46d615c94fb381db854e018b23fa,post_hanoi,russia,2025-12-12 17:32:42
dfp2w4,"McDermott: If Trump isn't a Kremlin asset, he's doing an Oscar-worthy impersonation of one",,jmsatl,politics,3627,74,1570662399,/r/politics/comments/dfp2w4/mcdermott_if_trump_isnt_a_kremlin_asset_hes_doing/,https://www.stltoday.com/opinion/columnists/kevin-mcdermott/mcdermott-if-trump-isn-t-a-kremlin-asset-he-s/article_3d34a186-0204-55ee-8b62-8ee911e61565.html,post_hanoi,russia,2025-12-12 17:32:42
dflleq,"Kremlin trolls 'uncorked' champagne after helping Trump win, Senate Intelligence Committee reports",,TchotchkeSympathizer,politics,6,3,1570647439,/r/politics/comments/dflleq/kremlin_trolls_uncorked_champagne_after_helping/,https://theweek.com/speedreads/870559/kremlin-trolls-uncorked-champagne-after-helping-trump-win-senate-intelligence-committee-reports/,post_hanoi,russia,2025-12-12 17:32:42
dfgdmq,The Kremlin’s War On American Democracy Only Got Bigger After 2016,,viva_la_vinyl,politics,540,11,1570624448,/r/politics/comments/dfgdmq/the_kremlins_war_on_american_democracy_only_got/,https://www.vice.com/en_us/article/59nkj8/the-kremlins-war-on-american-democracy-only-got-bigger-after-2016,post_hanoi,russia,2025-12-12 17:32:42
dff9x4,"Kremlin trolls 'uncorked' champagne after helping Trump win, Senate Intelligence Committee reports",,rWindhund,politics,6692,190,1570618011,/r/politics/comments/dff9x4/kremlin_trolls_uncorked_champagne_after_helping/,https://theweek.com/speedreads/870559/kremlin-trolls-uncorked-champagne-after-helping-trump-win-senate-intelligence-committee-reports,post_hanoi,russia,2025-12-12 17:32:42
df4ajf,Megathread: Senate Intel Report Finds Kremlin Directed Russian Social Media Meddling In 2016,"The Senate Intelligence Committee on Tuesday released its report on Russian social media interference efforts during the 2016 elections, with the panel finding that Russian actors were directed by the Kremlin to help President Trump win the election.

The report is the second volume to be released as part of the committee’s investigation into Russian interference efforts in the lead-up to the 2016 elections, with its findings mirroring those of former special counsel Robert Mueller in his own report released earlier this year.

A link to the report can be found [here](https://www.intelligence.senate.gov/sites/default/files/documents/Report_Volume2.pdf)

---

##Submissions that may interest you

SUBMISSION | DOMAIN
---|----
[Senate Intel report finds Kremlin directed Russian social media meddling in 2016](https://thehill.com/homenews/senate/464865-senate-intel-report-finds-kremlin-directed-russian-social-media-meddling-in) | thehill.com
[Senate Intel: Russian Propaganda Exploits American Racism](https://www.thedailybeast.com/senate-intel-russian-propaganda-exploits-american-racism?ref=wrap) | thedailybeast.com
[Bipartisan senators ask for laws to block foreign interference in elections on social media: The Senate Intel Committee issued a report Tuesday, the product of a two-year probe into how Russia tried to influence U.S. public opinion in 2016.](https://www.nbcnews.com/politics/congress/gop-dem-senators-ask-laws-block-foreign-interference-elections-social-n1063716) | nbcnews.com
[Russia used social media to support Trump in 2016 at direction of Kremlin, Senate intelligence report says](https://www.independent.co.uk/news/world/americas/us-politics/trump-russia-2016-intelligence-report-read-kremlin-facebook-a9148036.html) | independent.co.uk
[Senate Intel Concludes Russia Intervened In 2016 To Boost Trump](https://talkingpointsmemo.com/muckraker/read-senate-intel-concludes-russia-intervened-in-2016-to-boost-trump) | talkingpointsmemo.com
[Russian trolls tried to stoke racial divisions with the NFL kneeling debate and Colin Kaepernick well after 2016, Senate report says](https://www.businessinsider.com/russian-trolls-used-colin-kaepernick-nfl-kneeling-debate-divide-2019-10) | businessinsider.com
[Read: Senate report finds Russia tried to harm Clinton, boost Trump in 2016 election](https://thehill.com/homenews/senate/464854-read-senate-report-finds-russia-tried-to-harm-clinton-boost-trump-in-2016) | thehill.com
[Senate Intelligence Committee Report on Russian Active Measures: Part Two](https://www.lawfareblog.com/senate-intelligence-committee-report-russian-active-measures-part-two) | lawfareblog.com
[Bipartisan Senate report calls for sweeping effort to prevent Russian interference in 2020 election](https://www.washingtonpost.com/technology/2019/10/08/bipartisan-senate-report-calls-sweeping-effort-prevent-russian-interference-election/) | washingtonpost.com
[Russian propaganda increased after 2016 U.S. election: Senate committee](https://www.reuters.com/article/us-russia-disinformation-senate/russian-propaganda-increased-after-2016-u-s-election-senate-committee-idUSKBN1WN23T) | reuters.com
[A Senate panel asked Trump to condemn foreign election interference days after he called for Ukraine and China to investigate Biden](https://www.businessinsider.com/senate-report-trump-reinforce-danger-election-meddling-ukraine-china-2019-10) | businessinsider.com
[Senate Report: Russians used social media mostly to target race in 2016](https://www.npr.org/2019/10/08/768319934/senate-report-russians-used-used-social-media-mostly-to-target-race-in-2016?utm_campaign=npr&utm_term=nprnews&utm_source=facebook.com&utm_medium=social&fbclid=IwAR1U4DTW23P711kpPcSBAx0JtTZHJk7yneSnCWkv1QTlp4Tzbtb3crYU1iA) | npr.org
[Senate Intel's newest Russia report undermines pro-Trump conspiracy theories](https://www.politico.com/news/2019/10/08/intelligence-committee-russia-trump-report-040736) | politico.com
[Senate Report: 2016 Russian Social Media Campaign Meant to Elect Trump](https://www.broadcastingcable.com/news/senate-report-2016-russian-social-media-campaign-meant-elect-trump) | broadcastingcable.com
[A GOP-led Senate intel committee report states the obvious: Russia favored Trump in 2016](https://www.vox.com/platform/amp/2019/10/8/20905160/senate-intelligence-russia-2016-election) | vox.com
[Analysis - The Technology 202: New Senate report highlights how Russia's social media campaign influenced Americans offline](https://www.washingtonpost.com/news/powerpost/paloma/the-technology-202/2019/10/09/the-technology-202-new-senate-report-highlights-how-russia-s-social-media-campaign-influenced-americans-offline/5d9cbb03602ff16116ea4803/) | washingtonpost.com",PoliticsModeratorBot,politics,49788,5176,1570560406,/r/politics/comments/df4ajf/megathread_senate_intel_report_finds_kremlin/,https://www.reddit.com/r/politics/comments/df4ajf/megathread_senate_intel_report_finds_kremlin/,post_hanoi,russia,2025-12-12 17:32:42
df4076,Senate Intel report finds Kremlin directed Russian social media meddling in 2016,,Face2FaceRecs,politics,44,7,1570559137,/r/politics/comments/df4076/senate_intel_report_finds_kremlin_directed/,https://thehill.com/homenews/senate/464865-senate-intel-report-finds-kremlin-directed-russian-social-media-meddling-in,post_hanoi,russia,2025-12-12 17:32:42
df3enh,"Putin did not receive birthday message from Trump, Kremlin says",,AllByMyZelph,politics,109,51,1570556500,/r/politics/comments/df3enh/putin_did_not_receive_birthday_message_from_trump/,https://www.washingtonpost.com/world/2019/10/08/putin-did-not-receive-birthday-message-trump-kremlin-says/,post_hanoi,russia,2025-12-12 17:32:42
df35jd,"Russia used social media to support Trump in 2016 at direction of Kremlin, Senate intelligence report says",,Austin63867,politics,2750,183,1570555403,/r/politics/comments/df35jd/russia_used_social_media_to_support_trump_in_2016/,https://www.independent.co.uk/news/world/americas/us-politics/trump-russia-2016-intelligence-report-read-kremlin-facebook-a9148036.html,post_hanoi,russia,2025-12-12 17:32:42
deo6i1,Kremlin releases Putin hiking video to mark president's 67th birthday,,plaidcouch,politics,0,8,1570475718,/r/politics/comments/deo6i1/kremlin_releases_putin_hiking_video_to_mark/,https://edition.cnn.com/2019/10/07/europe/putin-siberia-67th-birthday-intl-scli/index.html,post_hanoi,russia,2025-12-12 17:32:42
dc5h4s,News Wrap: Kremlin says it must O.K. Putin-Trump transcript before release,,MySillyYumm,politics,120,29,1569991238,/r/politics/comments/dc5h4s/news_wrap_kremlin_says_it_must_ok_putintrump/,https://www.pbs.org/newshour/show/news-wrap-kremlin-says-it-must-o-k-putin-trump-transcript-before-release,post_hanoi,russia,2025-12-12 17:32:42
dbl3rf,"Trump-Putin Phone Calls Can Only Be Disclosed With Russian Consent, Kremlin Says",,EdwardHeisler,politics,123,94,1569889811,/r/politics/comments/dbl3rf/trumpputin_phone_calls_can_only_be_disclosed_with/,https://www.themoscowtimes.com/2019/09/30/trump-putin-phone-calls-can-only-be-disclosed-with-russian-consent-kremlin-says-a67510,post_hanoi,russia,2025-12-12 17:32:42
dbkrpp,Russia says Trump can't release phone calls without Kremlin permission,,newsreporter111,politics,553,104,1569888293,/r/politics/comments/dbkrpp/russia_says_trump_cant_release_phone_calls/,https://www.nbcnews.com/politics/donald-trump/russia-says-trump-can-t-release-phone-calls-without-kremlin-n1060551,post_hanoi,russia,2025-12-12 17:32:42
dbi5ju,Kremlin says disclosure of Trump-Putin phone calls would need Russian consent,,Jeanneruk,politics,70,50,1569877003,/r/politics/comments/dbi5ju/kremlin_says_disclosure_of_trumpputin_phone_calls/,https://www.reuters.com/article/us-usa-trump-whistleblower-kremlin/kremlin-says-disclosure-of-trump-putin-phone-calls-would-need-russian-consent-idUSKBN1WF1ET,post_hanoi,russia,2025-12-12 17:32:42
dbdfdx,"Release of Trump-Putin transcripts needs Russian approval, Kremlin says. ‘If the American send us signals, then we’ll discuss it’ | Leaders have held at least 11 phone calls and met in person",,NontransferableDada,politics,520,84,1569858147,/r/politics/comments/dbdfdx/release_of_trumpputin_transcripts_needs_russian/,https://www.theguardian.com/world/2019/sep/30/trump-putin-conversations-transcripts-russian-permission,post_hanoi,russia,2025-12-12 17:32:42
dbcrhp,Kremlin says Russian consent needed to release Trump-Putin phone calls,,PissLikeaRacehorse,politics,352,106,1569855425,/r/politics/comments/dbcrhp/kremlin_says_russian_consent_needed_to_release/,https://thehill.com/policy/international/russia/463633-kremlin-says-russian-consent-needed-to-release-trump-putin-phone,post_hanoi,russia,2025-12-12 17:32:42
