id,title,selftext,author,subreddit,score,num_comments,created_utc,permalink,url,period,topic,collection_date
e5v0p0,Where Russia Will Expand Next ?,"I dont mean offending here, so just polite, objective pure analyse here. 

By Expand I mean : opening new abroad military bases.

It was interesting to see Russia opening several big bases in Syria. But besides Syria and Ukraine, from your opinion : What will be the possible next ones, based on current events ?

I think its priority can be in the Mideterranean, which can give a strategic advantage to Russia: its regionally close to it, and as it have bases in Syria, those combined can push to balance with the US in that region.

There are several options there: One will be Algeria, and the other may be Libya. However, both are complex situations : In Libya there are many competing factions, and Algeria seems not enthusiast about global rivarly, but this can change with the upcoming government. 



But those are only my thoughts. Where do you think the next step can be ?",Captin_Capcom,geopolitics,19,39,1575440360,/r/geopolitics/comments/e5v0p0/where_russia_will_expand_next/,https://www.reddit.com/r/geopolitics/comments/e5v0p0/where_russia_will_expand_next/,post_hanoi,russia,2025-12-12 17:32:42
e5o858,"A huge Siberian pipeline binds Russia and China, as gas flows for the first time",,DoktorOmni,geopolitics,510,114,1575409389,/r/geopolitics/comments/e5o858/a_huge_siberian_pipeline_binds_russia_and_china/,https://www.washingtonpost.com/world/asia-pacific/a-huge-siberian-gas-pipeline-binds-russia-and-china-as-gas-flows-for-the-first-time/2019/12/02/35250ff8-14f7-11ea-80d6-d0ca7007273f_story.html,post_hanoi,russia,2025-12-12 17:32:42
e4n8ta,Is there potential for cooperation between Canada and Russia in the arctic?,"Canada and Russia are, barring some other players like Denmark or the US, the countries with the most important claims in the Arctic. Both claim control of their respective ""northern passages"", which many countries want to internationalize.

Given the common interest of both countries in protecting their sovereignty over these passages, is future cooperation between the two possible or probable, setting aside other issues (human rights, ect.)?",Vahir,geopolitics,19,11,1575232461,/r/geopolitics/comments/e4n8ta/is_there_potential_for_cooperation_between_canada/,https://www.reddit.com/r/geopolitics/comments/e4n8ta/is_there_potential_for_cooperation_between_canada/,post_hanoi,russia,2025-12-12 17:32:42
e4gjp8,Russia and Belarus to create joint Parliament and Government,,MelodicBerries,geopolitics,747,185,1575201412,/r/geopolitics/comments/e4gjp8/russia_and_belarus_to_create_joint_parliament_and/,https://www.uawire.org/russia-and-belarus-to-create-joint-parliament-and-government,post_hanoi,russia,2025-12-12 17:32:42
e40atg,Is RUSSIA using INDIA? - KJ VIDS,[deleted],[deleted],geopolitics,5,3,1575136011,/r/geopolitics/comments/e40atg/is_russia_using_india_kj_vids/,https://www.youtube.com/watch?v=hY4NyNqSsKU,post_hanoi,russia,2025-12-12 17:32:42
e3dhpa,What is the (US) logics of not allowing a nation (Turkey) to buy weapons from other nation (Russia)?,,buzzlair,geopolitics,0,32,1575026152,/r/geopolitics/comments/e3dhpa/what_is_the_us_logics_of_not_allowing_a_nation/,https://www.reddit.com/r/geopolitics/comments/e3dhpa/what_is_the_us_logics_of_not_allowing_a_nation/,post_hanoi,russia,2025-12-12 17:32:42
e2usd6,Why China isn’t as skillful at disinformation as Russia,,Hamena95,geopolitics,136,62,1574927126,/r/geopolitics/comments/e2usd6/why_china_isnt_as_skillful_at_disinformation_as/,https://qz.com/1699144/why-chinas-social-media-propaganda-isnt-as-good-as-russias/,post_hanoi,russia,2025-12-12 17:32:42
e0y96f,The China-Russia challenge to the US-led West has hit a BRICS wall,,MelodicBerries,geopolitics,64,20,1574600538,/r/geopolitics/comments/e0y96f/the_chinarussia_challenge_to_the_usled_west_has/,https://www.scmp.com/week-asia/opinion/article/3038953/china-russia-challenge-us-led-west-has-hit-brics-wall,post_hanoi,russia,2025-12-12 17:32:42
e004y5,Russia bans smartphones without local software,,fuck_your_diploma,geopolitics,5,4,1574424654,/r/geopolitics/comments/e004y5/russia_bans_smartphones_without_local_software/,https://www.bbc.com/news/world-europe-50507849,post_hanoi,russia,2025-12-12 17:32:42
dzag7g,Big Bad Russia?,"All of the bureaucrats testifying in the impeachment hearings seem to agree that Russia is the enemy and that shoring up Ukraine is primarily important within that context.  Mr. Morrison went so far as to say that we help the Ukrainians fight Russia over there so that ""we don't have to fight them here.""

Is this just a holdover from Cold War days and NATO interests or is Russia somehow actually dangerous to the US?",AdamSnell,geopolitics,9,25,1574293476,/r/geopolitics/comments/dzag7g/big_bad_russia/,https://www.reddit.com/r/geopolitics/comments/dzag7g/big_bad_russia/,post_hanoi,russia,2025-12-12 17:32:42
dz0bq9,Five men freed in Russia-Lithuania-Norway spy swap,,grunge969,geopolitics,37,2,1574246121,/r/geopolitics/comments/dz0bq9/five_men_freed_in_russialithuanianorway_spy_swap/,http://archive.is/TFTd4,post_hanoi,russia,2025-12-12 17:32:42
dyzedr,Five men freed in Russia-Lithuania-Norway spy swap,[deleted],[deleted],geopolitics,1,2,1574240047,/r/geopolitics/comments/dyzedr/five_men_freed_in_russialithuanianorway_spy_swap/,http://archive.is/TFTd4,post_hanoi,russia,2025-12-12 17:32:42
dxwftc,Twenty-five times Trump was soft on Russia,,jo9008,geopolitics,1,6,1574042305,/r/geopolitics/comments/dxwftc/twentyfive_times_trump_was_soft_on_russia/,https://www.cnn.com/2019/11/17/politics/trump-soft-on-russia/index.html,post_hanoi,russia,2025-12-12 17:32:42
dxwf6u,Twenty-five time Trump was soft on Russia,[deleted],[deleted],geopolitics,1,1,1574042213,/r/geopolitics/comments/dxwf6u/twentyfive_time_trump_was_soft_on_russia/,https://www.cnn.com/2019/11/17/politics/trump-soft-on-russia/index.html,post_hanoi,russia,2025-12-12 17:32:42
dxmk67,Russia lands forces at former U.S. air base in Northern Syria,,grunge969,geopolitics,48,2,1573997460,/r/geopolitics/comments/dxmk67/russia_lands_forces_at_former_us_air_base_in/,http://archive.is/35d6S,post_hanoi,russia,2025-12-12 17:32:42
dxmilb,Russia lands forces at former U.S. air base in Northern Syria,[deleted],[deleted],geopolitics,1,1,1573997193,/r/geopolitics/comments/dxmilb/russia_lands_forces_at_former_us_air_base_in/,https://www.reuters.com/article/us-syria-security-russia/russia-lands-forces-at-former-u-s-air-base-in-northern-syria-idUSKBN1XP0XN,post_hanoi,russia,2025-12-12 17:32:42
dx7ynv,A case for a more pragmatic relationship between the US and Russia,[deleted],[deleted],geopolitics,2,1,1573916745,/r/geopolitics/comments/dx7ynv/a_case_for_a_more_pragmatic_relationship_between/,https://www.foreignaffairs.com/articles/russia-fsu/2019-10-15/let-russia-be-russia?utm_medium=newsletters&utm_source=twofa&utm_content=20191115&utm_campaign=TWOFA%20111519%20Let%20Russia%20Be%20Russia&utm_term=FA%20This%20Week%20-%20112017,post_hanoi,russia,2025-12-12 17:32:42
dx7pzf,U.S. Shale to Overtake Russia’s Entire Oil and Gas Production,,zz2113,geopolitics,14,10,1573915531,/r/geopolitics/comments/dx7pzf/us_shale_to_overtake_russias_entire_oil_and_gas/,https://www.themoscowtimes.com/2019/11/14/us-shale-overtake-russia-oil-gas-production-a68168,post_hanoi,russia,2025-12-12 17:32:42
dv9ejj,Belarus buddies up with China as an alternative to Russia,,MelodicBerries,geopolitics,0,8,1573562228,/r/geopolitics/comments/dv9ejj/belarus_buddies_up_with_china_as_an_alternative/,https://asia.nikkei.com/Spotlight/Asia-Insight/Belarus-buddies-up-with-China-as-an-alternative-to-Russia,post_hanoi,russia,2025-12-12 17:32:42
durl85,"How Russia Meddles Abroad for Profit: Cash, Trolls and a Cult Leader",,zsreport,geopolitics,12,4,1573474492,/r/geopolitics/comments/durl85/how_russia_meddles_abroad_for_profit_cash_trolls/,https://www.nytimes.com/2019/11/11/world/africa/russia-madagascar-election.html,post_hanoi,russia,2025-12-12 17:32:42
duq7ko,Russia to hand over fighter jet (Su-30MKI) and tank production (T-90MS ) technology to India,[deleted],[deleted],geopolitics,6,3,1573465510,/r/geopolitics/comments/duq7ko/russia_to_hand_over_fighter_jet_su30mki_and_tank/,https://uawire.org/russia-to-hand-over-fighter-jet-and-tank-production-technology-to-india,post_hanoi,russia,2025-12-12 17:32:42
dupekr,What are Russia's true ambitions for the coming decade?,[removed],gousey,geopolitics,7,4,1573460005,/r/geopolitics/comments/dupekr/what_are_russias_true_ambitions_for_the_coming/,https://www.reddit.com/r/geopolitics/comments/dupekr/what_are_russias_true_ambitions_for_the_coming/,post_hanoi,russia,2025-12-12 17:32:42
du5tbe,Why does Bashar al-Assad have no say in the Russia-Turkish Military Patrols in Syria?,He seems to be neither involved in talks about or against the patrols by foreign powers.,grunge969,geopolitics,10,14,1573353846,/r/geopolitics/comments/du5tbe/why_does_bashar_alassad_have_no_say_in_the/,https://www.reddit.com/r/geopolitics/comments/du5tbe/why_does_bashar_alassad_have_no_say_in_the/,post_hanoi,russia,2025-12-12 17:32:42
dtuh2l,Turkey and Russia Show That Land Grabs Can Pay Off: Erdogan and Putin are shredding the myth that countries no longer tear other countries apart.,,MelodicBerries,geopolitics,233,42,1573296386,/r/geopolitics/comments/dtuh2l/turkey_and_russia_show_that_land_grabs_can_pay/,https://www.themoscowtimes.com/2019/10/16/turkey-and-russia-show-that-land-grabs-can-pay-off-a67753,post_hanoi,russia,2025-12-12 17:32:42
dtmgpj,Russia Raided a Physics Institute. Kremlin Watchers Are Mystified: The armed operation targeting scientists in Moscow prompted outrage and questions about over-the-top actions by the country’s increasingly aggressive security forces,,sumrnewsmodsrnazis,geopolitics,1,0,1573249886,/r/geopolitics/comments/dtmgpj/russia_raided_a_physics_institute_kremlin/,https://www.nytimes.com/2019/11/07/world/europe/russia-raid-physics-institute.html?action=click&module=News&pgtype=Homepage,post_hanoi,russia,2025-12-12 17:32:42
dtm8fs,Russia’s Natural Population Declines for 4th Straight Year,,zz2113,geopolitics,631,130,1573248899,/r/geopolitics/comments/dtm8fs/russias_natural_population_declines_for_4th/,https://www.themoscowtimes.com/2019/11/07/russias-natural-population-declines-for-4th-straight-year-audit-chamber-a68066,post_hanoi,russia,2025-12-12 17:32:42
dt5r0e,"The New Space Race Is On, and Russia Is Winning",,greenbbanana,geopolitics,1,1,1573166609,/r/geopolitics/comments/dt5r0e/the_new_space_race_is_on_and_russia_is_winning/,https://nationalinterest.org/feature/new-space-race-and-russia-winning-93211,post_hanoi,russia,2025-12-12 17:32:42
dsyovz,"Question from an outsider: given how negative reactions are to Russian donations in politics (UK/US especially), how do we know Russia isn't just making donations to drive those reactions?",[removed],[deleted],geopolitics,3,2,1573137926,/r/geopolitics/comments/dsyovz/question_from_an_outsider_given_how_negative/,https://www.reddit.com/r/geopolitics/comments/dsyovz/question_from_an_outsider_given_how_negative/,post_hanoi,russia,2025-12-12 17:32:42
dsubnk,Georgian opposition: only Trump will save Georgia from the economic crisis and Russia,[removed],Irakly_D,geopolitics,0,1,1573111500,/r/geopolitics/comments/dsubnk/georgian_opposition_only_trump_will_save_georgia/,https://www.reddit.com/r/geopolitics/comments/dsubnk/georgian_opposition_only_trump_will_save_georgia/,post_hanoi,russia,2025-12-12 17:32:42
ds504k,What is the Union State of Russia and Belarus exactly?,[removed],dorash,geopolitics,39,8,1572985567,/r/geopolitics/comments/ds504k/what_is_the_union_state_of_russia_and_belarus/,https://www.reddit.com/r/geopolitics/comments/ds504k/what_is_the_union_state_of_russia_and_belarus/,post_hanoi,russia,2025-12-12 17:32:42
dq9zoy,"Turkey, Russia hold first joint patrol in northeast Syria",,ChonezLeCharlatan,geopolitics,41,14,1572640580,/r/geopolitics/comments/dq9zoy/turkey_russia_hold_first_joint_patrol_in/,https://www.reuters.com/article/us-syria-security-turkey-russia/turkey-russia-begin-joint-patrols-in-northeast-syria-idUSKBN1XB39T,post_hanoi,russia,2025-12-12 17:32:42
dpyo8t,"The Trump administration is withholding $105 million in military aid for Lebanon, two days after Prime Minister Hariri resigned. One official said the move could pave the way for Russia to move in",[deleted],[deleted],geopolitics,2,3,1572577875,/r/geopolitics/comments/dpyo8t/the_trump_administration_is_withholding_105/,https://www.reuters.com/article/us-usa-lebanon-defense-exclusive/exclusive-u-s-withholding-105-million-in-security-aid-for-lebanon-sources-idUSKBN1XA2QX,post_hanoi,russia,2025-12-12 17:32:42
dpjen8,What are China's and Russia's diplomatic relationship?,[removed],Tobiah497,geopolitics,6,3,1572501742,/r/geopolitics/comments/dpjen8/what_are_chinas_and_russias_diplomatic/,https://www.reddit.com/r/geopolitics/comments/dpjen8/what_are_chinas_and_russias_diplomatic/,post_hanoi,russia,2025-12-12 17:32:42
dpc64q,Where does Russia and China stand diplomatically?,[removed],[deleted],geopolitics,4,1,1572466638,/r/geopolitics/comments/dpc64q/where_does_russia_and_china_stand_diplomatically/,https://www.reddit.com/r/geopolitics/comments/dpc64q/where_does_russia_and_china_stand_diplomatically/,post_hanoi,russia,2025-12-12 17:32:42
dp7a6n,Russia Tests New Disinformation Tactics in Africa to Expand Influence,,zsreport,geopolitics,41,19,1572444759,/r/geopolitics/comments/dp7a6n/russia_tests_new_disinformation_tactics_in_africa/,https://www.nytimes.com/2019/10/30/technology/russia-facebook-disinformation-africa.html,post_hanoi,russia,2025-12-12 17:32:42
dp79ij,Denmark greenlights Russia's Nordstream 2 in it's territorial waters,,BL_Lime,geopolitics,11,4,1572444670,/r/geopolitics/comments/dp79ij/denmark_greenlights_russias_nordstream_2_in_its/,https://www.dr.dk/nyheder/politik/russisk-gasledning-faar-lov-gaa-gennem-dansk-kontinentalsokkel,post_hanoi,russia,2025-12-12 17:32:42
dotdr7,"(Hypothetical) If China, Russia, and the US all simultaneously disappeared, what countries do you think would become the next superpowers?",[removed],[deleted],geopolitics,1,1,1572371319,/r/geopolitics/comments/dotdr7/hypothetical_if_china_russia_and_the_us_all/,https://www.reddit.com/r/geopolitics/comments/dotdr7/hypothetical_if_china_russia_and_the_us_all/,post_hanoi,russia,2025-12-12 17:32:42
dojvjb,A possible China-U.S. Cold War situation but with Russia?,,ColonelVapeLord,geopolitics,0,3,1572317367,/r/geopolitics/comments/dojvjb/a_possible_chinaus_cold_war_situation_but_with/,https://www.reddit.com/r/neoliberal/comments/doj6q3/russianus_alliance/,post_hanoi,russia,2025-12-12 17:32:42
do940e,Britain and Russia are Europe’s odd couple,,Alwaysfair,geopolitics,190,77,1572270689,/r/geopolitics/comments/do940e/britain_and_russia_are_europes_odd_couple/,https://www.ft.com/content/2057070e-f961-11e9-98fd-4d6c20050229,post_hanoi,russia,2025-12-12 17:32:42
dntj5h,Serbia Signs Trade Deal With Russia’s Eurasian Union,,MandarijnMan,geopolitics,16,5,1572184433,/r/geopolitics/comments/dntj5h/serbia_signs_trade_deal_with_russias_eurasian/,https://balkaninsight.com/2019/10/25/serbia-signs-trade-deal-with-russias-eurasian-union/,post_hanoi,russia,2025-12-12 17:32:42
dnbx0c,"If Ukraine and Russia manage to negotiate a peace deal in Ukraine, would it untie Russia’s hands and cause increased threat in other Russian neighbouring regions?","At the moment one gets the impression that the conflict in Ukraine has Russia bogged down, militarily tied and isolated. If a peace deal is successful, it will only be a matter of time until Russia returns to various institutions it was kicked out from and most likely sanctions would be stopped. Does this have a potential to increase possible threat of Russian military intervention elsewhere in neighbouring regions? For example it is extremely unlikely that Russia would act militarily in some hypothetical scenario in Georgia, but after a peace deal with Ukraine Russias hands will be untied and in case of some tensions Russia could assert its interests militarily.

If I am wrong in this assessment, please feel free to disagree and show your opinion on this matter and about the potential results a peace deal with Ukraine would have in Russia’s geopolitics.",ObdurateSloth,geopolitics,232,80,1572084063,/r/geopolitics/comments/dnbx0c/if_ukraine_and_russia_manage_to_negotiate_a_peace/,https://www.reddit.com/r/geopolitics/comments/dnbx0c/if_ukraine_and_russia_manage_to_negotiate_a_peace/,post_hanoi,russia,2025-12-12 17:32:42
dmqe1f,These photos show African delegates enjoying the best of Russia’s unique hospitality,,rogerram1,geopolitics,2,2,1571967546,/r/geopolitics/comments/dmqe1f/these_photos_show_african_delegates_enjoying_the/,https://qz.com/africa/1735066/african-leaders-eye-russia-weapon-sales-at-putins-summit/,post_hanoi,russia,2025-12-12 17:32:42
dmq4ni,Russia is building up its influence in the international area.,[removed],greenbbanana,geopolitics,1,5,1571966171,/r/geopolitics/comments/dmq4ni/russia_is_building_up_its_influence_in_the/,https://www.reddit.com/r/geopolitics/comments/dmq4ni/russia_is_building_up_its_influence_in_the/,post_hanoi,russia,2025-12-12 17:32:42
dmnpdx,Russia Delivers The Mighty S-400 to Serbia!,[deleted],[deleted],geopolitics,1,0,1571954885,/r/geopolitics/comments/dmnpdx/russia_delivers_the_mighty_s400_to_serbia/,https://www.youtube.com/watch?v=U3Inhi21-eE&t=1s,post_hanoi,russia,2025-12-12 17:32:42
dlq96z,"Former CIA official says Russia benefits most from Trump foreign policy, Putin must wake up thinking he ""must be dreaming""",,rickspick,geopolitics,2,2,1571785782,/r/geopolitics/comments/dlq96z/former_cia_official_says_russia_benefits_most/,https://www.newsweek.com/cia-official-trump-foreign-policy-benefits-putin-1466853,post_hanoi,russia,2025-12-12 17:32:42
dlnznb,Map of Turkish-Russian agreement on Northern Syria: Turkey will maintain control over the territory it currently occupies before the US established ceasefire while Russia and the Assad government will control all the territory outside the zone of Turkish occupation along the Syrian-Turkish border.,,Wolf123458,geopolitics,637,88,1571776425,/r/geopolitics/comments/dlnznb/map_of_turkishrussian_agreement_on_northern_syria/,https://i.redd.it/fyvhtv2hk5u31.jpg,post_hanoi,russia,2025-12-12 17:32:42
dlmtsd,Map of Turkish-Russian agreement on Northern Syria: Turkey will maintain control over the territory it currently occupies before the US established ceasefire while Russia and the Assad government will control all the territory outside the zone of Turkish occupation along the Syrian-Turkish border.,[deleted],[deleted],geopolitics,0,2,1571771823,/r/geopolitics/comments/dlmtsd/map_of_turkishrussian_agreement_on_northern_syria/,https://i.redd.it/1vxnkurv65u31.jpg,post_hanoi,russia,2025-12-12 17:32:42
dlhgzt,"Russia Attempts To Take Over Venezuelan Oil, Creating A Challenge For The U.S.",,Pwndimonium,geopolitics,2,1,1571748599,/r/geopolitics/comments/dlhgzt/russia_attempts_to_take_over_venezuelan_oil/,https://www.forbes.com/sites/arielcohen/2019/10/22/russia-attempts-to-take-over-venezuelan-oil-creating-a-challenge-for-the-us/#19300fa538ef,post_hanoi,russia,2025-12-12 17:32:42
dlgeks,How would geopolitics change if Russia had the GDP per Capita (nominal) of either Italy or Germany?,[removed],[deleted],geopolitics,0,1,1571742783,/r/geopolitics/comments/dlgeks/how_would_geopolitics_change_if_russia_had_the/,https://www.reddit.com/r/geopolitics/comments/dlgeks/how_would_geopolitics_change_if_russia_had_the/,post_hanoi,russia,2025-12-12 17:32:42
dl0qv0,"Turkey is planning to have nuclear weapons. How will USA, Russia, and Israel react to this one?",[removed],maxmasanting,geopolitics,14,13,1571665408,/r/geopolitics/comments/dl0qv0/turkey_is_planning_to_have_nuclear_weapons_how/,https://www.reddit.com/r/geopolitics/comments/dl0qv0/turkey_is_planning_to_have_nuclear_weapons_how/,post_hanoi,russia,2025-12-12 17:32:42
djsfti,What is the conflict between Russia and Kosovo?, I have seen that UEFA (European football organization) has said that they cannot play between Kosovo and Russia because of their problems,Birrack,geopolitics,9,8,1571426634,/r/geopolitics/comments/djsfti/what_is_the_conflict_between_russia_and_kosovo/,https://www.reddit.com/r/geopolitics/comments/djsfti/what_is_the_conflict_between_russia_and_kosovo/,post_hanoi,russia,2025-12-12 17:32:42
dje1bk,"Four questions about the present and future relationships of the USA, China, Russia, and Japan (where I live).",[removed],[deleted],geopolitics,1,0,1571352094,/r/geopolitics/comments/dje1bk/four_questions_about_the_present_and_future/,https://www.reddit.com/r/geopolitics/comments/dje1bk/four_questions_about_the_present_and_future/,post_hanoi,russia,2025-12-12 17:32:42
dj88gz,"Russia, Venezuela: Caracas Considering Granting Rosneft Control Over PDVSA, Report Suggests",,WillyIsogen,geopolitics,21,14,1571327259,/r/geopolitics/comments/dj88gz/russia_venezuela_caracas_considering_granting/,https://worldview.stratfor.com/situation-report/russia-venezuela-caracas-considering-granting-rosneft-control-over-pdvsa-report,post_hanoi,russia,2025-12-12 17:32:42
dj5xxx,"Kurdish commander: Trump approved deal with Russia, Damascus",,happy221,geopolitics,31,17,1571316618,/r/geopolitics/comments/dj5xxx/kurdish_commander_trump_approved_deal_with_russia/,https://www.apnews.com/c27ec5d2fa3b4954a65bc359f497a22a,post_hanoi,russia,2025-12-12 17:32:42
dj4gr4,"It’s curtains for US in Syria. Russia, Iran owe big thanks to Erdogan",,goto1001,geopolitics,33,20,1571308225,/r/geopolitics/comments/dj4gr4/its_curtains_for_us_in_syria_russia_iran_owe_big/,https://indianpunchline.com/its-curtains-for-us-in-syria-russia-iran-owe-big-thanks-to-erdogan/,post_hanoi,russia,2025-12-12 17:32:42
dj2emx,What english-language sources should I be looking at if I'm interested in Russia-Saudi Arabian relations?,[deleted],[deleted],geopolitics,14,4,1571293865,/r/geopolitics/comments/dj2emx/what_englishlanguage_sources_should_i_be_looking/,https://www.reddit.com/r/geopolitics/comments/dj2emx/what_englishlanguage_sources_should_i_be_looking/,post_hanoi,russia,2025-12-12 17:32:42
dhxo2z,"Anyone who wants to assist Syria in protecting the Kurds is good with me, whether it is Russia, China, or Napoleon Bonaparte. I hope they all do great, we are 7,000 miles away!",,itloads,geopolitics,8,15,1571089533,/r/geopolitics/comments/dhxo2z/anyone_who_wants_to_assist_syria_in_protecting/,https://i.redd.it/6a9h2n95uks31.png,post_hanoi,russia,2025-12-12 17:32:42
dhvnny,"Exclusive: U.S. cedes Syrian city to Russia in battlefield ""handover""",,ShortTrifle0,geopolitics,555,205,1571081392,/r/geopolitics/comments/dhvnny/exclusive_us_cedes_syrian_city_to_russia_in/,https://www.newsweek.com/exclusive-washington-cede-syrian-city-russia-handover-turkey-tries-1465112,post_hanoi,russia,2025-12-12 17:32:42
dhv1h3,Trump has delivered what Russia wants in Syria — at zero cost — and 'Putin likely can't believe his luck',[deleted],[deleted],geopolitics,1,3,1571078876,/r/geopolitics/comments/dhv1h3/trump_has_delivered_what_russia_wants_in_syria_at/,https://www.businessinsider.com/trump-russia-free-hand-syria-putin-cant-believe-luck-2019-10,post_hanoi,russia,2025-12-12 17:32:42
dhug48,"Trump and Erdogan ""just got played"" by Putin says terrorism expert, as Kurds in Syria strike a deal with Russia and Bashar al-Assad",[deleted],[deleted],geopolitics,19,4,1571076373,/r/geopolitics/comments/dhug48/trump_and_erdogan_just_got_played_by_putin_says/,https://www.newsweek.com/donald-trump-erdogan-just-got-played-vladimir-putin-says-terrorism-expert-michael-smith-1465008,post_hanoi,russia,2025-12-12 17:32:42
dhtk2u,Explained | How will purchases from Russia affect India-U.S. ties?,,Razor2115,geopolitics,35,7,1571072758,/r/geopolitics/comments/dhtk2u/explained_how_will_purchases_from_russia_affect/,https://www.thehindu.com/news/national/how-will-purchases-from-russia-affect-india-us-ties/article29606117.ece,post_hanoi,russia,2025-12-12 17:32:42
dgoola,Russia's Africa summit is the latest step in its resurgence as a global power on the continent,,rogerram1,geopolitics,38,5,1570844861,/r/geopolitics/comments/dgoola/russias_africa_summit_is_the_latest_step_in_its/,https://qz.com/africa/1726464/russia-africa-summit-marks-growing-influence-with-presidents/,post_hanoi,russia,2025-12-12 17:32:42
dgfmwj,Interpol elects South Korean as its president in blow to Russia,,GeneralReposti_Bot,geopolitics,1,1,1570802645,/r/geopolitics/comments/dgfmwj/interpol_elects_south_korean_as_its_president_in/,https://www.theguardian.com/world/2018/nov/21/interpol-elects-south-korean-president-russia-kim-jong-yang,post_hanoi,russia,2025-12-12 17:32:42
dfjbnt,Russia opens first office in Saudi Arabia ahead of Putins visit,[removed],lowrexpectation,geopolitics,15,3,1570637810,/r/geopolitics/comments/dfjbnt/russia_opens_first_office_in_saudi_arabia_ahead/,https://www.reddit.com/r/geopolitics/comments/dfjbnt/russia_opens_first_office_in_saudi_arabia_ahead/,post_hanoi,russia,2025-12-12 17:32:42
de8h00,EU divisions over how to handle Russia as France with Germany attempt to end the conflict in east Ukraine.,,Jemapelledima,geopolitics,61,60,1570391987,/r/geopolitics/comments/de8h00/eu_divisions_over_how_to_handle_russia_as_france/,https://www.reuters.com/article/us-ukraine-russia-eu/eu-divisions-over-russia-mount-as-france-germany-seek-peace-in-ukraine-idUSKCN1WL04D?feedType=RSS&feedName=worldNews&utm_source=reddit.com,post_hanoi,russia,2025-12-12 17:32:42
