id,title,selftext,author,subreddit,score,num_comments,created_utc,permalink,url,period,topic,collection_date
ehtows,"Russian MFA tweets that USA built Hitler’s war machine, with a picture of USA flag next to swastika.",,Marqin,worldnews,1,0,1577746667,/r/worldnews/comments/ehtows/russian_mfa_tweets_that_usa_built_hitlers_war/,https://twitter.com/mfa_russia/status/1211718750459875330,post_hanoi,russia,2025-12-12 17:32:42
ehqaqn,"US, German, Israeli Envoys Weigh In on Russian WWII Claims",,undivided01,worldnews,3,6,1577732369,/r/worldnews/comments/ehqaqn/us_german_israeli_envoys_weigh_in_on_russian_wwii/,https://www.nytimes.com/aponline/2019/12/30/world/europe/ap-eu-poland-russia-us.html,post_hanoi,russia,2025-12-12 17:32:42
ehnulx,U.S. sanctions block hurry-up work on Russian gas pipeline: officials,,LogicCarpetBombing,worldnews,3,2,1577721848,/r/worldnews/comments/ehnulx/us_sanctions_block_hurryup_work_on_russian_gas/,https://www.reuters.com/article/us-usa-russia-nord-stream/us-sanctions-block-hurry-up-work-on-russian-gas-pipeline-officials-idUSKBN1YY0SS,post_hanoi,russia,2025-12-12 17:32:42
ehkq3k,Taiwan's citizens battle pro-China fake news campaigns as election nears - Citizen groups in Taiwan are fighting a Russian-style influence and misinformation campaign that is believed to originate across the strait in mainland China with just weeks to go before it votes for its next president,,ManiaforBeatles,worldnews,4441,196,1577703585,/r/worldnews/comments/ehkq3k/taiwans_citizens_battle_prochina_fake_news/,https://www.theguardian.com/world/2019/dec/30/taiwan-presidential-election-referendum-on-ties-with-china,post_hanoi,russia,2025-12-12 17:32:42
ehen3i,Ukraine holds big prisoner swap with pro-Russian separatists,,meenayzain032,worldnews,1,1,1577667731,/r/worldnews/comments/ehen3i/ukraine_holds_big_prisoner_swap_with_prorussian/,http://www.topnewstrends.tk/2019/12/ukraine-holds-big-prisoner-swap-with.html,post_hanoi,russia,2025-12-12 17:32:42
ehedj3,"U.N. Security Council members are due to meet informally on Monday for a second round of negotiations on a Russian and Chinese proposal to lift a raft of sanctions on North Korea, a move that some diplomats say has little support",,DoremusJessup,worldnews,20,1,1577666470,/r/worldnews/comments/ehedj3/un_security_council_members_are_due_to_meet/,https://www.reuters.com/article/us-northkorea-usa-un/russia-china-to-hold-more-u-n-talks-on-lifting-north-korea-sanctions-diplomats-idUSKBN1YX0LD?il=0,post_hanoi,russia,2025-12-12 17:32:42
ehe7e8,Ukrainian government forces and pro-Russian separatists in the east completed a large-scale prisoner swap on Sunday after bussing scores of detainees in the five-year conflict to an exchange point in the breakaway Donbass region.,,madam1,worldnews,14,0,1577665709,/r/worldnews/comments/ehe7e8/ukrainian_government_forces_and_prorussian/,https://www.reuters.com/article/us-ukraine-crisis-prisoners-swap/ukraine-holds-big-prisoner-swap-with-pro-russian-separatists-idUSKBN1YX04N?feedType=RSS&feedName=topNews,post_hanoi,russia,2025-12-12 17:32:42
ehb4wu,"Over 230,000 people flee Idlib in two-week Russian-backed offensive: U.N.",,hellen2019,worldnews,1,0,1577651882,/r/worldnews/comments/ehb4wu/over_230000_people_flee_idlib_in_twoweek/,https://londondailyreport.com/230000-people-flee-idlib-two-week/,post_hanoi,russia,2025-12-12 17:32:42
eha41t,Is Vladimir Putin creating a new reality on the ground in Crimea? The Russian president has opened a direct train link between Russia and the peninsula annexed by Moscow in 2014.,,easyone,worldnews,1,0,1577647282,/r/worldnews/comments/eha41t/is_vladimir_putin_creating_a_new_reality_on_the/,https://www.aljazeera.com/programmes/insidestory/2019/12/vladimir-putin-creating-reality-ground-crimea-191223202610520.html,post_hanoi,russia,2025-12-12 17:32:42
eh9z9n,"Ukraine, pro-Russia separatists complete prisoner swap. Ukraine and pro-Russian separatists finish controversial exchange of 200 prisoners.",,easyone,worldnews,9,7,1577646659,/r/worldnews/comments/eh9z9n/ukraine_prorussia_separatists_complete_prisoner/,https://www.aljazeera.com/news/2019/12/ukraine-pro-russian-separatists-prisoner-swap-191229090541736.html,post_hanoi,russia,2025-12-12 17:32:42
eh8yaw,Putin thanked Donald Trump for providing information that helped russian security services prevent terrorist attack in Saint-Petersburg,[deleted],[deleted],worldnews,2,5,1577642048,/r/worldnews/comments/eh8yaw/putin_thanked_donald_trump_for_providing/,http://kremlin.ru/events/president/news/62518,post_hanoi,russia,2025-12-12 17:32:42
eh7w13,"Russian President Vladimir Putin, in a phone call on Sunday, thanked his U.S. counterpart Donald Trump for passing on an information which helped prevent “acts of terrorism” in Russia, the Kremlin said.",,juanffiff,worldnews,2089,303,1577637121,/r/worldnews/comments/eh7w13/russian_president_vladimir_putin_in_a_phone_call/,https://www.reuters.com/article/us-russia-usa-security/putin-thanks-trump-for-tip-to-thwart-terrorist-acts-in-russia-idUSKBN1YX0EX,post_hanoi,russia,2025-12-12 17:32:42
eh6udb,Ukrainian government forces and pro-Russian separatists in eastern Ukraine completed a full prisoner swap on Sunday after bussing remaining detainees in the five-year conflict to an exchange point in the breakaway Donbass region.,,juanffiff,worldnews,8,0,1577631785,/r/worldnews/comments/eh6udb/ukrainian_government_forces_and_prorussian/,https://www.reuters.com/article/us-ukraine-crisis-prisoners-swap/ukraine-completes-all-for-all-prisoner-swap-with-pro-russian-separatists-idUSKBN1YX04N,post_hanoi,russia,2025-12-12 17:32:42
eh60w2,"Putin's promises, 20 years on: A fact check | Vladimir Putin assumed the Russian presidency in an interim capacity in 2000. He made a lot of promises. Two decades later, the spy-turned-strongman is still at the helm of Kremlin politics.",,viva_la_vinyl,worldnews,14,2,1577626874,/r/worldnews/comments/eh60w2/putins_promises_20_years_on_a_fact_check_vladimir/,https://www.dw.com/en/putins-promises-20-years-on-a-fact-check/a-51790097,post_hanoi,russia,2025-12-12 17:32:42
eh53j9,Ukraine starts all-for-all prisoner swap with pro-Russian separatists,,Slats7,worldnews,23,2,1577620030,/r/worldnews/comments/eh53j9/ukraine_starts_allforall_prisoner_swap_with/,https://www.reuters.com/article/us-ukraine-crisis-prisoners-swap/ukraine-starts-all-for-all-prisoner-swap-with-pro-russian-separatists-idUSKBN1YX04N,post_hanoi,russia,2025-12-12 17:32:42
eh1668,"Over 230,000 people flee Idlib in two-week Russian-backed offensive: U.N.",,FinskiGerman,worldnews,24,1,1577591925,/r/worldnews/comments/eh1668/over_230000_people_flee_idlib_in_twoweek/,https://www.reuters.com/article/us-syria-security-idlib/over-230000-people-flee-idlib-in-two-week-russian-backed-offensive-un-idUSKBN1YV19M,post_hanoi,russia,2025-12-12 17:32:42
egwpt7,"More than 235,000 flee intense bombing in NW Syria — 2 weeks of regime and Russian bombardment has displaced 235,000 people who fled the area between December 12 and 25. OCHA spokesman David Swanson said more than 80 per cent of those who have fled southern Idlib this month are women and children.",,Molire,worldnews,74,2,1577569328,/r/worldnews/comments/egwpt7/more_than_235000_flee_intense_bombing_in_nw_syria/,https://www.afp.com/en/news/3954/more-235000-flee-intense-bombing-nw-syria-doc-1nc0bl8,post_hanoi,russia,2025-12-12 17:32:42
egtmn9,Ukraine and pro-Russians expected to swap prisoners. Ukraine president says exchange should take place on Sunday but details of the planned swap are scarce.,,easyone,worldnews,1,1,1577555005,/r/worldnews/comments/egtmn9/ukraine_and_prorussians_expected_to_swap/,https://www.aljazeera.com/news/2019/12/ukraine-pro-russians-expected-swap-prisoners-191228154200501.html,post_hanoi,russia,2025-12-12 17:32:42
egrn6k,Russian investigative journalists claim an explosion last year in the Urals town of Magnitogorsk that killed 39 people was a terrorist attack.,,green_flash,worldnews,35,2,1577545108,/r/worldnews/comments/egrn6k/russian_investigative_journalists_claim_an/,https://www.rferl.org/a/baza-maganitogorsk-russia-explosion-terror-gas-leak/30348625.html,post_hanoi,russia,2025-12-12 17:32:42
egrix8,Jailed American Paul Whelan marks one year in Russian detention,,justsomestubble,worldnews,32,0,1577544432,/r/worldnews/comments/egrix8/jailed_american_paul_whelan_marks_one_year_in/,https://www.cnn.com/2019/12/28/europe/paul-whelan-russia-detained-intl/index.html,post_hanoi,russia,2025-12-12 17:32:42
egr8g9,Russian’s $1 million to Parnas: Another stubborn fact for Trump surrogates to wave off,,nanoubik,worldnews,30,2,1577542790,/r/worldnews/comments/egr8g9/russians_1_million_to_parnas_another_stubborn/,https://tonyortega.org/2019/12/17/russians-1-million-to-parnas-another-stubborn-fact-for-trump-surrogates-to-wave-off/,post_hanoi,russia,2025-12-12 17:32:42
egqpxr,"Over 230,000 people flee Idlib in two-week Russian-backed offensive: U.N.",,janhra,worldnews,1,0,1577539551,/r/worldnews/comments/egqpxr/over_230000_people_flee_idlib_in_twoweek/,https://washingtondailyreport.com/over-230000-people-flee-idlib-in-two-week/,post_hanoi,russia,2025-12-12 17:32:42
egqd5o,"Ex-KGB instructor runs pseudoscientific, conspiracy theory courses in Russian university",,kroggy,worldnews,1,0,1577537133,/r/worldnews/comments/egqd5o/exkgb_instructor_runs_pseudoscientific_conspiracy/,https://meduza.io/en/feature/2019/12/27/conspiracy-u,post_hanoi,russia,2025-12-12 17:32:42
egnvo5,"UN approves Russian-sponsored, China-backed bid on new cybercrime convention. The US, European powers and rights groups fear that the resolution would legitimise crackdowns on expression",,mczack13,worldnews,204,16,1577518001,/r/worldnews/comments/egnvo5/un_approves_russiansponsored_chinabacked_bid_on/,https://www.scmp.com/news/world/united-states-canada/article/3043763/un-approves-russian-sponsored-china-backed-bid-new,post_hanoi,russia,2025-12-12 17:32:42
egnqk8,"More than 235,000 people fled their homes in northwest Syria in the past two weeks after Assad regime and Russian attacks, UN says.",,F_D_P,worldnews,23,3,1577517019,/r/worldnews/comments/egnqk8/more_than_235000_people_fled_their_homes_in/,https://amp.cnn.com/cnn/2019/12/27/middleeast/syria-displaced-idlib-unocha-intl/index.html,post_hanoi,russia,2025-12-12 17:32:42
egm3dn,UN General Assembly adopts Russian resolution on fighting cybercrime,,its_as,worldnews,1,0,1577506946,/r/worldnews/comments/egm3dn/un_general_assembly_adopts_russian_resolution_on/,https://thenews0fpakistan.blogspot.com/2019/12/un-general-assembly-adopts-russian.html,post_hanoi,russia,2025-12-12 17:32:42
eglq4m,Russian taillight,,new2000news,worldnews,1,0,1577504945,/r/worldnews/comments/eglq4m/russian_taillight/,http://newslikenews.blogspot.com/2019/12/russian-taillight.html,post_hanoi,russia,2025-12-12 17:32:42
egld42,Trump warns Syria and its Russian and Iranian allies against 'carnage' in Idlib,,dcismia,worldnews,0,7,1577502975,/r/worldnews/comments/egld42/trump_warns_syria_and_its_russian_and_iranian/,https://www.cnn.com/2019/12/26/politics/trump-syria-idlib-russia/index.html,post_hanoi,russia,2025-12-12 17:32:42
egkwa3,"Russia Deploys Hypersonic Weapon, Potentially Renewing Arms Race. The new Russian weapon system flies at superfast speeds and can evade traditional missile defense systems. The United States is trying to catch up.",,mobile_website_25323,worldnews,1,2,1577500485,/r/worldnews/comments/egkwa3/russia_deploys_hypersonic_weapon_potentially/,https://www.nytimes.com/2019/12/27/us/politics/russia-hypersonic-weapon.html,post_hanoi,russia,2025-12-12 17:32:42
egkipt,"The United Nations on Friday approved a Russian-led bid that aims to create a new convention on cybercrime, alarming rights groups and Western powers that fear a bid to restrict online freedom",,DoremusJessup,worldnews,65,14,1577498495,/r/worldnews/comments/egkipt/the_united_nations_on_friday_approved_a/,https://www.france24.com/en/20191228-un-backs-russia-on-internet-convention-alarming-rights-advocates,post_hanoi,russia,2025-12-12 17:32:42
egiw5d,"More than 235,000 people have fled the Idlib region over the past two weeks, the UN has said, amid air raids by Russian and Syrian government forces",,green_flash,worldnews,5,1,1577490126,/r/worldnews/comments/egiw5d/more_than_235000_people_have_fled_the_idlib/,https://www.aljazeera.com/news/2019/12/235000-flee-northwest-syria-violence-191227140701873.html,post_hanoi,russia,2025-12-12 17:32:42
eghz0v,Timeline: Vladimir Putin - 20 tumultuous years as Russian president or PM,,meltdownshomo,worldnews,7,2,1577485703,/r/worldnews/comments/eghz0v/timeline_vladimir_putin_20_tumultuous_years_as/,https://www.reuters.com/article/us-russia-putin/timeline-vladimir-putin-20-tumultuous-years-as-russian-president-or-pm-idUSKBN1YV0TB,post_hanoi,russia,2025-12-12 17:32:42
eghh14,Russian ambassador to Poland summoned for Putin WWII remarks,,WWENow,worldnews,1,0,1577483375,/r/worldnews/comments/eghh14/russian_ambassador_to_poland_summoned_for_putin/,https://apnews.com/583d6c047fd7f1c7aeed4f6df2cf9ffc,post_hanoi,russia,2025-12-12 17:32:42
eggl97,"Ukraine asks Germany for military aid against Russian aggression as deaths mount. ""the survival of the nation is at stake""",,TheyCallMeSeven,worldnews,17,0,1577479353,/r/worldnews/comments/eggl97/ukraine_asks_germany_for_military_aid_against/,https://www.spiegel.de/politik/ausland/ukraine-kiew-fordert-deutsche-militaerhilfe-im-konflikt-mit-russland-a-1302912.html,post_hanoi,russia,2025-12-12 17:32:42
eggggo,"Ukraine asks Germany for military aid against Russian aggression as deaths mount. ""the survival of the nation is at stake""",[deleted],[deleted],worldnews,1,0,1577478753,/r/worldnews/comments/eggggo/ukraine_asks_germany_for_military_aid_against/,https://www.google.com/url?sa=t&source=web&rct=j&url=https://www.spiegel.de/politik/ausland/ukraine-kiew-fordert-deutsche-militaerhilfe-im-konflikt-mit-russland-a-1302912-amp.html&ved=2ahUKEwjRvpGb1dbmAhXGGewKHaOhAG0QFjAAegQIBxAB&usg=AOvVaw3oUwVKAGHB9pR78pasiatI&ampcf=1,post_hanoi,russia,2025-12-12 17:32:42
egdui7,"Over 230,000 people flee Idlib in two-week Russian-backed offensive: U.N.",,pantangeli,worldnews,7,0,1577467044,/r/worldnews/comments/egdui7/over_230000_people_flee_idlib_in_twoweek/,https://www.reuters.com/article/us-syria-security-idlib/over-230000-people-flee-idlib-in-two-week-russian-backed-offensive-u-n-idUSKBN1YV19M,post_hanoi,russia,2025-12-12 17:32:42
egdbef,New Russian weapon can travel 27 times the speed of sound,,Smithman,worldnews,2,10,1577464647,/r/worldnews/comments/egdbef/new_russian_weapon_can_travel_27_times_the_speed/,https://www.thejournal.ie/russia-weapon-4948242-Dec2019/,post_hanoi,russia,2025-12-12 17:32:42
egcbrq,New Russian weapon can travel 27 times the speed of sound,,FenrirIII,worldnews,14,16,1577459810,/r/worldnews/comments/egcbrq/new_russian_weapon_can_travel_27_times_the_speed/,https://abcnews.go.com/International/wireStory/russia-commissions-intercontinental-hypersonic-weapon-67942398,post_hanoi,russia,2025-12-12 17:32:42
egaqv4,Ruslan Shaveddinov: Russian opposition activist 'kidnapped' by army,,Merv1192,worldnews,433,24,1577450625,/r/worldnews/comments/egaqv4/ruslan_shaveddinov_russian_opposition_activist/,https://www.bbc.co.uk/news/world-europe-50912822,post_hanoi,russia,2025-12-12 17:32:42
eg9x73,"US, Russian troops brawl in northeast Syria",,Admiral_Asado,worldnews,50,47,1577444812,/r/worldnews/comments/eg9x73/us_russian_troops_brawl_in_northeast_syria/,https://www.jpost.com/Middle-East/US-Russian-troops-brawl-in-northeast-Syria-report-612168,post_hanoi,russia,2025-12-12 17:32:42
eg9ddu,Russian Opposition Leader Alexei Navalny Targeted In Police Raid,,zsreport,worldnews,94,7,1577440888,/r/worldnews/comments/eg9ddu/russian_opposition_leader_alexei_navalny_targeted/,https://www.npr.org/2019/12/26/791572449/russian-opposition-leader-alexei-navalny-targeted-in-police-raid,post_hanoi,russia,2025-12-12 17:32:42
eg96t0,Russian opposition leader says staffer 'kidnapped' and sent to Arctic base under guise of military conscription,,IvyGold,worldnews,17,7,1577439546,/r/worldnews/comments/eg96t0/russian_opposition_leader_says_staffer_kidnapped/,https://www.cnn.com/2019/12/26/europe/russia-navalny-intl/index.html,post_hanoi,russia,2025-12-12 17:32:42
eg5hcp,Russian opposition leader says staffer 'kidnapped' and sent to Arctic base,,galvanize01adv,worldnews,10,0,1577416474,/r/worldnews/comments/eg5hcp/russian_opposition_leader_says_staffer_kidnapped/,https://edition.cnn.com/2019/12/26/europe/russia-navalny-intl/index.html,post_hanoi,russia,2025-12-12 17:32:42
eg2qk3,Russian Artist Faces Six Years in Prison For Sharing Art Featuring Pro-LGBTQ Messages on Social Media,,Seek_Adventure,worldnews,17988,1213,1577402614,/r/worldnews/comments/eg2qk3/russian_artist_faces_six_years_in_prison_for/,https://www.advocate.com/world/2019/12/26/russian-activist-persecuted-sharing-art-lgbtq-message,post_hanoi,russia,2025-12-12 17:32:42
eg1jlw,Wapo opinion: Rachel Maddow Cheerleaded for Russian Trump Dossier. Then It Fell Apart,[deleted],[deleted],worldnews,1,0,1577397016,/r/worldnews/comments/eg1jlw/wapo_opinion_rachel_maddow_cheerleaded_for/,https://www.washingtonpost.com/opinions/2019/12/26/rachel-maddow-rooted-steele-dossier-be-true-then-it-fell-apart/,post_hanoi,russia,2025-12-12 17:32:42
efzyad,"Germany, EU hit out at US over sanctions on Russian gas pipeline",,[deleted],worldnews,19,13,1577389596,/r/worldnews/comments/efzyad/germany_eu_hit_out_at_us_over_sanctions_on/,https://uk.news.yahoo.com/germany-eu-hit-us-over-us-sanctions-russian-121011557.html,post_hanoi,russia,2025-12-12 17:32:42
efyfov,"Germany, EU hit out at US over sanctions on Russian gas pipeline - Germany on Saturday accused the United States of interfering in its internal affairs",,tristan_isolde,worldnews,23,0,1577382516,/r/worldnews/comments/efyfov/germany_eu_hit_out_at_us_over_sanctions_on/,https://www.bangkokpost.com/world/1821294/germany-eu-hit-out-at-us-over-sanctions-on-russian-gas-pipeline,post_hanoi,russia,2025-12-12 17:32:42
efy8gl,A Bunch of Russian YouTubers Made a Cybertruck Knock-Off That is Bound to Make You Laugh,,YZXFILE,worldnews,1,12,1577381574,/r/worldnews/comments/efy8gl/a_bunch_of_russian_youtubers_made_a_cybertruck/,https://interestingengineering.com/a-bunch-of-russian-youtubers-made-a-cybertruck-knock-off-that-is-bound-to-make-you-laugh,post_hanoi,russia,2025-12-12 17:32:42
efwrj8,Russian Youth Climate Activist Arshak Makichyan Freed from Jail,,Pinkblackbox,worldnews,130,2,1577374527,/r/worldnews/comments/efwrj8/russian_youth_climate_activist_arshak_makichyan/,https://www.democracynow.org/2019/12/26/headlines/russian_youth_climate_activist_arshak_makichyan_freed_from_jail,post_hanoi,russia,2025-12-12 17:32:42
efwmg2,U.S. Military Cyber Operation Could ‘Target Senior Leadership and Russian Elites’ if Russia Interferes in 2020 Election,[deleted],[deleted],worldnews,0,1,1577373786,/r/worldnews/comments/efwmg2/us_military_cyber_operation_could_target_senior/,https://lawandcrime.com/high-profile/u-s-military-cyber-operation-could-target-senior-leadership-and-russian-elites-if-russia-interferes-in-2020-election/,post_hanoi,russia,2025-12-12 17:32:42
efwgl0,Vladimir Putin leads his ice hockey team to an 8-5 victory on Christmas Day with the Russian president 'scoring over half of the team's points',,pantangeli,worldnews,30,39,1577372930,/r/worldnews/comments/efwgl0/vladimir_putin_leads_his_ice_hockey_team_to_an_85/,https://www.dailymail.co.uk/news/article-7827737/Vladimir-Putin-leads-ice-hockey-team-8-5-victory-Christmas-Day.html,post_hanoi,russia,2025-12-12 17:32:42
efw1g8,Russian authorities raid Kremlin critic Alexei Navalny's Moscow office,,Fitness_and_Finance,worldnews,26,2,1577370648,/r/worldnews/comments/efw1g8/russian_authorities_raid_kremlin_critic_alexei/,https://www.reuters.com/article/us-russia-politics-navalny/russian-authorities-raid-kremlin-critic-alexei-navalnys-moscow-office-idUSKBN1YU0I6?il=0,post_hanoi,russia,2025-12-12 17:32:42
efw0ai,Russian authorities raid opposition leader Navalny's offices,,thisdodobird,worldnews,16,3,1577370470,/r/worldnews/comments/efw0ai/russian_authorities_raid_opposition_leader/,https://apnews.com/5fafe4cfd90126c249b786ab9354f967,post_hanoi,russia,2025-12-12 17:32:42
efvf90,Moscow police raid Russian opposition leader Navalny's office,,IrrationalExpression,worldnews,47,3,1577366907,/r/worldnews/comments/efvf90/moscow_police_raid_russian_opposition_leader/,https://www.aljazeera.com/news/2019/12/moscow-police-raid-russian-opposition-leader-navalny-office-191226105657041.html,post_hanoi,russia,2025-12-12 17:32:42
efvf8v,Russian opposition leader says staffer 'kidnapped' and sent to Arctic base,,[deleted],worldnews,185,8,1577366905,/r/worldnews/comments/efvf8v/russian_opposition_leader_says_staffer_kidnapped/,https://edition.cnn.com/2019/12/26/europe/russia-navalny-intl/index.html,post_hanoi,russia,2025-12-12 17:32:42
efvb2m,Russian authorities raid Kremlin critic Alexei Navalny's Moscow office,,Slats7,worldnews,2412,124,1577366131,/r/worldnews/comments/efvb2m/russian_authorities_raid_kremlin_critic_alexei/,https://www.reuters.com/article/us-russia-politics-navalny/russian-authorities-raid-kremlin-critic-alexei-navalnys-moscow-office-idUSKBN1YU0I6,post_hanoi,russia,2025-12-12 17:32:42
efucla,Moscow to take retaliatory action against British media: Russian news agencies,,noflagman,worldnews,47,4,1577359260,/r/worldnews/comments/efucla/moscow_to_take_retaliatory_action_against_british/,https://www.reuters.com/article/us-britain-russia-media/moscow-to-take-retaliatory-action-against-british-media-russian-news-agencies-idUSKBN1YU0HE,post_hanoi,russia,2025-12-12 17:32:42
eftnaz,Moscow to take retaliatory action against British media: Russian news agencies,,myrisingstocks,worldnews,12,2,1577353862,/r/worldnews/comments/eftnaz/moscow_to_take_retaliatory_action_against_british/,https://www.reuters.com/article/us-britain-russia-media/moscow-to-take-retaliatory-action-against-british-media-russian-news-agencies-idUSKBN1YU0HE?feedType=RSS,post_hanoi,russia,2025-12-12 17:32:42
efqe2q,Military cyber officials are developing information warfare tactics that could be deployed against senior Russian officials and oligarchs if Moscow tries to interfere in the 2020 U.S. elections through hacking election systems or sowing widespread discord,,DoremusJessup,worldnews,210,46,1577332347,/r/worldnews/comments/efqe2q/military_cyber_officials_are_developing/,https://www.washingtonpost.com/national-security/us-cybercom-contemplates-information-warfare-to-counter-russian-interference-in-the-2020-election/2019/12/25/21bb246e-20e8-11ea-bed5-880264cc91a9_story.html?utm_source=reddit.com,post_hanoi,russia,2025-12-12 17:32:42
efopu0,Ruslan Shaveddinov: Russian opposition activist 'kidnapped' by army,,mobile_website_25323,worldnews,81,0,1577323044,/r/worldnews/comments/efopu0/ruslan_shaveddinov_russian_opposition_activist/,https://www.bbc.com/news/world-europe-50912822,post_hanoi,russia,2025-12-12 17:32:42
efn31a,U.S. CyberCom contemplates information warfare to counter Russian interference in 2020 election,,stupidstupidreddit2,worldnews,59,15,1577314445,/r/worldnews/comments/efn31a/us_cybercom_contemplates_information_warfare_to/,https://www.washingtonpost.com/national-security/us-cybercom-contemplates-information-warfare-to-counter-russian-interference-in-the-2020-election/2019/12/25/21bb246e-20e8-11ea-bed5-880264cc91a9_story.html,post_hanoi,russia,2025-12-12 17:32:42
efjeyd,Russian government plans to use rainy day fund to buy Sberbank from central bank: two sources,,easyone,worldnews,12,1,1577296239,/r/worldnews/comments/efjeyd/russian_government_plans_to_use_rainy_day_fund_to/,https://www.reuters.com/article/us-russia-banks-sberbank-stake/russian-government-plans-to-use-rainy-day-fund-to-buy-sberbank-from-central-bank-two-sources-idUSKBN1YT0M0,post_hanoi,russia,2025-12-12 17:32:42
efiquv,Ruslan Shaveddinov: Russian opposition activist 'kidnapped' by army,,Slats7,worldnews,42,3,1577293016,/r/worldnews/comments/efiquv/ruslan_shaveddinov_russian_opposition_activist/,https://www.bbc.com/news/world-europe-50912822,post_hanoi,russia,2025-12-12 17:32:42
efgnpm,Top Russian diplomat says timing of Trump meeting was a 'coincidence',[deleted],[deleted],worldnews,441,68,1577281678,/r/worldnews/comments/efgnpm/top_russian_diplomat_says_timing_of_trump_meeting/,https://edition.cnn.com/2019/12/25/europe/lavrov-trump-interview-intl/index.html,post_hanoi,russia,2025-12-12 17:32:42
efetpx,"Russian attacks devour 979 humanitarian aid workers, SNHR report says",,juanffiff,worldnews,18,6,1577268064,/r/worldnews/comments/efetpx/russian_attacks_devour_979_humanitarian_aid/,https://mcnpress.com/2019/12/25/russian-attacks-devour-979-humanitarian-aid-workers-snhr-report-says/,post_hanoi,russia,2025-12-12 17:32:42
ef71en,Russian anti-corruption campaigner kidnapped by police - reappears on Arctic island as a draftee,,freud_orbison,worldnews,0,0,1577221259,/r/worldnews/comments/ef71en/russian_anticorruption_campaigner_kidnapped_by/,https://meduza.io/en/feature/2019/12/24/russian-anti-corruption-campaigner-disappears-following-police-searches-reappears-as-army-draftee-on-arctic-island,post_hanoi,russia,2025-12-12 17:32:42
ef3qlr,"New Russian fighter jet Su-57 crashes during test, pilot escapes safely",,peternelleoods,worldnews,29,8,1577205924,/r/worldnews/comments/ef3qlr/new_russian_fighter_jet_su57_crashes_during_test/,https://thewestnews.com/new-russian-fighter-jet-su-57-crashes-during-the-test-pilot-escapes-safely/892,post_hanoi,russia,2025-12-12 17:32:42
