id,title,selftext,author,subreddit,score,num_comments,created_utc,permalink,url,period,topic,collection_date
coz1xh,Tesla electric car catches fire after hitting tow truck in Moscow,[deleted],[deleted],news,6,26,1565542024,/r/news/comments/coz1xh/tesla_electric_car_catches_fire_after_hitting_tow/,https://reut.rs/2YZN8fU,post_hanoi,russia,2025-12-12 17:32:42
coxlcn,"Ukraine has protested to Russia after a leather-clad President Vladimir Putin visited the annexed Crimean peninsula to attend a bikers' festival. Ukraine said attempts by Moscow and its media to present such visits as routine were ""pathetic"".",,babyyourearichman111,news,1,0,1565534918,/r/news/comments/coxlcn/ukraine_has_protested_to_russia_after_a/,https://ichef.bbci.co.uk/images/ic/1024x576/p07kc1dr.jpg,post_hanoi,russia,2025-12-12 17:32:42
cowr1g,Tesla Electric Car Catches Fire After Hitting Tow Truck In Moscow,,NewsBOTNetwork,news,1,0,1565530265,/r/news/comments/cowr1g/tesla_electric_car_catches_fire_after_hitting_tow/,https://newsbotnetwork.com/news/tesla-electric-car-catches-fire-after-hitting-tow-truck-in-moscow/,post_hanoi,russia,2025-12-12 17:32:42
cowacg,Tesla Electric Car Catches Fire After Hitting A Tow Truck In Moscow,,NewsBOTNetwork,news,1,0,1565527356,/r/news/comments/cowacg/tesla_electric_car_catches_fire_after_hitting_a/,https://newsbotnetwork.com/news/tesla-electric-car-catches-fire-after-hitting-a-tow-truck-in-moscow/,post_hanoi,russia,2025-12-12 17:32:42
courw3,Tens of thousands rally in Moscow in growing election protest,,TheNewsDB,news,1,0,1565515702,/r/news/comments/courw3/tens_of_thousands_rally_in_moscow_in_growing/,https://thenewsdb.com/tens-of-thousands-rally-in-moscow-in-growing-election-protest/,post_hanoi,russia,2025-12-12 17:32:42
coq96v,Moscow protests pressuring Vladimir Putin find female standard-bearer,,121kiwi,news,1,0,1565484850,/r/news/comments/coq96v/moscow_protests_pressuring_vladimir_putin_find/,https://121private.home.blog/2019/08/11/moscow-protests-pressuring-vladimir-putin-find-female-standard-bearer-2/,post_hanoi,russia,2025-12-12 17:32:42
conf88,"50,000 demonstrate in Moscow in third weekend of protests for fair elections",,babyyourearichman111,news,1,0,1565470030,/r/news/comments/conf88/50000_demonstrate_in_moscow_in_third_weekend_of/,https://ca-times.brightspotcdn.com/dims4/default/c0e1949/2147483647/strip/true/crop/5026x2639+0+362/resize/1200x630!/quality/90/?url=https%3A%2F%2Fca-times.brightspotcdn.com%2Fe7%2F87%2F7dea32d34a24a0bf3616fdaefd14%2Frussia-protest-63018.jpg,post_hanoi,russia,2025-12-12 17:32:42
con8ox,"Moscow election protest attracts huge crowd, spurs spinoffs",,Bakedschwarzenbach,news,1,0,1565469162,/r/news/comments/con8ox/moscow_election_protest_attracts_huge_crowd_spurs/,https://www.washingtontimes.com/news/2019/aug/10/1000s-gather-for-moscow-election-protest/?utm_source=RSS_Feed&utm_medium=RSS,post_hanoi,russia,2025-12-12 17:32:42
comn9b,"Russian authorities keep cracking down on protesters as the number of arrests steadily grows. Another student, Daniil Konon (22yo) from Bauman Moscow State Technical Institute, was apprehended and accused of coordinating riots.",,ThickOpening,news,1,0,1565466266,/r/news/comments/comn9b/russian_authorities_keep_cracking_down_on/,https://therussianreader.com/2019/08/05/skovoroda-moscow-riot-case/,post_hanoi,russia,2025-12-12 17:32:42
coju1g,Moscow acknowledges mysterious rocket explosion involved nuclear workers,,Ph_Speed,news,625,56,1565452933,/r/news/comments/coju1g/moscow_acknowledges_mysterious_rocket_explosion/,https://www.reuters.com/article/us-russia-blast-deaths/moscow-acknowledges-mysterious-rocket-explosion-involved-nuclear-workers-idUSKCN1UZ2FS?feedType=RSS&feedName=worldNews&utm_source=feedburner&utm_medium=feed&utm_campaign=Feed%3A+Reuters%2FworldNews+%28Reuters+World+News%29,post_hanoi,russia,2025-12-12 17:32:42
cojodj,Moscow Rally: Thousands Protest Barred Election Candidates,[deleted],[deleted],news,1,0,1565452164,/r/news/comments/cojodj/moscow_rally_thousands_protest_barred_election/,https://www.usatoday.com/story/news/world/2019/08/10/moscow-rally-thousands-protest-barred-election-candidates/1975009001/,post_hanoi,russia,2025-12-12 17:32:42
cojnau,Moscow Rally: Thousands Protest Barred Election Candidated,[deleted],[deleted],news,1,0,1565452008,/r/news/comments/cojnau/moscow_rally_thousands_protest_barred_election/,https://www.usatoday.com/story/news/world/2019/08/10/moscow-rally-thousands-protest-barred-election-candidates/1975009001/,post_hanoi,russia,2025-12-12 17:32:42
coitqw,The Protests That Have Rocked Moscow For Weeks – Explained For Brits,[deleted],[deleted],news,1,0,1565447906,/r/news/comments/coitqw/the_protests_that_have_rocked_moscow_for_weeks/,https://m.huffingtonpost.co.uk/amp/entry/russia-protests-moscow_uk_5d4d4c06e4b01e44e478af60/,post_hanoi,russia,2025-12-12 17:32:42
coig3l,"Nearly 50,000 Protest for Fair Elections in Moscow",,JohhWard,news,8531,468,1565445919,/r/news/comments/coig3l/nearly_50000_protest_for_fair_elections_in_moscow/,https://www.themoscowtimes.com/2019/08/10/nearly-50000-protest-for-fair-elections-in-moscow-a66798,post_hanoi,russia,2025-12-12 17:32:42
codzl2,"Kashmir: Moscow for settling issue as per Shimla, Lahore settlements",,worldnewsheadline247,news,1,0,1565414467,/r/news/comments/codzl2/kashmir_moscow_for_settling_issue_as_per_shimla/,https://internationalnewsheadline.com/kashmir-moscow-for-settling-issue-as-per-shimla/,post_hanoi,russia,2025-12-12 17:32:42
cobxy6,Flight Records Show Italy’s Deputy Prime Minister Salvini's Aide Made A Lot Of Mysterious Trips To Moscow Around The Time Of The Secret Oil Deal Meeting,,babyyourearichman111,news,1,0,1565402227,/r/news/comments/cobxy6/flight_records_show_italys_deputy_prime_minister/,"https://img.buzzfeed.com/buzzfeed-static/static/2019-08/8/14/asset/badcaa92441a/sub-buzz-2986-1565273272-1.jpg?crop=2721:1425;279,107",post_hanoi,russia,2025-12-12 17:32:42
cnmncb,A short-term spike in radiation levels was recorded after a rocket engine exploded during a test in Russia. Moscow’s defence ministry said two were killed and four others wounded after the blast at a military shooting range in the northwestern region of Arkhangelsk.,,babyyourearichman111,news,1,0,1565275033,/r/news/comments/cnmncb/a_shortterm_spike_in_radiation_levels_was/,https://static.independent.co.uk/s3fs-public/thumbnails/image/2019/08/08/14/Arkhangelsk.jpg,post_hanoi,russia,2025-12-12 17:32:42
cndout,"New details suggest Moscow’s interference in the U.S. election may have been more extensive than thought, experts say.",,AnnieMatter,news,1,0,1565221980,/r/news/comments/cndout/new_details_suggest_moscows_interference_in_the/,https://foreignpolicy.com/2019/08/06/the-mystery-man-in-the-senate-russia-report-embassy-who-is-tarantsov/,post_hanoi,russia,2025-12-12 17:32:42
cn4yrw,Authorities Jammed Moscow’s Mobile Internet During Opposition Protests – NGO - The Moscow Times,,CJBill,news,387,16,1565179798,/r/news/comments/cn4yrw/authorities_jammed_moscows_mobile_internet_during/,https://www.themoscowtimes.com/2019/08/07/authorities-jammed-moscows-mobile-internet-during-opposition-protests-ngo-a66741,post_hanoi,russia,2025-12-12 17:32:42
cmbwat,Germany calls on Russia to release Moscow protesters,,121kiwi,news,1,0,1565016491,/r/news/comments/cmbwat/germany_calls_on_russia_to_release_moscow/,https://121private.home.blog/2019/08/05/germany-calls-on-russia-to-release-moscow-protesters-4/,post_hanoi,russia,2025-12-12 17:32:42
cm30sm,Germany calls on Russia to release Moscow protesters,,121kiwi,news,1,0,1564960127,/r/news/comments/cm30sm/germany_calls_on_russia_to_release_moscow/,https://121private.home.blog/2019/08/04/germany-calls-on-russia-to-release-moscow-protesters-2/,post_hanoi,russia,2025-12-12 17:32:42
clvp2a,Germany urges Russia to swiftly release Moscow protesters,,121kiwi,news,1,0,1564921112,/r/news/comments/clvp2a/germany_urges_russia_to_swiftly_release_moscow/,https://121private.home.blog/2019/08/04/germany-urges-russia-to-swiftly-release-moscow-protesters/,post_hanoi,russia,2025-12-12 17:32:42
clr0pt,Rammstein band members kiss onstage in Moscow in support of LGBTQ rights,,121kiwi,news,1,0,1564884552,/r/news/comments/clr0pt/rammstein_band_members_kiss_onstage_in_moscow_in/,https://121private.home.blog/2019/08/04/rammstein-band-members-kiss-onstage-in-moscow-in-support-of-lgbtq-rights-10/,post_hanoi,russia,2025-12-12 17:32:42
clppz4,Russian police detain nearly 700 in opposition crackdown in Moscow,,babyyourearichman111,news,1,0,1564876769,/r/news/comments/clppz4/russian_police_detain_nearly_700_in_opposition/,https://s2.reutersmedia.net/resources/r/?m=02&amp;d=20190803&amp;t=2&amp;i=1415056991&amp;w=1200&amp;r=LYNXNPEF720G4,post_hanoi,russia,2025-12-12 17:32:42
cll9hl,"Moscow police use force to end election protest, arrest 600",,The_Real_Twisted,news,138,21,1564852859,/r/news/comments/cll9hl/moscow_police_use_force_to_end_election_protest/,https://apnews.com/b0d813694cce4a6f90b4998339ea197e,post_hanoi,russia,2025-12-12 17:32:42
cl78a4,Historic Arms Control Treaty Ends With Washington And Moscow Blaming Each Other,,pssyched,news,1,0,1564767265,/r/news/comments/cl78a4/historic_arms_control_treaty_ends_with_washington/,https://www.npr.org/2019/08/02/747525453/historic-arms-control-treaty-ends-with-washington-and-moscow-blaming-each-other?utm_medium=social&utm_term=nprnews&utm_campaign=npr&utm_source=facebook.com,post_hanoi,russia,2025-12-12 17:32:42
e9a3h4,It Couldn’t Be Any Clearer That Trump Serves the Kremlin,,NotaNotSee,news,1,0,1576085315,/r/news/comments/e9a3h4/it_couldnt_be_any_clearer_that_trump_serves_the/,https://washingtonmonthly.com/2019/12/11/it-couldnt-be-any-clearer-that-trump-serves-the-kremlin/,post_hanoi,russia,2025-12-12 17:32:42
e570s1,Senate panel looked into Ukraine interference and found no evidence that Ukraine waged a top-down interference campaign akin to the Kremlin’s efforts to help Trump win in 2016.,[deleted],[deleted],news,1,0,1575326862,/r/news/comments/e570s1/senate_panel_looked_into_ukraine_interference_and/,https://www.politico.com/news/2019/12/02/senate-panel-ukraine-election-interference-074796,post_hanoi,russia,2025-12-12 17:32:42
dy7je6,Russian internet giant grants veto powers to Kremlin-linked body,,sajidkhan007,news,1,0,1574103371,/r/news/comments/dy7je6/russian_internet_giant_grants_veto_powers_to/,https://www.google.com/amp/s/amp.theguardian.com/world/2019/nov/18/russian-internet-giant-yandex-grants-veto-powers-kremlin-linked-body,post_hanoi,russia,2025-12-12 17:32:42
dr9z0k,Maria Butina: The Russian accused of trying to influence U.S. policies for the Kremlin,,feelthepress,news,0,5,1572829414,/r/news/comments/dr9z0k/maria_butina_the_russian_accused_of_trying_to/,https://www.cbsnews.com/amp/news/maria-butina-interview-full-transcript-watch-video-lesley-stahl-60-minutes-exclusive/?__twitter_impression=true,post_hanoi,russia,2025-12-12 17:32:42
dlyyz5,"If Kurds fail to withdraw, they will be crushed by Turkish military machine, Kremlin warns",[deleted],[deleted],news,1,0,1571835659,/r/news/comments/dlyyz5/if_kurds_fail_to_withdraw_they_will_be_crushed_by/,https://tass.com/politics/1084689,post_hanoi,russia,2025-12-12 17:32:42
dd5wqb,"Kremlin Media on Greta Thunberg: “An Illiterate, Fanatic Messiah” - EU vs Disinformation",,vigilant_info,news,1,0,1570187514,/r/news/comments/dd5wqb/kremlin_media_on_greta_thunberg_an_illiterate/,http://vigilantinfo.net/analytics/kremlin-media-on-greta-thunberg-an-illiterate-fanatic-messiah-eu-vs-disinformation/,post_hanoi,russia,2025-12-12 17:32:42
dbjn78,Russia says Trump can't release phone calls without Kremlin permission,,MobsCanParry,news,1,0,1569883286,/r/news/comments/dbjn78/russia_says_trump_cant_release_phone_calls/,https://www.nbcnews.com/politics/donald-trump/russia-says-trump-can-t-release-phone-calls-without-kremlin-n1060551,post_hanoi,russia,2025-12-12 17:32:42
dbes0h,"Release of Trump-Putin transcripts needs Russian approval, Kremlin says - The Guardian",,jameskarl910,news,1,0,1569863638,/r/news/comments/dbes0h/release_of_trumpputin_transcripts_needs_russian/,https://www.theguardian.com/world/2019/sep/30/trump-putin-conversations-transcripts-russian-permission,post_hanoi,russia,2025-12-12 17:32:42
dbd89t,Kremlin says disclosure of Trump-Putin phone calls would need Russian consent - Reuters,,jameskarl910,news,1,0,1569857320,/r/news/comments/dbd89t/kremlin_says_disclosure_of_trumpputin_phone_calls/,https://www.reuters.com/article/us-usa-trump-whistleblower-kremlin/kremlin-says-disclosure-of-trump-putin-phone-calls-would-need-russian-consent-idUSKBN1WF1ET,post_hanoi,russia,2025-12-12 17:32:42
dbd4r5,Kremlin says disclosure of Trump-Putin phone calls would need Russian consent - Reuters,,[deleted],news,1,0,1569856929,/r/news/comments/dbd4r5/kremlin_says_disclosure_of_trumpputin_phone_calls/,https://www.reuters.com/article/us-usa-trump-whistleblower-kremlin-idUSKBN1WF1ET?fbclid=IwAR2x6QS80VuKjtsvuXqB4yAslBVP6oi_oKmXdEJ4oORBjhDyQxWMHIlMS5s,post_hanoi,russia,2025-12-12 17:32:42
daqeam,NYTimes: Kremlin Says It Hopes Putin’s Calls With Trump Won’t Be Made Public,,Firewooodydaddy18899,news,1,0,1569729913,/r/news/comments/daqeam/nytimes_kremlin_says_it_hopes_putins_calls_with/,https://www.nytimes.com/2019/09/27/world/europe/trump-putin-russia-calls.html,post_hanoi,russia,2025-12-12 17:32:42
da8j28,Giuliani cancels paid appearance next week at Kremlin-backed conference,,PrincessRosella,news,1,0,1569628106,/r/news/comments/da8j28/giuliani_cancels_paid_appearance_next_week_at/,https://www.washingtonpost.com/politics/giuliani-set-to-make-paid-appearance-next-week-at-kremlin-backed-conference/2019/09/27/a15ab242-e133-11e9-8dc8-498eabc129a0_story.html?utm_source=reddit.com,post_hanoi,russia,2025-12-12 17:32:42
da7uv6,Giuliani cancels paid appearance next week at Kremlin-backed conference - The Washington Post,,jameskarl910,news,1,0,1569624626,/r/news/comments/da7uv6/giuliani_cancels_paid_appearance_next_week_at/,https://www.washingtonpost.com/politics/giuliani-set-to-make-paid-appearance-next-week-at-kremlin-backed-conference/2019/09/27/a15ab242-e133-11e9-8dc8-498eabc129a0_story.html,post_hanoi,russia,2025-12-12 17:32:42
da1pob,Kremlin says it hopes US wouldn't release calls between Trump and Putin calls - USA TODAY,,jameskarl910,news,1,0,1569596751,/r/news/comments/da1pob/kremlin_says_it_hopes_us_wouldnt_release_calls/,https://www.usatoday.com/story/news/world/2019/09/27/impeachment-russia-hopes-us-doesnt-release-trump-putin/3784764002/,post_hanoi,russia,2025-12-12 17:32:42
da1po1,Kremlin says it hopes U.S. won't release details of Putin-Trump calls - Reuters,,jameskarl910,news,1,0,1569596750,/r/news/comments/da1po1/kremlin_says_it_hopes_us_wont_release_details_of/,https://www.reuters.com/article/us-usa-trump-whistleblower-kremlin/kremlin-says-it-hopes-us-wont-release-details-of-putin-trump-calls-idUSKBN1WC11D,post_hanoi,russia,2025-12-12 17:32:42
d9zlpr,"Kremlin says it hopes U.S. would not release Trump-Putin calls, like it did with Ukraine - NBCNews.com",,jameskarl910,news,1,0,1569586836,/r/news/comments/d9zlpr/kremlin_says_it_hopes_us_would_not_release/,https://www.nbcnews.com/news/world/kremlin-says-it-hopes-u-s-would-not-release-trump-n1059446,post_hanoi,russia,2025-12-12 17:32:42
d6gbpr,Russia arrests shaman who vowed to banish Putin from the Kremlin,,tre3211,news,157,29,1568909804,/r/news/comments/d6gbpr/russia_arrests_shaman_who_vowed_to_banish_putin/,https://uk.reuters.com/article/uk-russia-politics-shaman/russia-arrests-shaman-who-vowed-to-banish-putin-from-the-kremlin-idUKKBN1W426A,post_hanoi,russia,2025-12-12 17:32:42
d4g7ra,Putin builds war chest as Kremlin digs in for the next crisis,,121kiwi,news,1,0,1568523771,/r/news/comments/d4g7ra/putin_builds_war_chest_as_kremlin_digs_in_for_the/,https://121private.home.blog/2019/09/15/putin-builds-war-chest-as-kremlin-digs-in-for-the-next-crisis-2/,post_hanoi,russia,2025-12-12 17:32:42
d2wh4c,CIA slams CNN’s ‘misguided’ and ‘simply false’ reporting on alleged CIA spy’s extraction from kremlin,[deleted],[deleted],news,1,0,1568233832,/r/news/comments/d2wh4c/cia_slams_cnns_misguided_and_simply_false/,https://www.google.com/amp/s/www.foxnews.com/politics/cia-slams-faulty-cnn-narrative-slams-misguided-reporting-on-russian-double-agents-alleged-exfiltration.amp,post_hanoi,russia,2025-12-12 17:32:42
d290at,CIA slams CNN's 'misguided' and 'simply false' reporting on alleged CIA spy's extraction from Kremlin,[deleted],[deleted],news,0,0,1568128754,/r/news/comments/d290at/cia_slams_cnns_misguided_and_simply_false/,https://www.reddit.com/r/news/comments/d28zt4/cia_slams_cnns_misguided_and_simply_false/,post_hanoi,russia,2025-12-12 17:32:42
d28zt4,CIA slams CNN's 'misguided' and 'simply false' reporting on alleged CIA spy's extraction from Kremlin,[deleted],[deleted],news,10,79,1568128699,/r/news/comments/d28zt4/cia_slams_cnns_misguided_and_simply_false/,https://www.foxnews.com/politics/cia-slams-faulty-cnn-narrative-slams-misguided-reporting-on-russian-double-agents-alleged-exfiltration,post_hanoi,russia,2025-12-12 17:32:42
d28a5u,Holes poked in CNN report blaming Trump for alarm that led to extraction of Kremlin informant,[deleted],[deleted],news,1,0,1568125707,/r/news/comments/d28a5u/holes_poked_in_cnn_report_blaming_trump_for_alarm/,https://www.washingtonexaminer.com/news/holes-poked-in-cnn-report-blaming-trump-for-alarm-that-led-to-extraction-of-kremlin-informant,post_hanoi,russia,2025-12-12 17:32:42
cufnjl,Kremlin dismisses doctors' complaints they were exposed to radiation after blast - Doctors who treated the victims of a military test explosion have accused Russian authorities of carelessly exposing them to radiation and then forcing them to keep silent.,,babyyourearichman111,news,1,0,1566575174,/r/news/comments/cufnjl/kremlin_dismisses_doctors_complaints_they_were/,https://www.telegraph.co.uk/content/dam/news/2019/08/22/TELEMMGLPICT000206440815-xlarge_trans_NvBQzQNjv4BqeK8ehqBZJSTiVTgumtathbH8AD1LYTdJsoz8pklmEgw.jpeg,post_hanoi,russia,2025-12-12 17:32:42
cq87j4,"Kremlin says WTO’s existence would be in doubt if U.S., others left",,121kiwi,news,1,0,1565781129,/r/news/comments/cq87j4/kremlin_says_wtos_existence_would_be_in_doubt_if/,https://121private.home.blog/2019/08/14/kremlin-says-wtos-existence-would-be-in-doubt-if-u-s-others-left/,post_hanoi,russia,2025-12-12 17:32:42
cq78pb,"'Accidents happen,' says Kremlin as it breaks silence on suspected nuclear missile explosion",,tosil,news,408,71,1565774573,/r/news/comments/cq78pb/accidents_happen_says_kremlin_as_it_breaks/,https://www.cnn.com/2019/08/13/europe/russia-missile-technology-kremlin-intl/index.html,post_hanoi,russia,2025-12-12 17:32:42
cq2mcl,"'Accidents happen,' says Kremlin as it breaks silence on suspected nuclear missile explosion",,Horror_Mango,news,1,0,1565745580,/r/news/comments/cq2mcl/accidents_happen_says_kremlin_as_it_breaks/,https://www-m.cnn.com/2019/08/13/europe/russia-missile-technology-kremlin-intl/index.html?utm_source=fark&utm_medium=website&utm_content=link&ICID=ref_fark&r=https%3A%2F%2Fm.fark.com%2Fgoto%2F10523197%2Fwww.cnn.com%2F2019%2F08%2F13%2Feurope%2Frussia-missile-technology-kremlin-intl%2Findex.html%253Futm_source%253Dfark,post_hanoi,russia,2025-12-12 17:32:42
cq0twy,A Kremlin-Linked Firm Invested Millions in Kentucky. Were They After More Than Money?,,121kiwi,news,1,0,1565736635,/r/news/comments/cq0twy/a_kremlinlinked_firm_invested_millions_in/,https://121private.home.blog/2019/08/13/a-kremlin-linked-firm-invested-millions-in-kentucky-were-they-after-more-than-money/,post_hanoi,russia,2025-12-12 17:32:42
cpu2a0,Kremlin Says It Is Winning Arms Race Against U.S. Despite Rocket Accident,,NewsBOTNetwork,news,1,0,1565707285,/r/news/comments/cpu2a0/kremlin_says_it_is_winning_arms_race_against_us/,https://www.youtube.com/watch?v=SASEd7y4JmI,post_hanoi,russia,2025-12-12 17:32:42
cl69e5,Kremlin critic Alexei Navalny says he was poisoned in custody - Jailed Russian opposition leader Alexei Navalny has filed an official complaint saying he was poisoned while in jail on Sunday. Five people have been detained for organizing last weekend's protests in Moscow.,,babyyourearichman111,news,1,0,1564762787,/r/news/comments/cl69e5/kremlin_critic_alexei_navalny_says_he_was/,https://www.dw.com/image/49836028_304.jpg,post_hanoi,russia,2025-12-12 17:32:42
cj0oej,"Kremlin critic Alexei Navalny hospitalized with ""acute allergic reaction"" after being detained",,babyyourearichman111,news,1,0,1564344451,/r/news/comments/cj0oej/kremlin_critic_alexei_navalny_hospitalized_with/,https://cdn.cnn.com/cnnnext/dam/assets/180123115306-alexey-navalny-january-2018-super-tease.jpg,post_hanoi,russia,2025-12-12 17:32:42
cgmaly,Trump’s New Favorite Channel Employs Kremlin-Paid Journalist,,it-is-sandwich-time,news,1,0,1563846520,/r/news/comments/cgmaly/trumps_new_favorite_channel_employs_kremlinpaid/,https://www.thedailybeast.com/oan-trumps-new-favorite-channel-employs-kremlin-paid-journalist,post_hanoi,russia,2025-12-12 17:32:42
ccmhy1,Pro-Kremlin TV host's proposed attack against Kazakstan riles citizens,[deleted],[deleted],news,26,1,1563001817,/r/news/comments/ccmhy1/prokremlin_tv_hosts_proposed_attack_against/,http://central.asia-news.com/en_GB/articles/cnmi_ca/features/2019/07/05/feature-01,post_hanoi,russia,2025-12-12 17:32:42
cc6mmm,Pro-Kremlin TV host's proposed attack against Kazakstan riles citizens,[deleted],[deleted],news,10,0,1562908964,/r/news/comments/cc6mmm/prokremlin_tv_hosts_proposed_attack_against/,http://central.asia-news.com/en_GB/articles/cnmi_ca/features/2019/07/05/feature-01,post_hanoi,russia,2025-12-12 17:32:42
c8bl1z,Vladimir Putin's urgent meeting with defence chief at Kremlin as Mike Pence's Air Force 2 plane turns back to DC for 'emergency',,shortadamlewis,news,1,0,1562086194,/r/news/comments/c8bl1z/vladimir_putins_urgent_meeting_with_defence_chief/,https://www.thesun.co.uk/news/9421808/vladimir-putin-defence-mike-pence-air-force-washington/,post_hanoi,russia,2025-12-12 17:32:42
c86rf3,New Army Green Service Uniform Sighted At The Kremlin,,artyssg,news,0,3,1562056615,/r/news/comments/c86rf3/new_army_green_service_uniform_sighted_at_the/,http://soldiersystems.net/2019/07/02/new-army-green-service-uniform-sighted-at-the-kremlin/,post_hanoi,russia,2025-12-12 17:32:42
e8tw86,Zelensky besieged Lavrov at the summit in Paris,,YuriiYastrub,news,1,0,1575999857,/r/news/comments/e8tw86/zelensky_besieged_lavrov_at_the_summit_in_paris/,https://eto314.com/en/politics/2019/12/10/avakov-zelenskij-osadil-lavrova-na-sammite-v-parizhe/,post_hanoi,russia,2025-12-12 17:32:42
dqarew,"Al-Baghdadi was US ‘spawn’, his death is still an open question – Lavrov — RT World News",,SilentSpace,news,1,0,1572643940,/r/news/comments/dqarew/albaghdadi_was_us_spawn_his_death_is_still_an/,https://www.rt.com/news/472431-lavrov-al-baghdadi-us-spawn/,post_hanoi,russia,2025-12-12 17:32:42
dbnxdp,Sergey Lavrov (Russia) – Press Conference (27 September 2019),,troysanders006,news,1,0,1569903356,/r/news/comments/dbnxdp/sergey_lavrov_russia_press_conference_27/,https://www.youtube.com/watch?v=O-FMcVyMX_4&feature=share,post_hanoi,russia,2025-12-12 17:32:42
dhlqn0,"डेनियल मेदवेदेव ने जीता शंघाई मास्टर्स, फाइनल में अलेक्जेंडर ज्वेरेव को 6-4, 6-1 में हराया - Daniil Medvedev wins Shanghai Masters- TV9 Bharatvarsh",,bharatvarshtv9,news,1,0,1571028557,/r/news/comments/dhlqn0/डनयल_मदवदव_न_जत_शघई_मसटरस_फइनल_म_अलकजडर_जवरव_क_64/,https://www.tv9bharatvarsh.com/sports/shanghai-masters-daniil-medvedev-beats-alexander-zverev-in-final-for-title-113561.html,post_hanoi,russia,2025-12-12 17:32:42
d1ob1q,US Open 2019: Rafael Nadal beats Daniil Medvedev to win 19th Grand Slam title,,ariel25220,news,1,0,1568019367,/r/news/comments/d1ob1q/us_open_2019_rafael_nadal_beats_daniil_medvedev/,https://www.bbc.co.uk/sport/tennis/49629579,post_hanoi,russia,2025-12-12 17:32:42
d1khfl,Rafael Nadal Defeats Daniil Medvedev at U.S. Open Men's Singles Final 2019!,,streettvglobe,news,1,0,1567994575,/r/news/comments/d1khfl/rafael_nadal_defeats_daniil_medvedev_at_us_open/,https://www.streettvgists.com/rafael-nadal-defeats-daniil-medvedev-at-u-s-open-mens-singles-final-2019/?feed_id=167311&_unique_id=5d75b2ce08dd6,post_hanoi,russia,2025-12-12 17:32:42
d1k2n5,Rafael Nadal beats Daniil Medvedev for title,,kanchana071,news,1,0,1567992404,/r/news/comments/d1k2n5/rafael_nadal_beats_daniil_medvedev_for_title/,https://foxusalive.com/rafael-nadal-beats-daniil-medvedev-for-title/?utm_source=rss&utm_medium=rss&utm_campaign=rafael-nadal-beats-daniil-medvedev-for-title,post_hanoi,russia,2025-12-12 17:32:42
d1aa34,US Open 2019: Rafael Nadal faces Daniil Medvedev in bid for 19th Grand Slam title,,ariel25220,news,1,0,1567945586,/r/news/comments/d1aa34/us_open_2019_rafael_nadal_faces_daniil_medvedev/,https://www.bbc.co.uk/sport/tennis/49624253,post_hanoi,russia,2025-12-12 17:32:42
d0oio1,Daniil Medvedev tops Grigor Dimitrov in semifinal,,kanchana071,news,1,0,1567812979,/r/news/comments/d0oio1/daniil_medvedev_tops_grigor_dimitrov_in_semifinal/,https://foxusalive.com/daniil-medvedev-tops-grigor-dimitrov-in-semifinal/?utm_source=rss&utm_medium=rss&utm_campaign=daniil-medvedev-tops-grigor-dimitrov-in-semifinal,post_hanoi,russia,2025-12-12 17:32:42
czrgyg,Daniil Medvedev is more New York than most New Yorkers,,kanchana071,news,1,0,1567634236,/r/news/comments/czrgyg/daniil_medvedev_is_more_new_york_than_most_new/,https://foxusalive.com/daniil-medvedev-is-more-new-york-than-most-new-yorkers/?utm_source=rss&utm_medium=rss&utm_campaign=daniil-medvedev-is-more-new-york-than-most-new-yorkers,post_hanoi,russia,2025-12-12 17:32:42
